BEGIN TRANSACTION;
CREATE TABLE IF NOT EXISTS "fio_juvenile" (
	"Field Contact #"	TEXT,
	"Contact Date"	TEXT,
	"Contact Officer"	TEXT,
	"Contact Officer Name"	TEXT,
	"Supervisor Name"	TEXT,
	"Street Address"	TEXT,
	"City"	TEXT,
	"State"	TEXT,
	"Zip Code"	TEXT,
	"Stop Duration"	TEXT,
	"Circumstance"	TEXT,
	"Basis"	TEXT,
	"Vehicle Year"	TEXT,
	"Vehicle State"	TEXT,
	"Vehicle Model"	TEXT,
	"Vehicle Make"	TEXT,
	"Vehicle Color"	TEXT,
	"Vehicle Style"	TEXT,
	"Vehicle Type"	TEXT,
	"Vehicle Searched"	TEXT,
	"Key Situation"	TEXT,
	"Narrative"	TEXT,
	"Frisked"	TEXT,
	"Summons Issued"	TEXT,
	"Weather"	TEXT,
	"date"	TEXT,
	"time"	TEXT,
	"year"	INT,
	"month"	INT,
	"day"	INT
);
INSERT INTO "fio_juvenile" VALUES ('FC22005324','12/6/2022 16:13','FLAHERTY, PATRICK','FLAHERTY, PATRICK','RICHARD CASALLAS','SARATOGA ST','EAST BOSTON','MA','2128',NULL,'Observed','Encounter',NULL,'MA','FORTE',NULL,'BLUE','4 Door, Sedan','Passenger Car/ Automobile','No/Null','Juvenile',NULL,'No/Null','No/Null',NULL,'12/6/2022','16:13',2022,12,6);
INSERT INTO "fio_juvenile" VALUES ('FC23000097','1/4/2023 15:29','Monteiro, Miguel','Monteiro, Miguel','JOHN BURROWS',NULL,'DORCHESTER','MA','2126',NULL,'Encountered','Intel',NULL,NULL,NULL,NULL,NULL,NULL,NULL,'No/Null','School, Body Worn Camera, Juvenile','Officers responding to an assault & battery on a teacher at the Young Achievers School were made aware that a group of juveniles possibly involved in the incident had boarded the #28 Bus (XXX) inbound on Blue Hill Ave.

Officers observed this bus at the intersection of Morton Street and Blue Hill Avenue and conducted a stop. Multiple BPD units as well as Transit PD responded to the scene as well. 

An employee of the Young Achievers arrived on scene for identification purposes. At the direction of Lieutenant Detective Fitzgerald (CA81), officers FIO''d four female juveniles after the school employee observed those onboard MBTA bus #XXX.XXX - DOB: XX/XX/XXXXXXX - DOB: XX/XX/XXXX
XXX DOB: XX/XX/XXXXXXX - DOB: XX/XX/XXXX

C112D Duggan/Monteiro','No/Null','No/Null',NULL,'1/4/2023','15:29',2023,1,4);
INSERT INTO "fio_juvenile" VALUES ('FC23000111','1/4/2023 10:09','CORREIA, JOSE','CORREIA, JOSE','DANIEL TRACEY',NULL,'DORCHESTER','MA','2122',NULL,'Stopped','Probable Cause','2012','MA','OTHER: grand cherokee',NULL,'GRAY','Other: suv','Passenger Car/ Automobile','No/Null','Auto Investigator, Body Worn Camera, Juvenile, Gang','About 10:10PM Officers Correia and Lopes in the HK01F conducted a traffic stop of a stolen motor vehicle (MA/reg. XXX2012 Blue Jeep Grand Cherokee) at Geneva Avenue and Homes Avenue which resulted in an arrest of the operator XXX D.O.B. XX/XX/XXXX
Front seat passenger XXX, D.O.B. XX/XX/XXXX
Backseat passenger (XXX, D.O.B. XX/XX/XXXX
Backseat passenger (XXX, D.O.B. XX/XX/XXXXactive member ofXXX.

All parties and the vehicle searched to negative results.

HK01F (Correia and Lopes).','No/Null','No/Null',NULL,'1/4/2023','10:09',2023,1,4);
INSERT INTO "fio_juvenile" VALUES ('FC23000230','1/10/2023 23:03','HOLMES, KYLE','HOLMES, KYLE','RAFAEL RODRIGUEZ',NULL,'BOSTON','MA','2119',NULL,'Stopped','Probable Cause','2021','MA','OTHER: wrangler',NULL,'BLACK','Other: suv','Passenger Car/ Automobile','No/Null','Body Worn Camera, Juvenile','Officers observed a male and female hastily exit the driver/passenger doors of MA REG: XXXand swap seats while staring wide-eyed at Officers as they drove by in their unmarked cruiser. The vehicle was idling at the Shell Gas Station at XXXBlue Hill Ave away from the pumps towards the exit. A query revealed the vehicle STOLEN. Officers immediately stopped and removed the occupants. The occupants were frisked and the vehicle towed. XXXwas dropped off atXXXFernboro St #XXX, XXXwas transported to District XXX to be picked up by a relative.XXX arrived and stated he was the step-father but refused to bring XXXhome. He eventually agreed to bring him home and was verbally berating XXXas they exited the station. Once outside, in the presence of Officers, XXXphysically assaulted XXXHe was placed in custody and walked into B-XXX booking. XXXmade multiple aggressive threats towards Officers trying to fight them and alleging he will tear the station apart. He claimed to be a former XXX associate. 

XXXXX has previous reports of being in stolen vehicles and issues at the McCormack School.

XXX(a.k.a. XXXXX has previous reports of being in stolen vehicles, has been FIO''d atXXXFernboro St as well as being in the possession of an airsoft rifle.

XXXXXXis a registered Level 3 Sex Offender

BK01F/BK03F (Kerin, O''Brien, J, McGuire) B616F (Holmes)','No/Null','No/Null',NULL,'1/10/2023','23:03',2023,1,10);
INSERT INTO "fio_juvenile" VALUES ('FC23000550','1/28/2023 0:00','Vraibel, Matthew','Vraibel, Matthew','DANIEL TRACEY','BULLARD ST','DORCHESTER','MA','2121',NULL,'Encountered','Encounter','2013','MA','MDX',NULL,'GRAY',NULL,'Suv (sport Utility Vehicle)','No/Null','Body Worn Camera, Juvenile','R/C for person with a gun atXXX Bullard St.

Officers encountered XXX (Multiple firearm charges and ActiveXXX) who stated he observedXXX, XXX and XXX break into his vehicle (MA Reg XXXXX pat frisked for weapons to no avail.

XXX and XXXadmitted to officers to breaking into two vehicles near XXXRossetter St, which also belonged to XXXwith spark plugs around 05:00am ON 01/27/2023. 

H102A (Vraibel/Madden).','No/Null','No/Null',NULL,'1/28/2023','0:00',2023,1,28);
INSERT INTO "fio_juvenile" VALUES ('FC23000642','2/1/2023 16:36','DIPIRO, MATTHEW','DIPIRO, MATTHEW','MICHAEL LOCKE','GARFIELD AVENUE','BOSTON','MA','2136',NULL,'Encountered','Intel','2011','MA','TSX',NULL,'BLACK','4 Door, Sedan','Passenger Car/ Automobile','No/Null','Juvenile, Gang','MA Reg XXXparked in front of XXX Garfield Ave. 
Operator - XXX
Front Passenger - XXX (Fairmount)
Rear Passenger - XXX (Fairmount) 

LK01F (DiPiro/McNulty)','No/Null','No/Null',NULL,'2/1/2023','16:36',2023,2,1);
INSERT INTO "fio_juvenile" VALUES ('FC23000660','2/3/2023 0:00','Murray, Terrence','Murray, Terrence','JOHN BURROWS',NULL,'BOSTON','MA','2126',NULL,'Stopped','Encounter','2022','NY','CHARGER',NULL,'BLACK','4 Door, Sedan','Passenger Car/ Automobile','No/Null','Body Worn Camera, Juvenile, Gang','Traffic Stop 89/9 (Rental) NY Reg XXXat Walk Hill St. and American Legion Hwy.

OP- XXX DOBXX/XX/XXXX

Front passenger-unidentified female

Rear passenger XXXXX/XX/XXXX

Officer''s did note a calm, cordial and non-confrontational demeanor from both XXX and XXXwhich is a change from their normal animated, loud and confrontational behavior with officer''s during past interactions which are referenced in previous FIOE''s. 

In the back window officers also observed a black XXXhat. 

FIOE for intel 

Murray/Shetrawski C113F','No/Null','No/Null',NULL,'2/3/2023','0:00',2023,2,3);
INSERT INTO "fio_juvenile" VALUES ('FC23000824','2/13/2023 20:16','Hiltunen, Michael','Hiltunen, Michael','ZACHARY CROSSEN','WASHINGTON ST','BOSTON','MA','2110',NULL,'Stopped','Probable Cause',NULL,NULL,NULL,NULL,NULL,NULL,NULL,'No/Null','Juvenile','Officers responded to a radio call for a removal inside the Basement of Macy''s 450 Washington Street, Downtown Boston. 

Officers were directed downstairs by Macys staff for kids playing with store merchandise including several knives. 

At that time Officers identified the following individuals: XXX (DOB: XX/XX/XXXXXXXXX/XX/XXXX
XXX(DOB: XX/XX/XXXXXXX XX/XX/XXXX
XXX (DOB: XX/XX/XXXX

XXX(DOB: XX/XX/XXXX
XXX XX/XX/XXXX
Due to the Macy''s staff mention of various knives, belonging to the store, all individuals were pat frisked during which officers recovered two kitchen knives from XXX andXXX. At that time, Officers returned the knives to Macy''s staff.

Further CJIS inquiry revealed that XXX brandished a knife during an armed Robbery that took place in XXXHuntington Street, Back Bay. 

FIO for Intel/ Officer Safety 

A102F (Hiltunen/ Marchand)','No/Null','No/Null',NULL,'2/13/2023','20:16',2023,2,13);
INSERT INTO "fio_juvenile" VALUES ('FC23000932','2/19/2023 16:30','Marchand, Brian','Marchand, Brian','CHARLES CELLUCCI','TREMONT ST','BOSTON','MA','2111',NULL,'Observed','Intel',NULL,NULL,NULL,NULL,NULL,NULL,NULL,'No/Null','Juvenile','Officers were driving on when they observed XXX in front of XXXTremont Street, Boston. XXXmade eye contact with officers and immediately departed the area.

XXXwas a suspect in a stabbing that occurred on 01/15/23. (I232003918)- the case remains open.

FIO for officer safety and to further associate with Tremont Street/Winter Street.

AK01F (Marchand/Hiltunen)','No/Null','No/Null',NULL,'2/19/2023','16:30',2023,2,19);
INSERT INTO "fio_juvenile" VALUES ('FC23000934','2/20/2023 0:15','DIPIRO, MATTHEW','DIPIRO, MATTHEW','MICHAEL LOCKE','AMERICAN LEGION HWY','ROSLINDALE','MA','2131',NULL,'Stopped','Encounter',NULL,NULL,NULL,NULL,NULL,NULL,NULL,'No/Null','Body Worn Camera, Juvenile','CD19 of the staircases of the towers of Canterbury Place XXXCanterbury St, XXX American Legion) While walking the staircases of XXXofficers encountered XXX playing music from a large speaker on the landing between the 7th and 6th floor. During the encounter XXXattempted to identify himself as XXX" 

All parties were advised to leave the building and not to return.

LK01 (DiPiro/McNulty)','No/Null','No/Null',NULL,'2/20/2023','0:15',2023,2,20);
INSERT INTO "fio_juvenile" VALUES ('FC23000941','2/19/2023 17:49','Marchand, Brian','Marchand, Brian','CHARLES CELLUCCI',NULL,'BOSTON','MA','2110',NULL,'Stopped','Probable Cause',NULL,NULL,NULL,NULL,NULL,NULL,NULL,'No/Null','Body Worn Camera, Juvenile','Officers responded to a report for a group of juveniles causing a disturbance and assaulting bystanders at Franklin St. & Washington St.

Four (4) juveniles were arrested for ADW after being stopped at Franklin St. & Hawley Street.

XXX(DOB XX/XX/XXXX
JXXX (DOB XX/XX/XXXX
XXX (DOB XX/XX/XXXX
XXX (DOB XX/XX/XXXX
Further investigation revealed XXXwas arrested for ADW after a Person W/ A Gun call in C-6 on 02/13/22. The firearm was later identified as a Pellet Gun.

FIO for Officer Safety and to associated with Downtown Juvenile activity.

AK01F (Marchand/Hiltunen)','No/Null','No/Null',NULL,'2/19/2023','17:49',2023,2,19);
INSERT INTO "fio_juvenile" VALUES ('FC23001038','2/25/2023 0:00','Murray, Terrence','Murray, Terrence','JAMES MOORE','NORFOLK STREET','BOSTON','MA','2124',NULL,'Stopped','Intel',NULL,NULL,NULL,NULL,NULL,NULL,NULL,'No/Null','Auto Investigator, Body Worn Camera, Juvenile','Stolen vehicle MA Reg XXXwas stopped at XXXNorfolk St Dorchester. 

Operator XX/XX/XXXX
Passenger XXX XX/XX/XXXX
PassengerXXXXX/XX/XXXX

XXX originally identified himself as XXXXX/XX/XXXX which he has previously used as an alias during past interactions with law enforcement. 

All three juveniles arrested and charged accordingly.

FIOE to associate ties between the three. 

C112F Murray/Shetrawski','No/Null','No/Null',NULL,'2/25/2023','0:00',2023,2,25);
INSERT INTO "fio_juvenile" VALUES ('FC23001057','2/26/2023 17:22','KENNEDY, JESSE','KENNEDY, JESSE','JOHN FITZGERALD',NULL,'BOSTON','MA','2124','110','Encountered','Intel',NULL,NULL,NULL,NULL,NULL,NULL,NULL,'No/Null','Body Worn Camera, Juvenile','Officers while on a Code 19 at Chez Vous located at XXXRhodes St, encountered the following individuals outside:

1)XXX DOB XX/XX/XXXX- prior Receiving Stolen M/V

2) XXX DOB XX/XX/XXXX- open B&E, multiple FIO''s in regard to stolen motor vehicles

3) XXX DOB XX/XX/XXXX
The individuals listed above were within a larger group of juveniles outside of Chez Vous, all of whom were cordial with Officers throughout their interaction. During the interaction, XXXmade statements bragging about being recently arrested in E5 while in a stolen motor vehicle (See I232015133). 

It should also be noted that XXXmade statements and hand gestures while speaking with Officers in regard to being "killers". XXXwas also referred to as XXXby other individuals in the group. Officer was able to capture the hand gestures on his bodycam.

FIO''d for Intel Purposes.

C113F (Kennedy / R. Adams)','No/Null','No/Null',NULL,'2/26/2023','17:22',2023,2,26);
INSERT INTO "fio_juvenile" VALUES ('FC23001063','2/27/2023 2:34','CALABRESE, SALVATORE','CALABRESE, SALVATORE','MICHAEL MCCARTHY',NULL,'DORCHESTER','MA','2124',NULL,'Stopped','Probable Cause','2017','MA','ACCORD',NULL,'GRAY','4 Door, Sedan','Passenger Car/ Automobile','No/Null','Body Worn Camera, Juvenile','About 2:34am on Monday 2/27/23 Officers conducted a traffic stop at Washington and Talbot in Dorchester for a stolen motor vehicle MA reg XXXgray 2017 Honda Accord. Officers arrested the driver St. Joe''s associate XXX XX/XX/XXXX(prior firearm) and charged him with Receiving Stolen Motor Vehicle and Operating After Suspended. 



CK02A - Calabrese, McCarty and Farley','No/Null','No/Null',NULL,'2/27/2023','2:34',2023,2,27);
INSERT INTO "fio_juvenile" VALUES ('FC23001183','3/4/2023 23:31','PANZAVECCHIA, STEFANIA','PANZAVECCHIA, STEFANIA','ZACHARY CROSSEN','WARREN STREET','BOSTON','MA','2129',NULL,'Stopped','Probable Cause',NULL,NULL,NULL,NULL,NULL,NULL,NULL,'No/Null','Juvenile','About 23:31 hours, March 04, 2023 officers of the YVSF conducted a m/v stop of a red scooter at XXXWarren St for Vals (Red light violation). Officers spoke with two juveniles later identified as XXX (operator) and XXX (passenger). Verbal warning issued.','No/Null','No/Null',NULL,'3/4/2023','23:31',2023,3,4);
INSERT INTO "fio_juvenile" VALUES ('FC23001240','3/8/2023 11:56','MUHAMMAD, SUNI','MUHAMMAD, SUNI','DANIEL TRACEY','DRAPER','DORCHESTER','MA','2125',NULL,'Stopped','Probable Cause',NULL,NULL,NULL,NULL,NULL,NULL,NULL,'No/Null','Body Worn Camera, Juvenile, Gang, Gun','About 11:56 A.M. Wednesday March 8, 2023 Youth Violence Strike Force Officers while conducting an on-going firearms investigation stopped active Morse St. associate XXX(DOB: XX/XX/XXXXwhich resulted in a firearm arrest at XXXDraper Street.

Present inside the residence was XXXmother, XXX XX/XX/XXXXand XXX(DOB: XX/XX/XXXXActive Morse associate, multiple F/A on BOP, currently on GPS monitoring). 

XXXwas placed under arrest for firearm(s) charges and transported to district C-11 for booking. See I232018026 for full report.



VK06 (S. Muhammad/S. Medrano/J. O''Brien)

MSP Troopers (B. Caccamo/R. Dugue/S. Hazelton)

VK05 (N. Bernazzani/M. Conley)

VK04 (A. Parham/R. Fullam/C. Hegerich/L. Capriles)

VK23 (E. McPherson/R. Schain/P. Sheehan)

VK804 (Det. S. Ridge)

VK808 (Det. B. Higgins)

VK809 (Det. J. Bowden)

VK901 (Sgt. Byrne)

VK981 (Sgt. Det. Romano)

VA01 (Lt. M. Assad)

MSP-G23 (Sgt. A. DaSilva)

Suffolk County Sherriff (Lt. A. Lopez)','No/Null','No/Null',NULL,'3/8/2023','11:56',2023,3,8);
INSERT INTO "fio_juvenile" VALUES ('FC23001312','3/12/2023 1:24','SULLIVAN, PATRICK','SULLIVAN, PATRICK','JAMES MOORE','WOODROW AVE','DORCHESTER','MA','2124','26','Stopped','Probable Cause',NULL,NULL,NULL,NULL,NULL,NULL,NULL,'No/Null','Body Worn Camera, Juvenile','At about 1:30AM on 03/12/23 officers responding to a family trouble at XXXWoodrow Avenue encountered XXXborn XX/XX/XXXXhiding in the stairwell. XXXhad turned 14 at midnight and was reported to have walked out after his mother told him he could not smoke marijuana. A CJIS query revealed seven active felony warrants for a variety of offenses. He was placed under arrest and booked without incident.','No/Null','No/Null',NULL,'3/12/2023','1:24',2023,3,12);
INSERT INTO "fio_juvenile" VALUES ('FC23001384','3/16/2023 20:43','LYNCH, PATRICK','LYNCH, PATRICK','JOHN BROWN','CENTRE ST','JAMAICA PLAIN','MA','2130',NULL,'Encountered','Probable Cause',NULL,NULL,NULL,NULL,NULL,NULL,NULL,'No/Null','Juvenile','About 8:43 PM on Thursday 03/16/2023 Officers Lynch and Copello in the J101F responded to a radio call for a Fight at XXXCentre St, Jamaica Plain.

As Officers were searching the area as well as the first-floor hallway, Officer Lynch observed a black female fitting the description of a Person of interest from a MV stolen out of XXXRiver St (See I#232017573). The BRIC sent out a flyer for "Identification Wanted" on 03/14/2023. Officer Lynch was able to recognize this female due to her pink hair that noticeably stands out as well as the ongoing motor vehicle thefts that have taken place in the recent weeks/months at Planet Fitness around the Boston area as well as in area E that have been sent out via department email. 

The female identified herself as XXX(DOB: XX/XX/XXXXOfficers could not find any information pertaining to the above info in Mark43 or CJIS.

After searching through Mark43 and using the tab under "relationships" Officers came across a picture as well as a name that matched the BRIC flyer''s photo, that was sent out on 03/14/2023. (ATU- Autho Theft at Planet Fitness, XXXRiver St)

The female who gave the name "XXX(DOB: XX/XX/XXXXwas identified as XXX (DOB: XX/XX/XXXX','No/Null','No/Null',NULL,'3/16/2023','20:43',2023,3,16);
INSERT INTO "fio_juvenile" VALUES ('FC23001409','3/17/2023 18:15','Tilley, Ryan','Tilley, Ryan','JOHN BROWN','CENTRE ST','JAMAICA PLAIN','MA','2130','45','Stopped','Intel',NULL,NULL,NULL,NULL,NULL,NULL,NULL,'No/Null','Body Worn Camera, Juvenile, Gang, Gun','About 6:15 P.M Friday 03/18/2023 Officers responded to R/C for a group of about 20 kids breaking into the closed off construction site at the Bromley Heath development.

Prior to R/C Officers also observed individuals listed above, along with several others unidentified filming a music video around the development.

After a brief foot chase, XXX was pat frisked and was found to be carrying an AXON 15 foot range stun gun which is commonly carried by law enforcement agencies, and not known to be available on a civilian market in MA. XXX stated he came from NY to hang out with his girlfriend in the development. XXX was pat frisked with negative results, transported to E-13 and released to his legal guardian.

All other individuals listed FIO''d and released.

J411F (Tilley) JK01F (Ruiz/Asuncion) J101F (Lynch/Copello)','No/Null','No/Null',NULL,'3/17/2023','18:15',2023,3,17);
INSERT INTO "fio_juvenile" VALUES ('FC23001421','3/19/2023 21:00','Garvey, Thomas','Garvey, Thomas','MICHAEL MCCARTHY','CLARKSON ST','DORCHESTER','MA','2125',NULL,'Observed','Intel',NULL,NULL,NULL,NULL,NULL,NULL,NULL,'No/Null','Juvenile','Officers responded to a radio call for a verbal disturbance at XXXClarkson Street, Dorchester. The caller who wished to remain anonymous stated that large groups of juveniles often frequent the 3rd floor apartment of XXXClarkson St. The caller described the juveniles as mostly black males, aged 14-17, commonly wearing hoodies and facemasks. The caller further stated that when confronted in the past the group of juveniles have referenced being in possession of firearmsXXX resides on the third floor of XXXClarkson and the caller stated she is often unsupervised and hosting the group of juveniles. XXXwas present for the recent firearm arrest of XXXthat occurred in front of the aforementioned address. (See I232019863) 

H103F (Garvey/ D. Foley)','No/Null','No/Null',NULL,'3/19/2023','21:00',2023,3,19);
INSERT INTO "fio_juvenile" VALUES ('FC23001617','3/27/2023 20:55','KENNEDY, JESSE','KENNEDY, JESSE','JOHN BURROWS','GLENWAY ST','DORCHESTER','MA','2121','35','Encountered','Intel',NULL,NULL,NULL,NULL,NULL,NULL,NULL,'No/Null','Body Worn Camera, Juvenile','Offices responded to XXXGlenway for a Threats Report between XXXDOB XX/XX/XXXX(open Assault to Murder, & F/A violations) and a XXX DOB XX/XX/XXXXA subsequent CJISWeb Inquiry for XXXshows a BOP if XXXis run by his name and date of birth but will not return a result for his BOP if the search is run by his Social Security Number or OLN. 

FIO completed to document the search criteria needed to return XXXBOP. 

C111F (Kennedy / R. Adams)','No/Null','No/Null',NULL,'3/27/2023','20:55',2023,3,27);
INSERT INTO "fio_juvenile" VALUES ('FC23001658','3/22/2023 20:00','BISSONNETTE, PHILIP','BISSONNETTE, PHILIP','JAMES MOORE','FENELON ST','DORCHESTER','MA','2121',NULL,'Stopped','Probable Cause',NULL,NULL,NULL,NULL,NULL,NULL,NULL,'No/Null','Juvenile','Observed person trespassing in the fenced alley between XXXErie St. Upon observing Sergeant Bissonnette person fled on foot behind the houses on Erie St. Sgt Bissonnette observed person on Washington St. only to have him flee again. Sergeant Bissonnette along with several Officers from B2. FIO and released','No/Null','No/Null',NULL,'3/22/2023','20:00',2023,3,22);
INSERT INTO "fio_juvenile" VALUES ('FC23001730','4/2/2023 17:50','Byrnes, Patrick','Byrnes, Patrick','ALLISON ENG','MONMOUTH ST','EAST BOSTON','MA','2128','70','Encountered','Encounter',NULL,NULL,NULL,NULL,NULL,NULL,NULL,'No/Null','School, Body Worn Camera, Juvenile','Officers responded to a radio call for "Assault in Progress" regarding a group of juveniles trying to attack another juvenile. Officers encountered XXXDOB XX/XX/XXXXXX (DOB XX/XX/XXXXXXX (DOB XX/XX/XXXXand XXX(DOB XX/XX/XXXXon scene. XXX and XXX admitted to being at the location because they wanted to speak with the victim,XXX (DOB XX/XX/XXXXregarding social media posts. XXXdenied being with the group at the time of the confrontation. All parties negative for warrants. XXXinformed officers that there have been numerous ongoing incidents with a group of classmates at East Boston High School, ranging from social media/in person bullying to physical assaults. FIOE to associate parties. 

-G101F (Byrnes, P./Maldonado), G415F (Cuasut Hernandez)','No/Null','No/Null',NULL,'4/2/2023','17:50',2023,4,2);
INSERT INTO "fio_juvenile" VALUES ('FC23001761','4/4/2023 16:35','Byrnes, Ryan','Byrnes, Ryan','ALLISON ENG','WILLIAM F MCCLELLAN HWY','EAST BOSTON','MA','2128',NULL,'Encountered','Encounter','2019','MA','Eclipse',NULL,'GRAY','Hatchback, 4 Door','Suv (sport Utility Vehicle)','No/Null','Juvenile','Officers responded to a radio call for a verbal dispute in the lobby of Swissport located at XXXMcClellan Highway, East Boston.

Upon arrival, the officers were unable to locate the involved parties. The officers spoke with XXX in the lobby, who stated that he had not seen or observed anything. XXXstated that he was at the Swissport facility for a hiring event. Officers observed XXXto be dressed in business casual clothing. XXXthen proceeded to the 2nd floor of the building where the hiring event was taking place.

Officers were familiar with XXXdue to having responded to his arrest the day prior (I232025817), a violent confrontation which resulted in an "Officer in Trouble" call and multiple officers injured.

While officers were clearing the call at XXXMcClellan Highway, the officers observed XXXspeaking to the occupant of MA XXXwhich was parked in the parking lot. The officers recognized the occupant of the vehicle to be XXX

Officers are familiar with XXXand XXXdue to their being part of a larger group known for stealing cars from Planet Fitness locations (See BRIC Flyer issued 01/24/23). It should be noted that across the parking lot from the Swissport Warehouse at XXXMcLellan Highway, there is a Planet Fitness location. 

A7 Officers previously arrested XXXon 12/20/22 (I222098345) for stealing multiple vehicles from the Avis lot located at XXXBoardman Street, East Boston. The Avis lot is located adjacent to the Swissport warehouse located at XXXMcClellan Highway.

FIOE for Intel.

Byrnes R./Petruzziello (G101F), Nedio/Nepomuceno-Mateo (GK01F)','No/Null','No/Null',NULL,'4/4/2023','16:35',2023,4,4);
INSERT INTO "fio_juvenile" VALUES ('FC23001855','4/8/2023 19:15','Ostholthoff, Tyler','Ostholthoff, Tyler','CHARLES CELLUCCI',NULL,'BOSTON','MA','2116','0','Stopped','Probable Cause','2021','MA','OTHER',NULL,'BLACK','Hatchback, 4 Door','Passenger Car/ Automobile','No/Null','Body Worn Camera, Juvenile','Officers stopped a black Honda C-HR (MA reg. XXXafter Officers observed it swerve around their unmarked cruiser, stop in front of them in the middle of the road, and proceed to shout profanities at another vehicle. 

Driver identified as XXX(DOB XX/XX/XXXXNo BOP. 

Front passenger identified as XXXDOB XX/XX/XXXXNo BOP. 

Rear passenger identified as XXX (DOB XX/XX/XXXX- could not confirm via CJIS). 

None of the occupants were wearing seatbelts, and they all eventually provided their names and dates of birth. 

XXXwas confrontational with Officers throughout the stop and continued reaching to the underside of his left leg after being asked multiple times to stop. XXXclaimed he was attaching his seatbelt. 

Officers issued exit orders due to XXXbehavior. Vehicle and all occupants pat frisked, yielding negative results. 

During exit order, XXXrefused to stand still. XXXwas placed in handcuffs due to his behavior and for Officer safety. 

XXXremained cordial with Officers throughout stop and attempted multiple times to calm XXXand XXXdisobedient behavior.

All parties released.

FIOE''d to associate subjects to vehicle. 

Ostholthoff/McCullough (AK15F)','No/Null','No/Null',NULL,'4/8/2023','19:15',2023,4,8);
INSERT INTO "fio_juvenile" VALUES ('FC23001938','4/8/2023 22:15','MONZON, RENZO','MONZON, RENZO','JOHN BURROWS','ELLINGTON ST','DORCHESTER','MA','2121',NULL,'Stopped','Encounter',NULL,NULL,NULL,NULL,NULL,NULL,NULL,'No/Null','Body Worn Camera, Juvenile','About 10:15 pm, on Saturday, 04/08/23, Officers assigned to the youth violence strike force stopped XXX in front of XXX Ellington St. 

Officers were on random patrol in the area of Old Rd. The Officers attention was drawn to an individual, later identified as XXX, who was walking on Old Rd. 

The reason why the Officers attention was drawn to this individual was because when XXXsaw the Officers, he became wide eyed, and clutched his fanny pack. Officers are well aware of the new trend of people carrying an unholstered firearm inside of fanny packs. Also as XXXwas walking he sat down at the bus station and told Officers that he was just waiting for the bus. When asked where he was coming from he stated that he had just gotten off the bus. It should be noted that when XXXsat down, he moved the fanny pack behind him as if he was trying to conceal the fanny pack from the Officers. While in casual conversation XXXbecame visibly upset, got up, and now began walking away from the bus stop. 

Due to the fact that XXXstated that he was waiting for the bus and now he began walking away, him clutching onto the fanny pack when he observed Officers, and him attempting to conceal the fanny pack when he sat down, Officers believed that he was in possession of a weapon, specifically a firearm. 

Officers exited their vehicle in order to speak with XXXWhen XXXsaw Officers get out, he began running away from Officers at a full sprint while clutching onto the fanny pack. XXXwas stopped shortly after and frisked for weapons to no avail. 

XXXwas explained as to why he was frisked and he stated that he understood and that he was sorry. XXXwas FIOED and released.','No/Null','No/Null',NULL,'4/8/2023','22:15',2023,4,8);
INSERT INTO "fio_juvenile" VALUES ('FC23001939','4/13/2023 17:12','KENNEDY, JESSE','KENNEDY, JESSE','JOHN BURROWS','MASCOT ST','DORCHESTER','MA','2124','48','Stopped','Probable Cause',NULL,NULL,NULL,NULL,NULL,NULL,NULL,'No/Null','Body Worn Camera, Juvenile, Gun','Officers responded to XXXXXX for a Shots Fired call. Upon arrival Officers were made aware that the firearm in question was an airsoft rifle. Officers encountered the following individuals:

1) XXX (DOB XX/XX/XXXX- Previous FIO''s with Adams St Associates and also interactions following shots fired calls. XXXwas recently arrested in Norwood where he initially fled the traffic stop. 

2)XXXDOB XX/XX/XXXX

3) XXX (DOB XX/XX/XXXX
All 3 parties were pat frisked for additional weapons which yielded negative results. The airsoft rifle was turned over to XXXmother XXX (DOB XX/XX/XXXXwho stated that it was hers. 

FIO''d for Intel Purposes.

C111F (Kennedy / R. Adams)','No/Null','No/Null',NULL,'4/13/2023','17:12',2023,4,13);
INSERT INTO "fio_juvenile" VALUES ('FC23002053','4/19/2023 21:12','GREEN, MEGAN','GREEN, MEGAN','AMYLEIGH DEVITO','RUGGLES ST','ROXBURY','MA','2120','18','Encountered','Encounter',NULL,NULL,NULL,NULL,NULL,NULL,NULL,'No/Null','Body Worn Camera, Juvenile','Officers made contact with XXX (DOB: XX/XX/XXXXat his residence, XXX Ruggles apartment XXX Mr. XXXis well known to Officers and requested to speak with police via department cell phone. Mr. XXXrequested Officer support with various family and work concerns. B2 CSO Sgt. Sullivan notified. 

Mr. XXXand his mother were notified of his two warrants Docket XXXand Docket XXXto which they said they would go to Boston Juvenile Court in the morning. 

B103F (Green/Pires)','No/Null','No/Null',NULL,'4/19/2023','21:12',2023,4,19);
INSERT INTO "fio_juvenile" VALUES ('FC23002193','4/28/2023 0:00','UKA, ENRIK','UKA, ENRIK','SEAN WILBANKS','WASHINGTON ST','BRIGHTON','MA','2135',NULL,'Stopped','Encounter',NULL,NULL,NULL,NULL,NULL,NULL,NULL,'No/Null','School, Body Worn Camera, Juvenile','About 7:43 PM on Friday 04/28/2023, Officers Uka and Hooker in the KK02F observed two juveniles taking a package from the front door of XXXWashington Street, Brighton.

Officers stopped and made contact with the juveniles who were identified as (XXX, DOB: XX/XX/XXXXand XXX, DOB: XX/XX/XXXX
Officers asked the juveniles if the package they just took from XXXWashington St belongs to them and they stated no and that they were sorry for their actions.

The officers recognized the hoodie that (XXX) was wearing from a video footage that was given to the officers from the owners of the convenience store at XXXWashington Street. The owner of the store told the officers that two days in a row on Tuesday 04/25/2023 and Wednesday 04/26/2023, a group of teenagers have been coming in and stealing items (entire boxes) from the store and running out. One of the teenagers in the video footage was wearing a hoodie with the writing in white letters XXXin the front. 

During the encounter today, (XXX) was wearing a hoodie with the same writing XXX
Officers informed (XXX) that there is a footage of someone wearing a hoodie exactly like the one he has on today and stealing items from XXXWashington Street convenience store. He admitted to being there this week with many friends and stealing. He was sorry and told the officers he will not do it again and will tell his friends to not steal again also.

Officers asked XXXif he was with the group at XXXWashington street as well and he said he was there and was sorry for stealing but will not repeat it again.

The mother of (XXX) who was identified as (XXX DOB: XX/XX/XXXXwas driving by and stopped to speak with the officers. Once she was explained of the situation she was very upset at her son and said that she will talk to her son and punish him accordingly.','No/Null','No/Null',NULL,'4/28/2023','0:00',2023,4,28);
INSERT INTO "fio_juvenile" VALUES ('FC23002270','5/3/2023 7:35','O''BRIEN, JUSTIN','O''BRIEN, JUSTIN','ALLISON ENG','WALDEMAR AVE','EAST BOSTON','MA','2128',NULL,'Encountered','Intel',NULL,NULL,NULL,NULL,NULL,NULL,NULL,'No/Null','School, Body Worn Camera, Juvenile','At about 8:13 am on Wednesday May 03, 2023 Officer Hernandez in the G415D responded to the area of XXX WALDEMAR AVE, EAST BOSTON, MA 02128 in search for a missing XXX (REF 1.1 232034087) 

Officer Hernandez was able to locate the missing juvenile in the second floor stairwell with three other juvenile identified as XXX, XXX and XXX. 

SGT Hernandez the G910 also responded and was able to make contact parents and guardians. XXX was picked by his grandmother XXX, XXX was picked up by mother XXX and XXX mother was contacted and was transported to East Boston High School by Officer Hernandez and turn over to his school dean XXX. 

BWC were activated.','No/Null','No/Null',NULL,'5/3/2023','7:35',2023,5,3);
INSERT INTO "fio_juvenile" VALUES ('FC23002288','5/4/2023 14:20','Castor, Caitlyn','Castor, Caitlyn','DONALD KEENAN','HUNTINGTON AVE','BOSTON','MA','2116',NULL,'Encountered','Probable Cause',NULL,NULL,NULL,NULL,NULL,NULL,NULL,'No/Null','Body Worn Camera, Juvenile, Gang','District D4 officers responded to the area of XXX Huntinton Ave for a r/c for a multiple person fight (males and females). Upon arrival officers observed a group of females running outbound down the South West Corridor. With in the ground officers observed (3) males with hoods and masks attempt to break away from the group running. 

Officers spoke with Lenox associates XXX and XXX regarding a fight that occurred. All parties were cordial with officers and stated that they were not involved in the fight "it was those girls". 

Officers informed the group they should leave the area which they agreed. 

FIO for INTEL

D103D (Castor and Crowley)','No/Null','No/Null',NULL,'5/4/2023','14:20',2023,5,4);
INSERT INTO "fio_juvenile" VALUES ('FC23002312','5/5/2023 16:01','ELVIN, SIOBHAN','ELVIN, SIOBHAN','KEVIN MCCLAY','CENTRE ST','JAMAICA PLAIN','MA','2130','59','Observed','Intel',NULL,NULL,NULL,NULL,NULL,NULL,NULL,'No/Null','Auto Investigator, Body Worn Camera, Juvenile, Other Agency/Unit Notified, Gang','About 17:00 Hrs. 05/05/23 - R/C for MVA W/ Injuries - Stolen vehicle involved 

5 suspects total, 1 suspect observed on witness cell phone camera running away wearing black hoodie, white and black checkered pajama bottoms, and white sneakers, down Chestnut Avenue towards Bromley Heath development.

 Officers canvassed area and located/observed SB1XXX known to Officers, standing outside XXX Centre Street, wearing a black hoodie, black and white checkered pajama bottoms and white sneakers.

JK01F (Tilley/Ramos)','No/Null','No/Null',NULL,'5/5/2023','16:01',2023,5,5);
INSERT INTO "fio_juvenile" VALUES ('FC23002320','5/5/2023 20:50','FOLEY, ERIC','FOLEY, ERIC','JOHN BURROWS','WHITFIELD ST','DORCHESTER','MA','2124',NULL,'Stopped','Probable Cause',NULL,NULL,NULL,NULL,NULL,NULL,NULL,'No/Null','Body Worn Camera, Juvenile','On-site arrest of XXX for recieving stolen m/v at XXX Whitfield St. XXX informed Officers he was with XXX described as a white/Hispanic male with blonde colored braids to go to a house party at XXX Dunlap St. Prior to the stop, Officers observed multiple individuals in full face coverings standing aorund the stolen m/v. After conducting a U-turn, indivudals were no longer on scene. Officers inquired why XXX left the area to which XXX statedXXX". XXX stated he believes XXX lives at XXX Whitfield. It should be noted that MA REG XXX was involved in a hit and run and the victim of the hit and run stated the driver (matching XXXexact physical and clothing description) displayed a FA on today''s date in B2. 

H104F (E. Foley/O. Russell)','No/Null','No/Null',NULL,'5/5/2023','20:50',2023,5,5);
INSERT INTO "fio_juvenile" VALUES ('FC23002391','5/8/2023 18:00','Ostholthoff, Tyler','Ostholthoff, Tyler','JOHN SHAUGHNESSY','FRUIT ST','BOSTON','MA','2114','0','Encountered','Intel',NULL,NULL,NULL,NULL,NULL,NULL,NULL,'No/Null','Juvenile, Gun','On 5/8/23 at 6:00 PM, Officers were informed by arrestee, XXX (DOB XX/XX/XXXXthatXXX (DOB XX/XX/XXXXwas in possession of multiple firearms. 

Officers'' conversation with XXXwas entirely casual and began when Officers asked XXXhow he managed to get from Natick (where he was reported missing) to Boston and where he had been living since arriving in the city. 

XXXstated he snuck onto an MBTA Commuter Rail train after leaving the Brandon School on April 11th to make his way to Mattapan where his "boys" lived. 

Approximately two weeks ago, XXXwas selling single cigarettes in Mattapan Square when he was confronted byXXX (DOB XX/XX/XXXXwhose street name is XXXXXXstated XXXwalked up to him, asked him what he was doing in his neighborhood and then brandished and pointed a silver-colored, Glock-style firearm at him. XXXexplained to XXXthat he was homeless and just trying to make money by selling single cigarettes. From that point on XXXsaid, "XXX" and "looked out for me." 

XXXstated at one point, XXXoffered to give XXXhis own Glock firearm. XXXstated XXXhas four firearms in his possession. XXXalso stated XXXoften spoke about being arrested in 2016 during which time "he got popped" with two firearms and lots of drugs (seemingly referencing I162087998).

XXXsaid if he is returned to Natick, he will just run away again and go back to Mattapan Square. 

FIOE''d for intel and officer safety.

Ostholthoff/McCullough (A103F)','No/Null','No/Null',NULL,'5/8/2023','18:00',2023,5,8);
INSERT INTO "fio_juvenile" VALUES ('FC23002456','5/11/2023 19:00','FOLEY, ERIC','FOLEY, ERIC','ERIC MERNER','CHARLES ST','DORCHESTER','MA','2122',NULL,'Stopped','Intel',NULL,NULL,NULL,NULL,NULL,NULL,NULL,'No/Null','Body Worn Camera, Juvenile','SS of the above individuals atXXXCharles St. All four observed exitingXXXDitson St. Officers recovered knives from XXX and XXX. XXXand XXXmathced the description of armed robbery suspects from two different incidents. XXXwas stopped two nights ago by Officers after fleeing an armed robbery. FIO''d for intel and released.

HK01F (E. Foley/ O. Russell)','No/Null','No/Null',NULL,'5/11/2023','19:00',2023,5,11);
INSERT INTO "fio_juvenile" VALUES ('FC23002777','5/31/2023 17:00','PALERMO, SARAH','PALERMO, SARAH','RAFAEL RODRIGUEZ','WASHINGTON ST','DORCHESTER','MA','2121','85','Encountered','Encounter',NULL,NULL,NULL,NULL,NULL,NULL,NULL,'No/Null','Juvenile','While doing a CD19 at the Burger King, XXXWashington St. a large group of kids were gathered in the building and asked to leave, then gathered outside. 

On scene was :

Anthony Fonseca (blue tie dye shirt) on foot. Brought knife to BK in past, was pepper sprayed in BK day prior (I232042191)XXXnavy blue SpongeBob short sleeve shirt); on a blue city bike who fled the scene when Officers began to gather information (2 warrants from the MBTA). claimed to have been pepper sprayed at BK the day prior (I232042191). Stated he is not M4 but hangs with M4 kids. 

XXX(Black sweatshirt, black sweatpants large gold and rhinestone necklace) carrying a screwdriver into BK, handed it off to XXXstated it was for his scooter and had a mini dirt bike with him.

XXX (White shirt, blue backpack) - frequent runaway- younger brother of XXX (Creston).

XXX (white T-Shirt, sweatpants and black Balaclava, large afro)

XXX (Black sweatshirt and sweatpants), was present during the pepper spray incident (I232042191)XXX (black shirt & pants, large knee brace)XXX (blue sweatshirt, sweatpants, crocks)

XXX-unknown last name, believe it begins with a XXXblack camo sweatshirt, band-aid on head 



B103F (Palermo/Luciw)','No/Null','No/Null',NULL,'5/31/2023','17:00',2023,5,31);
INSERT INTO "fio_juvenile" VALUES ('FC23002846','6/4/2023 16:29','Madden, Joseph','Madden, Joseph','HENRY STAINES','COLUMBIA RD','BOSTON','MA','2127','16','Stopped','Probable Cause',NULL,NULL,NULL,NULL,NULL,NULL,NULL,'No/Null','Body Worn Camera, Juvenile','3rd party call for a fight at Dorchester St. / E 4th St., South Boston. 

Stopped male matching description in the area of XXXColumbia RdXXX (DOB: XX/XX/XXXXstated that he was defending himself.

No victim was found in the area.

Should be noted that XXXhas hearing issues.

F202F (Madden/Shimchak)','No/Null','No/Null',NULL,'6/4/2023','16:29',2023,6,4);
INSERT INTO "fio_juvenile" VALUES ('FC23002877','6/6/2023 12:33','SCHAIN, RYAN','SCHAIN, RYAN','JAMES MOORE','BLUE HILL AVE','DORCHESTER','MA','2124',NULL,'Stopped','Probable Cause',NULL,NULL,NULL,NULL,NULL,NULL,NULL,'No/Null','Juvenile','YVSF Intel - VK23

Officers observed a male on wearing a black ski mask and two hooded sweatshirts operating a scooter on Lucerne Street. The male was not wearing a helmet. As officers positioned themselves behind the scooter he increased his speed, while looking back at them several times. The male cut down Balsam Street and then drove quickly into the side driveway of XXXBlue Hill Ave., where he dumped the scooter and ran on foot. The male was stopped and detained near the front yard of XXXBlue Hill Ave. The scooter had damage to its front panel. 

The male stated his name was XXX of XXXWood Ave. Further investigation revealed the male''s true identity was XXX(middle name XXXand that he resided at XXXBlue Hill Ave. As he was 14, Officers contacted XXXmother,XXX, who responded and took custody of him. He was advised to not operate scooters in that manner and was FIO''d and released.','No/Null','No/Null',NULL,'6/6/2023','12:33',2023,6,6);
INSERT INTO "fio_juvenile" VALUES ('FC23003028','6/14/2023 6:10','FOLEY, RORY','FOLEY, RORY','CHRISTOPHER CARROLL','COLUMBUS AVE','BOSTON','MA','2116',NULL,'Stopped','Probable Cause',NULL,NULL,NULL,NULL,NULL,NULL,NULL,'No/Null','Warrant Arrest, Body Worn Camera, Juvenile, Gang, Gun','YVSF intelXXX self-admitted to Mass Ave gang affiliation at booking.','No/Null','No/Null',NULL,'6/14/2023','6:10',2023,6,14);
INSERT INTO "fio_juvenile" VALUES ('FC23003037','6/14/2023 19:43','Thornton, Adrienne','Thornton, Adrienne','MICHAEL MCCARTHY','DRAPER ST','DORCHESTER','MA','2122',NULL,'Stopped','Probable Cause',NULL,NULL,NULL,NULL,NULL,NULL,NULL,'No/Null','Body Worn Camera, Juvenile, Child Present','Officers responded to a radio call for a breaking and entering in progress at XXXDraper Street, Dorchester.

Officers arrived on scene and met with the caller XXX, who was on the third floor porch. He informed officers that there were multiple city Bluebikes on the left side of the building that appeared abandoned. He mentioned that there were multiple individuals (unknown number) who gained entry through the basement level of the unfinished unit. 

Officers noticed the Bluebikes situated at the side of the building. There was a door leading downstairs into the basement. At that moment, there was a thin black male (unknown age) wearing a red-hooded sweater and dark colored pants that exited the building through an open window. The male was able to grab one of the Bluebikes and starting riding away from officers on Draper Street towards Westville Street. 

 The remaining individuals attempted to close the door in front of the officer. Assisting units made entry and were able to detain the remaining three individuals who ran upstairs. After securing the suspects, officers conducted a protective sweep for any remaining suspects to no avail. 

The individuals were identified as the following:

 * 
S1XXX (DOB XX/XX/XXXX
 * 
S2-XXX (DOB XX/XX/XXXX
 * 
S3XXX (DOB XX/XX/XXXX
 * 
S4XXX (DOB XX/XX/XXXX

The suspects were brought to district C-11 and released to their parents/guardians. 

FIO''s for intel. 

H102F (Thornton/Lopes).','No/Null','No/Null',NULL,'6/14/2023','19:43',2023,6,14);
INSERT INTO "fio_juvenile" VALUES ('FC23003049','6/15/2023 20:15','Sweeney, Anna','Sweeney, Anna','CHRISTOPHER CARROLL',NULL,'BOSTON','MA','2118',NULL,'Stopped','Encounter',NULL,NULL,NULL,NULL,NULL,NULL,NULL,'No/Null','Juvenile','Radio call for a person with a gun at Tremont St and W Springfield St. Caller stated a group of 13-14 year old males of mixed races were running up and down W Springfield shooting each other with BB guns. Officers observed a group matching the description and stopped to ID. Officers observed the guns to be water gel blaster guns.

Officers were provided with the names of XXX XX/XX/XXXXXXX XX/XX/XXXXXXX XX/XX/XXXXandXXX XX/XX/XXXXOfficers were later able to correctly identify these individuals via Mark 43 as XXX XX/XX/XXXXXXXXX/XX/XXXXand XX/XX/XXXX

FIO''d and released on scene. 

DK01F (Murphy/ Sweeney).','No/Null','No/Null',NULL,'6/15/2023','20:15',2023,6,15);
INSERT INTO "fio_juvenile" VALUES ('FC23003204','6/25/2023 18:37','SPARKS-CLANCY, SAEQUAN','SPARKS-CLANCY, SAEQUAN','MICHAEL MYLETT','MOREY RD','WEST ROXBURY','MA','2132',NULL,'Encountered','Encounter',NULL,NULL,NULL,NULL,NULL,NULL,NULL,'No/Null','Body Worn Camera, Juvenile','About 6:37PM, on Sunday 06/25/2023, Officer Sparks-Clancy, in the E428F, responded to a radio call for a Larceny In Progress at XXXCerdan Avenue, West Roxbury.

The call came in on Channel 4 Dispatch: "THREE MALE TEENS AT ABV LOCATION WITH BOLTCUTTERS TRYING TO STEAL A MOTORCYCLE"

Upon arrival, Officers in the E103F (P.O Sousa/P.O Clohety) stated that the 3 males started running and hopping fences behind the above address. Officer Sparks-Clancy searched the area when he was stopped by an unknown pedestrian on XXXWells Avenue stating there''s an 2 black males behind the house. Officer Sparks-Clancy started to drive down Morey Road when he observed a light skin, juvenile, with a skinny build wearing a black sweater with red/white and grey striped with the words (NBA) written on his back, navy blue sweatpants and black sneakers walk out of the driveway of XXXMorey Road. The juvenile male approached a man getting out of his car. The male getting out of his car immediately put his hands up with his palms facing the juvenile and stepping back, with his backing touching the driver door of his vehicle shaking his head left and right. 

Officer Sparks-Clancy asked both individuals if they were okay. The male that got out of his vehicle stated he didn''t know the kid. The juvenile who identified himself as XXXstated his phoned died and he was trying to call his grandmother. Upon closer observation, Officers noticed XXXwas sweating profusely, there was grass and tree pieces in his hair, and dirt all over his sweater. While Officers were talking with XXXa description of the possible suspects matching XXXclothing was put out over the air.

XXXhas two closed cases out of Juvenile Court (BMC) :
ARRAIGNMENT: (0001) ARG-DATE: XX/XX/XXXXPD: MTA COURT: SUFFOLK COUNTY JUVENILE DKT#: XXX OFF: ASSAULT DANGEROUS WEAPON KNIFE  ASLT DW STATUS: C WPD: WDT: DISP: PTCOR-B C 5/23/23 DISM ARRAIGNMENT: (0002) ARG-DATE: 12/23/21 PD: MTA COURT: SUFFOLK COUNTY JUVENILE DKT#: XXXOFF:  A&B DANGEROUS WEAPON SHOD FOOT A&B DW STATUS: C WPD: WDT: DISP: PTCOR-A C 5/23/23 DISMXXXwas given a ride to Forest Hills station at the conclusion of the investigation.','No/Null','No/Null',NULL,'6/25/2023','18:37',2023,6,25);
INSERT INTO "fio_juvenile" VALUES ('FC23003242','6/28/2023 13:00','FOLEY, ERIC','FOLEY, ERIC','KENNETH MACMASTER',NULL,'DORCHESTER','MA','2124',NULL,'Observed','Intel',NULL,NULL,NULL,NULL,NULL,NULL,NULL,'No/Null','Juvenile','Officer observedXXX operating a bright blue moped on Geneva Ave towards Westville St. The Officer attempted to conduct a m/v stop but was unable to due to traffic and eventually lost sight of the moped. XXXwas wearing a black shirt with XXXwritten on the back, gray pants and a black surgical mask. XXXfrequents XXXDitson and has been stopped/FIO''d with juveniles known to commit armed robberies in the Fields Corner area. FIO''d for intel.

H425D (E. Foley)','No/Null','No/Null',NULL,'6/28/2023','13:00',2023,6,28);
INSERT INTO "fio_juvenile" VALUES ('FC23003340','7/4/2023 18:00','Cooper, Renee','Cooper, Renee','PAUL DOWNEY','WASHINGTON ST','BOSTON','MA','2110',NULL,'Encountered','Encounter',NULL,NULL,NULL,NULL,NULL,NULL,NULL,'No/Null','Body Worn Camera, Juvenile','Officers responded to Macy''s at XXXWashington Street for a Person with a Knife. 

Upon arrival, Officers were met by Macy''s staff members who stated that an unknown male (later identified as XXX DOB: XX/XX/XXXXhad been with a group of 5-10 teenagers. Mr. XXX was seen by the Secruity Consultant holding a knife. Staff stated they asked XXX to leave the premises and he as well as the other teenagers refused to leave.

Officers spoke with and were able to identify the male asXXX. Officers frisked XXX for the knife. Macy''s staff stated the have on surveillance camera XXX dropping the knife at the rear door leading to the MBTA entrance. XXX was verbally trespassed and escorted off the premises.

CJIS inquiry yielded no active warrants. 

A103F (Mendes/Cooper)','No/Null','No/Null',NULL,'7/4/2023','18:00',2023,7,4);
INSERT INTO "fio_juvenile" VALUES ('FC23003358','7/6/2023 3:22','VILLANUEVA, JASON, R.','VILLANUEVA, JASON, R.','JAMES MOORE','WALES ST','DORCHESTER','MA','2124',NULL,'Stopped','Probable Cause',NULL,NULL,NULL,NULL,NULL,NULL,NULL,'No/Null','Body Worn Camera, Juvenile','While on patrol in the area of XXXWales St, Dorchester, Officers stopped the following individuals:

 * XXX

All parties were found to be congregating in the playground at XXXWales Street where there are posted signs of the parked being closed between Dusk and Dawn. Officers located a large sized machete in the area which was seized, while on scene with the parties one of the parties uttered "there are Wood Ave guys that live right there" referring to the home located at XXXWales St where there were 2 unknown parties recording the officers and shouting from the balcony of the home. All parties were FIO''d and released.','No/Null','No/Null',NULL,'7/6/2023','3:22',2023,7,6);
INSERT INTO "fio_juvenile" VALUES ('FC23003449','7/11/2023 1:14','CALABRESE, SALVATORE','CALABRESE, SALVATORE','KENNETH MACMASTER',NULL,'DORCHESTER','MA','2121',NULL,'Stopped','Probable Cause',NULL,NULL,NULL,NULL,NULL,NULL,NULL,'No/Null','Body Worn Camera, Juvenile, Gang','Officers arrested XX/XX/XXXXon warrants in the area of Washington St and Eldon St, Dorchester. 

During the booking process both XXXand XXXboth self identified as Johnston Rd. XXXwas wearing a Toronto Blue Jays hat and stated that he claims Johnston Rd because of his fatherXXX XX/XX/XXXX(multiple prior firearms) who is from Spencer and hangs out with Johnston Rd dudes. XXXsaid that he also hangs out with them when he is with his father. XXXalso stated that he started the group XXXas in XXXCanterbury but doesn''t claim them anymore. 

FIO for intel purpose

CK02A - Calabrese/Coleman','No/Null','No/Null',NULL,'7/11/2023','1:14',2023,7,11);
INSERT INTO "fio_juvenile" VALUES ('FC23003620','7/20/2023 3:55','Ercolano, Sean','Ercolano, Sean','LEAH BAGAS','BOYLSTON ST','BOSTON','MA','2116',NULL,'Stopped','Probable Cause',NULL,NULL,NULL,NULL,NULL,NULL,NULL,'No/Null','Body Worn Camera, Juvenile, Gang','On Thursday, 07/20/2023,XXXwas arrested for auto theft of a motorized scooter.

Active Adams St / Franklin Field gang memberXXX- Prior F/A charges

XXXwas cordial with Officers throughout their interaction.  XXXdenied any gang associations but stated he, "doesn''t fuck with Wainrwight or 400 Block"  

XXXrefused to identify the second suspect, only giving the name XXXand stating XXXworked at Macy''s or Primark.  When being picked up by his mother,XXX she stated that XXXuses the name XXXas a false name for people he associates with.

A691D','No/Null','No/Null',NULL,'7/20/2023','3:55',2023,7,20);
INSERT INTO "fio_juvenile" VALUES ('FC23003746','7/30/2023 18:00','FOLEY, ERIC','FOLEY, ERIC','MICHAEL MCCARTHY','DORCHESTER AVE','DORCHESTER','MA','2124',NULL,'Stopped','Probable Cause',NULL,NULL,NULL,NULL,NULL,NULL,NULL,'No/Null','Warrant Arrest, Body Worn Camera, Juvenile','On-site warrant arrest of XXX (possible N.O.B. associate) at Ashmont Station after Officers observed him walking on Dot Ave and into the station. During booking, XXXrefused to confirm NOB ties, but stated he has issues with Wainwright because they "smoke" his deceased brother (XXX. XXXstated he also has issues with ATM because they "smoke" onXXX. XXXstated XXX (M4) is his blood cousin and that XXX(M4) is hisXXXand he has been staying at his houseXXXTalbot) while XXXaka XXXhas been in DYS custody. XXXwas cordial and cooperative throughout the entirety of the arrest.

FIO''d for intel.

HK01F (E. Foley/O. Russell)','No/Null','No/Null',NULL,'7/30/2023','18:00',2023,7,30);
INSERT INTO "fio_juvenile" VALUES ('FC23003749','7/31/2023 1:50','SULLIVAN, PATRICK','SULLIVAN, PATRICK','JOHN BURROWS','BLUE HILL AVE','DORCHESTER','MA','2124',NULL,'Observed','Encounter',NULL,NULL,NULL,NULL,NULL,NULL,NULL,'No/Null','Juvenile','Officer observed seven juveniles (six boys and one girl) loitering in the parking lot of the XXXBlue Hill Avenue Mobil. The group eventually boarded an MBTA bus headed outbound on Blue Hill Avenue at about 1:50AM. The officer believed he recognizedXXXwho was noticeably limping)XXX, a short-statured hooded male wearing a surgical mask (possibly XXX) and another male in a surgical mask believed to be XXX. Following their departure the officer was approached by a homeless female who requested anonymity. She stated some of the juveniles had asked her for money and when she refused, made comments to the effect of "you''re lucky that cop''s here, we''ll come back when you''re alone and knock you out." She additionally believed that one of the juveniles may have been attempting to reach for her purse at one point. She had not tried to alert the nearby officer, explaining that she had not wanted to appear scared. She was provided a courtesy transport to a safe location at her request.

Sullivan (C421A)','No/Null','No/Null',NULL,'7/31/2023','1:50',2023,7,31);
INSERT INTO "fio_juvenile" VALUES ('FC23003765','7/31/2023 20:30','Nunes, Robert','Nunes, Robert','JOHN SHAUGHNESSY','COMMERCIAL ST','BOSTON','MA','2109','20','Encountered','Encounter',NULL,NULL,NULL,NULL,NULL,NULL,NULL,'No/Null','Body Worn Camera, Juvenile','About 8:49 PM, on Monday, 07/31/23, Officer Nunes assigned to the A421F responded to a radio call for Trespassing at XXXCommercial Street, Boston (BCYF Mirabella Pool). 

Assisting units A436F (Cooper), A202F (Erb & Beaton) 

Upon arrival, Officers observed six juveniles using the swimming pool. At this time Mirabella Pool was closed with the gates locked and secured. The six juveniles gain access to the pool by jumping over the fence. Officers identified and informed all juveniles if they return to the property after closing hours they will be arrested for Trespassing. 

Officers Nunes (A421F) and Cooper (A436F) transported all six juveniles to North Station.','No/Null','No/Null',NULL,'7/31/2023','20:30',2023,7,31);
INSERT INTO "fio_juvenile" VALUES ('FC23003776','8/2/2023 7:05','FOLEY, RORY','FOLEY, RORY','JOHN FITZGERALD','BROOKS ST','BRIGHTON','MA','2135',NULL,'Stopped','Probable Cause',NULL,NULL,NULL,NULL,NULL,NULL,NULL,'No/Null','Warrant Arrest, Body Worn Camera, Juvenile, Other Agency/Unit Notified','XXX XX/XX/XXXXarrested per virtue of a DYS probation warrant at XXXBrooks Street, Brighton. 

YVSF.','No/Null','No/Null',NULL,'8/2/2023','7:05',2023,8,2);
INSERT INTO "fio_juvenile" VALUES ('FC23003789','8/3/2023 18:10','FULLAM, RYAN JAMES','FULLAM, RYAN JAMES','CHRISTOPHER CARROLL','BOYLSTON ST','BOSTON','MA','2199',NULL,'Stopped','Probable Cause',NULL,NULL,NULL,NULL,NULL,NULL,NULL,'No/Null','Body Worn Camera, Juvenile','RC for Juveniles shoplifting XXXBoylston St SephoraXXX and XXXstopped by LP for concealing merchandise under 1200.00S$. Both female juveniles have no prior police interaction and were visibly apologetic and upset, Parents were notified, and all merchandise was returned. Both juvenile females were released and informed they were trespassed from this Sephora Store.','No/Null','No/Null',NULL,'8/3/2023','18:10',2023,8,3);
INSERT INTO "fio_juvenile" VALUES ('FC23003927','8/11/2023 9:40','Kozub, Roksana','Kozub, Roksana','ZACHARY CROSSEN','CHARTER ST','BOSTON','MA','2113',NULL,'Stopped','Probable Cause',NULL,NULL,NULL,NULL,NULL,NULL,NULL,'No/Null','Body Worn Camera, Juvenile','Officers stopped both suspects (XXX D.O.B XX/XX/XXXXand XXX XX/XX/XXXXoutside of the charter street park.

Officers observed both juveniles to be consuming alcohol out of a Pink Amsterdam Vodka Bottle and Hennessey Privilege Bottle.

Officers confiscated both bottles and disposed of them.

FIO to associate juveniles in the area and address complaints of underage drinking.

Officers Kozub/Eaton.','No/Null','No/Null',NULL,'8/11/2023','9:40',2023,8,11);
INSERT INTO "fio_juvenile" VALUES ('FC23003928','8/11/2023 21:00','Kozub, Roksana','Kozub, Roksana','ZACHARY CROSSEN','HANOVER ST','BOSTON','MA','2113',NULL,'Stopped','Probable Cause',NULL,NULL,NULL,NULL,NULL,NULL,NULL,'No/Null','Juvenile','Officers stopped both suspects (XXX D.O.B XX/XX/XXXXXXXD.O.B XX/XX/XXXX), and XXX XX/XX/XXXXsitting on the steps of XXXHanover Street during the North End Feast.

Officers observed the three juveniles to be sharing a small nip of Vodka.

Officers confiscated the small nip of Vodka and disposed of them.

FIO to associate juveniles in the area and address complaints of underage drinking.

Officers Kozub/Eaton.','No/Null','No/Null',NULL,'8/11/2023','21:00',2023,8,11);
INSERT INTO "fio_juvenile" VALUES ('FC23003948','8/13/2023 22:00','FREEMAN, AWAN','FREEMAN, AWAN','JAMES MOORE','BLUE HILL AVE','DORCHESTER','MA','2124',NULL,'Stopped','Probable Cause','2022',NULL,'OTHER: Moped',NULL,'RED',NULL,'Moped','No/Null','Body Worn Camera, Juvenile','About 10:00pm on Sunday, August 13, 2023 as a part of "OPERATION QUIET STREETS" Officers and a MA State Police Trooper in the conjunctive effort conducted a Traffic Stop on a Red Yongfu Moped (VIN# XXX) at the Mobil Gas Station located at XXXBlue Hill Ave., Dorchester.

One of the two occupants was identified as Mr.XXX DOB XX/XX/XXXX(14 year old male). Another male occupant fled the area on foot before officers approached. Officers and the State Trooper knew that due to Mr. XXXage he was unable to possess an MA learner''s permit and/or driver''s license and subsequently a CJIS Inquiry confirmed that. Mr. XXXwas searched which yielded negative results for weapon(s) and/or illegal contraband. Officers observed no plate affixed to the moped at all as well as loose wires just below the compounds of the handlebars and no key in the ignition. A CJIS Inquiry of the aforementioned VIN number yielded "NO RECORD(S) FOUND". There were no paper documents located inside of the moped nor did Mr. XXXpossess such on his person.

It should be noted that Mr. XXXwas recently FIO''d with 2 others on 08/02/2023 by members of YVSF following a radio call for multiple Persons Shot in the area of School St. and Washington St. in Egleston Sq. (E-13). The State Trooper also located an incident in which Mr. XXXwas associated with a reveler group on 08/07/2023 in the Ted Williams Tunnel in which Mr. XXXwas cited and summonsed.

The moped was towed. The State Trooper issued Mr. XXXa citation in-hand, Mr. XXXwas FIO''d and released following the stop.

FIO for intel purposes.

C411F (Freeman)','No/Null','No/Null',NULL,'8/13/2023','22:00',2023,8,13);
INSERT INTO "fio_juvenile" VALUES ('FC23003989','8/16/2023 15:45','MACDONALD, DAVID','MACDONALD, DAVID','PATRICK MORRISON','LEONARD ST','DORCHESTER','MA','2122',NULL,'Encountered','Encounter',NULL,NULL,NULL,NULL,NULL,NULL,NULL,'No/Null','Recreational Vehicle, Juvenile','Officers responded to a radio call for several males driving mopeds down the one way street. As officers pulled onto Leonard Street they observed two males coming down the wrong way and quickly turn around pulling onto Clayton Street.XXX circled the block and parked the moped behind his residence at XXXLeonard. Officers advisedXXX of the complaints of his erratic operation. Officers also advised him to wear a helmet. Also on scene was XXX. The operator of the second moped did not return to the scene.','No/Null','No/Null',NULL,'8/16/2023','15:45',2023,8,16);
INSERT INTO "fio_juvenile" VALUES ('FC23004013','8/17/2023 14:02','GUERINI, ANDREW','GUERINI, ANDREW','CHRISTOPHER CARROLL','HARRISON AVE','BOSTON','MA','2118','28','Stopped','Probable Cause',NULL,NULL,NULL,NULL,NULL,NULL,NULL,'No/Null','Body Worn Camera, Juvenile','Officers responded to a call for a vandalism in progress at XXXHarrison Ave (Whole Foods).  Officers were informed that 3 black females in their late teens were stealing liquor and had been destroying merchandise inside of the store.  Officers stopped XXX and XXXat the corner of E. Berkeley and Harrison Ave.  XXXwas eventually placed under arrest.

FIO to associate suspects with the store.','No/Null','No/Null',NULL,'8/17/2023','14:02',2023,8,17);
INSERT INTO "fio_juvenile" VALUES ('FC23004062','8/21/2023 17:23','MCDONOUGH, MICHAEL','MCDONOUGH, MICHAEL','DONALD KEENAN','W DEDHAM ST','BOSTON','MA','2118',NULL,'Stopped','Probable Cause',NULL,NULL,NULL,NULL,NULL,NULL,NULL,'No/Null','Body Worn Camera, Juvenile','Officers placed XXX and XXXunder arrest in the area of Washington St. and E Newton St. (I232067020) in possession of stolen mopeds.  XXXwas in possession of a darker color moped with the significant damage to the steering column. 

XXXprovided Officers with fake names which included "XXX(DOB: XX/XX/XXXXOfficers are aware that XXXhas used variations of this fake name in past police encounters.   XXXhas a noticeable scar on his forehead in between his eyebrows.  

DK01F (McDonough/Crowley)','No/Null','No/Null',NULL,'8/21/2023','17:23',2023,8,21);
INSERT INTO "fio_juvenile" VALUES ('FC23004144','8/28/2023 3:28','Champagnie, Triston','Champagnie, Triston','JOSE LOZANO','PEACEVALE RD','DORCHESTER','MA','2124','51','Stopped','Probable Cause',NULL,NULL,NULL,NULL,NULL,NULL,NULL,'No/Null','Juvenile','About 3:30am on 08/28/23, Officers received a call for a male walking through backyards. Upon being observed by neighbors he ran towards Washington St, clutching his waistband.

Officers canvassed the area & located a juvenile matching the description. Upon doing so, Officers were in a brief foot pursuit where the individual later identified as (XXX - XX/XX/XXXXwas later apprehended.

Officers inquired on XXXreasoning for going through backyards, to which he stated "my friend made me".

It should be known XXXhas a previous history of multiple vandalism reports.

XXXwas transported back to his residence at XXXNorfolk St, where his mother took custody of him.

XXX.

CK02A (Champagnie // Calabrese).','No/Null','No/Null',NULL,'8/28/2023','3:28',2023,8,28);
INSERT INTO "fio_juvenile" VALUES ('FC23004148','8/27/2023 18:00','SHEA, KATHERINE','SHEA, KATHERINE','KENNETH MACMASTER','DISTRICT AVE','DORCHESTER','MA','2125',NULL,'Stopped','Probable Cause',NULL,NULL,NULL,NULL,NULL,NULL,NULL,'No/Null','Juvenile','08/27/23 16:49 hours Officers Glaropoulos (F631D) and Ortiz (F630D) responded to a Person with a Knife and Several Fights at XXXDISTRICT AVE DORCHESTER South Bay Mall.  

The officers responded to the area that had approximately 300 kids in the mall area.  The movie theater personnel stated there was a juvenile male who had pulled a knife on an employee.  The movie theater employee pointed to a juvenile male (dark skinned, grey shirt, black durag) and stated "that''s him". As officers approached the juvenile male he ran towards Allstate Rd toward Massachusetts Ave.  Officer Glaropoulos gave out a description and other officers stopped the juvenile who was identified as XXXDOB XX/XX/XXXXOfficers conducted a pat frisk of the juvenile who did not currently have a weapon on him.  The juvenile was surrounded by friends.   An adult male (XXX) approached officers and stated he was the juvenile''s football coach and would take the group home along with notifying parents of the incident.  Officers then responded back to District Ave where other Officers had asked for assistance because several fights were breaking out among the large groups of  juveniles.  Officers headed back and observed a fight between females and attempted to separate the females to stop the altercation.','No/Null','No/Null',NULL,'8/27/2023','18:00',2023,8,27);
INSERT INTO "fio_juvenile" VALUES ('FC23004302','9/5/2023 21:11','DIPIRO, MATTHEW','DIPIRO, MATTHEW','ROBERT DONARUMA','HYDE PARK AVE','BOSTON','MA','2136',NULL,'Stopped','Probable Cause',NULL,NULL,NULL,NULL,NULL,NULL,NULL,'No/Null','Body Worn Camera, Juvenile','R/C for shoplifting at the Walcott General Store where the staff provided video of the two suspects inside the store. Officers observed the video and had just seen the suspect boarding a MBTA #32 bus at the intersection of HPA and Milton St.

Officers stopped the bus at XXXHPA and identified the suspects as;XXX XX/XX/XXXX- Numerous open F/A and Assault chargesXXX XX/XX/XXXX- Open assault charges

As officers approached XXXgrabbed his waistband and discarded a small folding knife. 

XXXinitially provided the nameXXX
Property was returned to the store. Both parties were FIOE''d and released.

L202F (DiPiro/McNulty)','No/Null','No/Null',NULL,'9/5/2023','21:11',2023,9,5);
INSERT INTO "fio_juvenile" VALUES ('FC23004586','9/25/2023 19:45','Cavaco, Cedric','Cavaco, Cedric','EDWARD NORTON','BENNINGTON','EAST BOSTON','MA','2108',NULL,'Observed','Intel',NULL,NULL,NULL,NULL,NULL,NULL,NULL,'No/Null','Juvenile, Gang','About 7:45pm on Monday 09/25/2023, Officers Cavaco and Maldonado in the G101F, while on patrol on Bennington Street, East Boston. Officers noticed a group of 6-7 individuals sitting on the steps in front of XXXBennington Street with 2 mopeds that appeared to have no registration attached, parked on the sidewalk outside of the residence. Officers recognized individuals known to Officers for past incidents of gang and drug affiliation in the group of individuals sitting outside of the address (XXX. Officers did not conduct and encounter at this moment and proceeded to lap the block and on a second go around officers noticed two of the individuals approach the mopeds with the rest of the group entering the building. Please note that Officers have seen these individuals the past couple days hanging in this area.','No/Null','No/Null',NULL,'9/25/2023','19:45',2023,9,25);
INSERT INTO "fio_juvenile" VALUES ('FC23004631','9/28/2023 17:56','Deluca, Zachary','Deluca, Zachary','AMYLEIGH DEVITO',NULL,'BOSTON','MA','2121',NULL,'Stopped','Probable Cause',NULL,NULL,NULL,NULL,NULL,NULL,NULL,'No/Null','Juvenile, Gun','Firearm arrest in the rear of XXXWashington Street.

Suspect -XXX

On scene, Officers observedXXXPrior F/A), XXX (Active M4), XXX (Active M4). 

All parties on scene were extremely hostile toward Officers. 

FIO''d to associate all parties and to document behavior towards Officers.

B102F (DeLuca/Donovan)','No/Null','No/Null',NULL,'9/28/2023','17:56',2023,9,28);
INSERT INTO "fio_juvenile" VALUES ('FC23004669','10/1/2023 0:00','KENNEDY, DALE','KENNEDY, DALE','PATRICK MORRISON','WASHINGTON ST','DORCHESTER','MA','2124',NULL,'Encountered','Encounter',NULL,NULL,NULL,NULL,NULL,NULL,NULL,'No/Null','Body Worn Camera, Juvenile','About 2:06 a.m., Saturday, October 1, 2023, Officer D Kennedy and Q Nguyen (H102A) gave a ride to XXX from XXXWashington St. to XXXWood Ave. XXXgave the name of XXX XXX. XXXgrandmother confirmed his proper name as XXX.','No/Null','No/Null',NULL,'10/1/2023','0:00',2023,10,1);
INSERT INTO "fio_juvenile" VALUES ('FC23004808','10/9/2023 20:46','HOSEA, JAMES','HOSEA, JAMES','DANIEL TRACEY','HANCOCK ST','DORCHESTER','MA','2125',NULL,'Encountered','Encounter',NULL,NULL,NULL,NULL,NULL,NULL,NULL,'No/Null','Body Worn Camera, Juvenile, Other Agency/Unit Notified','POSSIBLE DESTINATIONS FOR IF XXXLEAVES THE HOUSE AGAIN;

HANCOCK STREET TO BOWDOIN STREET

XXXGENEVA AVENUE #XXX (MOTHER''S HOUSE)

AREA OF TOPLIFF STREET 

AREA OF FIELDS CORNER','No/Null','No/Null',NULL,'10/9/2023','20:46',2023,10,9);
INSERT INTO "fio_juvenile" VALUES ('FC23004827','10/10/2023 22:35','KENNEDY, JESSE','KENNEDY, JESSE','JOHN BURROWS','COLUMBIA RD','DORCHESTER','MA','2121','25','Stopped','Probable Cause',NULL,NULL,NULL,NULL,NULL,NULL,NULL,'No/Null','Body Worn Camera, Juvenile','Officers while on patrol in the area of Washington St and Columbia Rd initially observed 2 individuals matching the description of an Armed Robbery that took place earlier in the shift with the suspects description being: "suspect #1 tall black male skinny build wearing a pink hoodie and suspect #2 black male wearing all black." Officers observed these individuals walking on Washington St towards Columbia Ave.

Officers looped the block and while attempting to locate them, observed individuals entering the rear courtyard of XXXColumbia Rd. Officers exited their cruisers and made entry into the courtyard. While in the courtyard the following individuals exited the stairwell to XXXColumbia Rd where there are multiple No Trespassing signs posted:

1) XXX DOB XX/XX/XXXX- Previous XXX interactions including being on scene where 2 F/A''s were recovered (See I232070802) and XXXwas summonsed for Trespassing at XXXWashington St. 

2) Saeda XXXDOB 04/20/2009 - Previous Affray arrest for incident I232068975 in A1 during an incident that involved a large group of Juveniles causing a disturbance.

During the interaction, XXXwas observed to be out of breath and stated that they were looking for their friend whose Aunt lives in the building. XXXdid not specify their friends name when asked. 

Officers also canvassed the staircase where both XXXand XXXexited from and encountered a resident on the top floor who stated that she observed both XXXand XXXattempt to come up to the top, but turned them away. This resident was advised to re-contact police if they return.

Both parties were frisked for weapons which yielded negative results. Both individual given a verbal warning for Trespassing, FIO''d and Released. 

C111F (Kennedy / R. Adams) & C202F (M. Rodriguez & Hooker)','No/Null','No/Null',NULL,'10/10/2023','22:35',2023,10,10);
INSERT INTO "fio_juvenile" VALUES ('FC23004840','10/10/2023 13:30','D''ADDIECO, SANTINO','D''ADDIECO, SANTINO','CHARLES MOORE',NULL,'EAST BOSTON','MA','2128',NULL,'Observed','Intel',NULL,NULL,NULL,NULL,NULL,NULL,NULL,'No/Null','Juvenile, Gang','Observed in the area of Putnam Street and Trenton Street suspected XXX associates XXX and XXX who were dressed in East Boston High School attire. XXXhas open firearm charges related to a person shot incident in the area of Tremont Street and Winter Street from May 2022. FIOE for intel purposes. 

YVSF','No/Null','No/Null',NULL,'10/10/2023','13:30',2023,10,10);
INSERT INTO "fio_juvenile" VALUES ('FC23004950','10/18/2023 19:45','LOPES, HENA','LOPES, HENA','KENNETH MACMASTER','DRAPER','BOSTON','MA','2122',NULL,'Stopped','Probable Cause',NULL,NULL,NULL,NULL,NULL,NULL,NULL,'No/Null','Warrant Arrest, Body Worn Camera, Juvenile','Warrant arrest of XXXD.O.B. XX/XX/XXXXat XXXDraper Street. XXXhad an outstanding Straight Warrant that was issued on 10/16/23 out of Dorchester Court for:

c.269 s.10AA- Possession Large Capacity 

c.269 s.10G- Possession Firearm without FID card

c.269 s.10TT- Possession Ammunition without FID card

c.1XXXs.131L/A- Improper Storage of Firearm 

XXXwas cordial towards the Officers. He was then transported to district C-11 for booking. 

XXXis an active member with XXX. 

FIOed for intel.

HK01F (Lopes/Millane).','No/Null','No/Null',NULL,'10/18/2023','19:45',2023,10,18);
INSERT INTO "fio_juvenile" VALUES ('FC23004970','10/19/2023 16:56','KENNEDY, JESSE','KENNEDY, JESSE','JAMES MOORE','BABSON ST','MATTAPAN','MA','2126','29','Encountered','Intel',NULL,NULL,NULL,NULL,NULL,NULL,NULL,'No/Null','Body Worn Camera, Juvenile, Gang','Officers responded to XXXBabson St for a B&E In Progress. Officers spoke to the victim XXX DOB XX/XX/XXXX(Active XXX). XXXstated that she recently made a report that the suspect XXX DOB XX/XX/XXXX(Open ADW) had been selling crack around children. XXXreported that XXXand the following individuals showed up to her residence at XXXBabson to retailiate:

XXXXXXr DOB XX/XX/XXXXmultiple prior FIO''s and present for F/A Arrests with XXX Members. Also has an open Misdemeanor Straight Warrant for Assault

There was also a juvenile female named XXXpresent during this incident but XXXcould not provide any further details on her.

A CJISWeb Inquiry also shows XXXto have an open Felony Straight Warrant out of Bristol County that was issued on 10/18. Due to XXXbeing the victim in this incident she was advised to go to court and clear the warrant.

FIO''d for Intel Purposes

C111F (Kennedy / R. Adams)','No/Null','No/Null',NULL,'10/19/2023','16:56',2023,10,19);
INSERT INTO "fio_juvenile" VALUES ('FC23005000','10/22/2023 21:20','FULLAM, PATRICK','FULLAM, PATRICK','PAUL DONLON','JAN KARSKI WAY','DORCHESTER','MA','2125',NULL,'Stopped','Probable Cause',NULL,NULL,NULL,NULL,NULL,NULL,NULL,'No/Null','Body Worn Camera, Juvenile','Officers responded to radio call for group of juveniles causing a disturbance inside of XXXJan Karski Way.

Officers have responded to dozens of radio calls in the area of the South Bay mall over the past months for similar disturbances involving juveniles. Officers stopped XXX attempting to leave the building after being confronted by security. Officers have previously arrested XXXfor armed robbery inside the South Bay parking lot (I232058905). CJIS query revealed no active warrants. All parties trespassed and released. 

FK01F (Burke/Fullam)','No/Null','No/Null',NULL,'10/22/2023','21:20',2023,10,22);
INSERT INTO "fio_juvenile" VALUES ('FC23005021','10/24/2023 18:03','Byrnes, Patrick','Byrnes, Patrick','EDWARD NORTON','SARATOGA ST','EAST BOSTON','MA','2128','87','Observed','Intel',NULL,NULL,NULL,NULL,NULL,NULL,NULL,'No/Null','Body Worn Camera, Juvenile, Gang','While recovering several stolen vehicles from the rear of XXXSaratoga Street, the calling party (refused to identify self) and his female significant other (also refused to identify self) stated that the individuals in the Brandywyne Village housing complex who are responsible for the recent string of stolen Kias/Hyundais live atXXX Brandywyne Drive. It should be noted that juvenile XXX (DOB XX/XX/XXXXwho found riding in a stolen Kia on 10/12/2023 (see #I232082340) resides at XXXBrandywyne Drive. It should also be noted that the last known address of active XXX gang member XXX (DOB XX/XX/XXXXnumerous prior firearm and 94C charges) is XXXBrandywyne Drive. FIOE for intel. 

-G101F (Byrnes, P./Hanton)','No/Null','No/Null',NULL,'10/24/2023','18:03',2023,10,24);
INSERT INTO "fio_juvenile" VALUES ('FC23005063','10/27/2023 19:24','FULLAM, RYAN JAMES','FULLAM, RYAN JAMES','KENNETH MACMASTER','HANCOCK ST','DORCHESTER','MA','2125',NULL,'Stopped','Probable Cause',NULL,NULL,NULL,NULL,NULL,NULL,NULL,'No/Null','Body Worn Camera, Juvenile, Gang, Gun','YVSF INVEST - XXXHancock St Dorchester.XXX (XXX Member) arrested in possession of a firearm. Officers located this firearm in XXXwaistband. Shortly thereafter Officers located a fanny pack style bag. In that fanny pack style bag, was an additional firearm. 

Within the same group of XXXthe following were congregating smoking Marijuana and drinking alcohol in the parking lot of the Hancock St. Laundry Mat. XXXAssociates:

 XXX 
Officers encountered the following also within this group:

 *XXX
It should be noted that XXXalluded and acknowledged to officers that he is recruiting young gang members from the XXX gang area to join XXX','No/Null','No/Null',NULL,'10/27/2023','19:24',2023,10,27);
INSERT INTO "fio_juvenile" VALUES ('FC23005074','10/27/2023 13:16','SENA, ASHLEY','SENA, ASHLEY','EDWARD BARRETT','GREENWOOD AVE','BOSTON','MA','2136',NULL,'Stopped','Probable Cause','2009','MA','ACCORD',NULL,'BLACK','4 Door, Sedan','Passenger Car/ Automobile','No/Null','Body Worn Camera, Juvenile','About 1:17 PM on Friday, October 27, 202XXX Officer Sena assigned to the L422D & Officer Mirville assigned to the L412D responded to a radio call for a FIGHT at XXXMetropolitan Avenue Boston, Ma (New Mission High School). 



Sgt. McCarthy & Officer XXXobserved a motor vehicle (MA REG XXX near XXX Greenwood Avenue with several males inside and understanding a fight was planned and weapons may be involved so officers made contact with the occupants. Officer McCarthy approached the drivers side and began to speak to the male in the drivers seat (XXXD.O.B.XX/XX/XXXX) while officer XXXapproached the passenger side of the vehicle. Due to excess tint on the passenger compartment windows officers requested that the windows be rolled down so the officers could safely interact with the occupants. 



Upon the rear window being rolled down Officer XXXobserved a male wearing black top and grey sweatpants sitting in the rear passenger seat. Officer XXXattention was immediately drawn to a pocket knife clipped to the males waistline. Due to the details of the call and the suspects son being pinged to that area Officer XXXimmediately removed the male (Identified as XXX D.O.B. XX/XX/XXXXfrom the vehicle. During the pat frisk of that male, Officer XXXremoved a pocket knife from his waistband, detained him into handcuffs and placed him in the rear of the L101Ds vehicle.



Officer Zagraphos (L101D) removed the front seat passenger (Identified as XXX and also recovered a pocketknife from his jacket pocket.



The remaining two parties (XXXD.O.B.XX/XX/XXXX & XXX D.O.B XX/XX/XXXXwere removed and frisked along with the vehicle with negative results.','No/Null','No/Null',NULL,'10/27/2023','13:16',2023,10,27);
INSERT INTO "fio_juvenile" VALUES ('FC23005093','10/29/2023 0:30','FULLAM, RYAN JAMES','FULLAM, RYAN JAMES','MICHAEL MCCARTHY','GIBSON ST','DORCHESTER','MA','2122',NULL,'Encountered','Intel',NULL,NULL,NULL,NULL,NULL,NULL,NULL,'No/Null','Juvenile, Gang','Gang related Intel

40 Gibson St- 00:30 10/29/2023. XXXwas arrested for firearm related charges (I232087409) in the area of a shot spotter activation on Topliff st. with ballistics confirmed recovered refer I232087406. Note the firearm that the Youth Violence Strike Force recovered from Mr. XXXwas fired to lock back.

Officer spoke to XXXat C-11 in cordial conversation. XXXself-admitted the following to Officer proactively. XXXreported that he is in a gang called XXX". XXXinformed officer this gang frequents the area of Colombia Rd. / Washington St. in the area of the Burger King. XXXwas clear that XXX" is "cool with" XXXgang but not the same thing. XXXreports the XXX" gang has older members and has been active since 2019. He stated that XXX" is "cool" with XXX, XXX, XXX and XXX. He stated they feud with "Wainwright, Wood Ave and Ruggles." He also stated he has issues with younger (EYG) gang associates. It should be noted that EYG associates are often FIOed in the area of Geneva Ave and Topliff St.','No/Null','No/Null',NULL,'10/29/2023','0:30',2023,10,29);
INSERT INTO "fio_juvenile" VALUES ('FC23005390','11/13/2023 18:09','MEANEY, COLE','MEANEY, COLE','JAMES MOORE','NORFOLK ST','BOSTON','MA','2124',NULL,'Stopped','Probable Cause',NULL,NULL,NULL,NULL,NULL,NULL,NULL,'No/Null','Body Worn Camera, Juvenile','It should be notedXXX (Masked Armed Robbery on BOP) and XXX (ABDW BB gun on BOP) were also present during the arrest. 

See 1.1','No/Null','No/Null',NULL,'11/13/2023','18:09',2023,11,13);
INSERT INTO "fio_juvenile" VALUES ('FC23005450','11/17/2023 20:10','Hanton, Robert','Hanton, Robert','EDWARD NORTON',NULL,'EAST BOSTON','MA','2128',NULL,'Encountered','Intel',NULL,NULL,NULL,NULL,NULL,NULL,NULL,'No/Null','Body Worn Camera, Juvenile','About 8:10PM on Friday 11/17/23, Officer Hanton in the G412F assisted on a radio call for vandalism in progress at the corner of Cottage and Porter Street, East Boston.

Upon arrival, we encountered a juvenile, XXX who was photographed by a witness stating that he was accompanying the suspect of the vandalism (graffiti on door to XXXPorter Street)XXX was transported to the station and released to his step-father without charges. XXX was also mentioned in an incident where he entered XXXPorter Street without permission. (No date or time was given for this incident)','No/Null','No/Null',NULL,'11/17/2023','20:10',2023,11,17);
INSERT INTO "fio_juvenile" VALUES ('FC23005754','12/9/2023 0:00','Auguste, Esther','Auguste, Esther','JOHN BROWN','CENTRE ST','JAMAICA PLAIN','MA','2130','0','Stopped','Encounter',NULL,NULL,NULL,NULL,NULL,NULL,NULL,'No/Null','Body Worn Camera, Juvenile','About 2:20 pm on Saturday, 12/09/23, Officers Auguste and Tilley in the J101D and Boston Housing Officer Stevens in the Z425, while conducting a Code 19 walk and talk at XXXCentre Street FIOE, two individuals in the common hallway.


Subject: 1 male identified asXXX(DOB XX/XX/XXXXSubject: 2 male identified as XXX (DOB XX/XX/XXXX

Subject 1 was smoking what smelled to be marijuana from officers'' training and experience. Officers were aware of the No trespassing order. Both individuals were pat-frisked, and no weapons were found. A verbal warning was given, and the subjects were informed to leave premise.','No/Null','No/Null',NULL,'12/9/2023','0:00',2023,12,9);
INSERT INTO "fio_juvenile" VALUES ('FC23005790','12/11/2023 8:38','Byrnes, Patrick','Byrnes, Patrick','CHARLES MOORE','FRANKLIN STREET','STONEHAM','MA','2180','0','Observed','Intel',NULL,NULL,NULL,NULL,NULL,NULL,NULL,'No/Null','Juvenile','Officer received information that several members of the group of juveniles suspected of being involved in numerous robberies, B&E''s and, auto thefts in the Orient Heights area (see #I232100556 and associated FIOE) were involved in a B&E incident at a smoke shop in Stoneham, MA on 12/7. Brothers XXXand XXX as well asXXX were arrested for the B&E by Stoneham Police. XXXtold the arresting officers that he was with 5 other individuals and they were in a red Kia sedan.

It should be noted that XXXwas arrested on 12/10 in East Boston for Possession of Burglarious Tools (screwdriver). It should also be noted that another member of the group,XXXwas recently arrested for a series of smoke shop burglaries in East Boston and Quincy.

Also arrested by Stoneham PD for the smoke shop B&E was XXX. XXXis well known to officers in East Boston and was arrested for a B&E in August 2023 (#I232062562). XXXwas also found riding in a vehicle being used without permission by a 13 year old driver in June 2023 (#I232043878). Additionally, a member of the group, XXX was alleged to be staying with XXXafter running away from home on 12/09 (#I232100026). 

Information forwarded to A7 detectives. FIOE for intel and to associate XXXwith group.

-G415F (Byrnes, P.)','No/Null','No/Null',NULL,'12/11/2023','8:38',2023,12,11);
INSERT INTO "fio_juvenile" VALUES ('FC23005802','12/12/2023 1:47','BANG, SEAN','BANG, SEAN','ALLISON ENG','WALDEMAR AVE','BOSTON','MA','2128','13','Encountered','Intel',NULL,NULL,NULL,NULL,NULL,NULL,NULL,'No/Null','Body Worn Camera, Juvenile','Officers were conducting CDXXX9 at the Vallar Road area due to the surge of the B&E business area and stolen motor vehicles around Orient Height. Officers observed XXX (DOB: XX/XX/XXXXa male, later identified asXXX (DOB: XX/XX/XXXXwalking out of XXX Vallar Road at approximately XXX:47 am on today''s date.

The officer conducted pat-frisked Mr. XXXfor weapons to no avail. Officers escorted Ms. XXX and Mr. XXXto XXX Vallar Road and spoke with XXX(DOB:XX/XX/XXXX).

G20XXXA (Bang/Shears) & GT55A (Pels)','No/Null','No/Null',NULL,'12/12/2023','1:47',2023,12,12);
INSERT INTO "fio_juvenile" VALUES ('FC23005876','12/16/2023 23:00','Shetrawski, Jake','Shetrawski, Jake','JAMES MOORE',NULL,'BOSTON','MA','2126','0','Stopped','Intel','2010','MA','COROLLA',NULL,'BLUE','4 Door, Sedan','Passenger Car/ Automobile','No/Null','Body Worn Camera, Juvenile','Officers observed XXX exit the passenger seat of MA Reg XXX(stolen vehicle) which was parked behind the Mildred School in Mattapan. Officers were able to quickly detain XXXbut as they approached the vehicle fled on Mildred St. towards Norfolk St. at a high rate of speed. Officers could observe the stolen vehicle to be occupied by at least 4 other individuals. Responding B3 units attempted a second traffic stop at the intersection of Morton St and Norfolk St, but the vehicle again fled. And the pursuit was discontinued. 

XXXwas transported to his residence at XXXTemple St. Mattapan and released forthwith. 

C421F Shetrawki','No/Null','No/Null',NULL,'12/16/2023','23:00',2023,12,16);
INSERT INTO "fio_juvenile" VALUES ('FC23005877','12/16/2023 22:39','Luna Jimenez, Carlos','Luna Jimenez, Carlos','LEONARDO HERNANDEZ','BENNINGTON ST','BOSTON','MA','2128',NULL,'Stopped','Intel',NULL,NULL,NULL,NULL,NULL,NULL,NULL,'No/Null','Body Worn Camera, Juvenile','About 10:39 pm on Saturday, 12/16/23, Officers Luna Jimenez and Guichard in the G201F conducted a Fio at XXXBennington Street, East Boston.

While patrolling, officers observed four individuals in front of XXXBennington StreetOfficers know the individuals from prior encounters due to multiple Breaking and enterings in the area.
Officers Proceeded to stop and FIO them. 

XXX was wearing a black hoodie with white letters saying Aeropostale and a blue pajamaXXX was wearing a cow pajamaXXX wore a black winter jacket and red and black checkered pants.
Officers were unable to identify one Lightskin male.

Officers recorded the encounter on a body-worn camera. I232102389','No/Null','No/Null',NULL,'12/16/2023','22:39',2023,12,16);
INSERT INTO "fio_juvenile" VALUES ('FC23005895','12/18/2023 18:00','Maldonado, Santiago','Maldonado, Santiago','EDWARD NORTON',NULL,'BOSTON','MA','2128',NULL,'Stopped','Intel','2020','MA','CAMRY',NULL,'BLACK','Sedan, 4 Door','Passenger Car/ Automobile','No/Null','Body Worn Camera, Juvenile','About 5:54 pm, 12/18/23, officers conducted a Traffic stop of a Black Toyota Camry bearing MA REG XXXfor 90/9D violation at Meridian St and Havre St, East Boston.

Officer spoke to the driver XXX XXXand gave a verbal warning for the violation. 

It should be noted that XXX has a BOP from 2022 for Armed Robbery. Also, during the interaction XXX referred to Paris Street as "P Street." 

Maldonado/Cavaco (G101F)','No/Null','No/Null',NULL,'12/18/2023','18:00',2023,12,18);
INSERT INTO "fio_juvenile" VALUES ('FC23005897','12/18/2023 20:51','Maldonado, Santiago','Maldonado, Santiago','EDWARD NORTON','BARNES AVE','EAST BOSTON','MA','2128',NULL,'Encountered','Encounter','2013','MA','MALIBU',NULL,'WHITE','4 Door, Sedan','Passenger Car/ Automobile','No/Null','Body Worn Camera, Juvenile','About 8:51 pm, 12/18/23, officers observed XXXexiting Woody''s Liquor on Barnes Ave. XXXwas observed to be accompanied by a Black Male, approximately 6''1 in height, thin build, wearing a black track suit-jacket, a black hat with red graphics, blue jeans, and facial hair. Also, a white female wearing cheetah-patterned leggings, a dark-colored hoodie, and blonde hair.
The officers observed the group walking towards a White Chevrolet Malibu bearing MA REG XXXThe group separated after acknowledging the officer''s presence, and the unknown male drove away. The female and XXXentered Woody''s Pizza at XXXBarnes Ave. 

The officers went around the block; upon returning (approximately 4 minutes from the first sighting), the officers observed that the White Chevrolet Malibu had returned and parked directly in front of Woody Liquor on Barnes Ave with the unknown male driver inside. The officers observed XXXto have one foot in the vehicle while holding the passenger door open to enter the vehicle. XXXupon acknowledging police presence, abandoned the vehicle and reentered Woody''s Pizza with the unknown female. The driver once again left the scene. 

Officers staged on Bayswater St and Barnes Ave for intel. 

Approximately 10 minutes later, the white Chevrolet returned and occupied the exact parking location, and the driver was observed entering Woody''s Liquor. Immediately upon the vehicle''s arrival, XXXdid not see officers posted on the corner of Bayswater and Barnes Ave and exited the establishment. 

Officers had a casual encounter with XXXto which he was confrontational. They voluntarily stated that the male is " my man" and that he "works for Woody''s LQ," "doing deliveries," and "I am with him." Explaining to officers that he is with the unknown but, not working. 

The officer documented the vehicle and the strange behavior for intel purposes. 

Maldonado/Cavaco (G101F)','No/Null','No/Null',NULL,'12/18/2023','20:51',2023,12,18);
INSERT INTO "fio_juvenile" VALUES ('FC23005911','12/16/2023 20:09','Ostholthoff, Tyler','Ostholthoff, Tyler','CHARLES CELLUCCI','POLK ST','CHARLESTOWN','MA','2129','4320','Stopped','Intel',NULL,NULL,NULL,NULL,NULL,NULL,NULL,'No/Null','Body Worn Camera, Juvenile, Gang','At about 8:00 PM on 12/16/23, Officers encountered (and eventually pat frisked)XXX (DOB XX/XX/XXXXat XXXPolk Street after he admitted to having a kitchen knife in his pocket because of "the smoke" he claimed he had in the projects. XXXstated he carries the knife for protection.

At one point Officers asked XXXwhat he goes by, and he replied, XXX. 

Officers recovered the knife from a pant pocket. During the stop, XXXfacetimedXXXDOB XX/XX/XXXXaffiliated with Charlestown Blood gang members, prior firearm-related charges, class B distribution, stolen MV). 

Officers recognized XXXimmediately and asked XXX"is that XXXXXXthen stated to XXX"yo, how they know your name?" XXXthen covered his face, but remained on the line. 

Both XXXand XXXwere cordial with Officers. 

BWCs activated. 

FIOE''d for intel. 

Ostholthoff/Monzon (AK15F)','No/Null','No/Null',NULL,'12/16/2023','20:09',2023,12,16);
INSERT INTO "fio_juvenile" VALUES ('FC23005929','12/20/2023 19:35','Horan, Sean','Horan, Sean','KENNETH MACMASTER','WASHINGTON ST','DORCHESTER','MA','2124',NULL,'Stopped','Probable Cause',NULL,NULL,NULL,NULL,NULL,NULL,NULL,'No/Null','Warrant Arrest, Body Worn Camera, Juvenile','Warrant Arrest of XXX at the KFC XXXWashington Street, Dorchester. 

Officers confirmed XXXwas staying in a program at the time of his arrest. Officers spoke to Program Director (XXX) who stated XXXfrequently hangs out with XXX XXXtold officers that XXXand XXXoften engage in criminal activity together and made mention that she heard from other children in the program that XXXoften makes statements alluding to him having a FA. 

FIOE for intel purposes and officer safety.

Horan (H437F)','No/Null','No/Null',NULL,'12/20/2023','19:35',2023,12,20);
INSERT INTO "fio_juvenile" VALUES ('FC23005972','12/22/2023 23:19','Scroggins, Frederick','Scroggins, Frederick','ALLISON ENG',NULL,'EAST BOSTON','MA','2128','0','Encountered','Intel',NULL,NULL,NULL,NULL,NULL,NULL,NULL,'No/Null','Body Worn Camera, Juvenile','About 11:19 pm on Friday, 12/22/2023, Officers responded to a vandalism in progress at London/Porter St, East Boston.

The caller stated that she observed a group of individuals Knocking down a stop sign. The caller did not identify the suspect who damaged the sign. The caller did not want to be involved and took a picture of the group and provided it to officers.

Upon arrival, the officers stopped several individuals and pat frisked for weapons to no avail. The group stated that the stop sign was already on the floor when they walked by. The officers weren''t able to determined the perpetrator. 

Subject 1: XXX
Subject 2: XXX
Subject 3:XXX
Subject 4: XXX
Subject 5: XXX
Subject 6: XXX (G412F)','No/Null','No/Null',NULL,'12/22/2023','23:19',2023,12,22);
INSERT INTO "fio_juvenile" VALUES ('FC23005976','12/23/2023 17:19','Maldonado, Santiago','Maldonado, Santiago','CHARLES MOORE','BENNINGTON ST','EAST BOSTON','MA','2128',NULL,'Stopped','Intel',NULL,NULL,NULL,NULL,NULL,NULL,NULL,'No/Null','Body Worn Camera, Juvenile, Gang','About 5:19 pm, 12/23/23, Officers patrolling the lower end of Bennington Street, passed by two individuals on the steps of XXXBennington Street. Officers have knowledge due to previous encounters with juveniles at the same address that the property has Trespass signs posted and visible to anyone that approaches the steps. 

The officers approached subject #1 XXX and subject #2 XXX and asked if they lived on the property; to which both responded in the negative. The officers also observed subject #1 to actively/openly be smoking a cigarette of marihuana. 

Officers frisked the subjects for weapons to no avail. The officers disposed of the substance and warned the subject of proper use in MA. 

It should be noted that subject #2 is related to XXX known to associate with a group of individuals that are criminally active in the East Boston Area. (FIOE #FC23005294)

G101F (Maldonado/Cavaco)','No/Null','No/Null',NULL,'12/23/2023','17:19',2023,12,23);
INSERT INTO "fio_juvenile" VALUES ('FC23005994','12/25/2023 21:15','Hanton, Robert','Hanton, Robert','EDWARD NORTON','MAVERICK SQ','EAST BOSTON','MA','2128',NULL,'Observed','Intel',NULL,NULL,NULL,NULL,NULL,NULL,NULL,'No/Null','Body Worn Camera, Juvenile','About 9:15PM on MondayXXX2/25/23, Officer Hanton and Byrnes in the G102F unit while on random patrol observed a group atXXX Maverick Square, East Boston.

While on patrol, officers observed a group of four males lighting what appeared to be marijuana. The group appeared to conceal what they were lighting once they noticed the patrol vehicle. Officers encountered four juveniles who admitted to the officers observations:

XX/XX/XXXXXXX XX/XX/XXXXXXX XX/XX/XXXX

Encounter documented to gather associations.

G102F (Hanton, Byrnes, R.)','No/Null','No/Null',NULL,'12/25/2023','21:15',2023,12,25);
INSERT INTO "fio_juvenile" VALUES ('FC24000104','1/8/2024 8:00','Atehortua, Kevin','Atehortua, Kevin','EDWARD NORTON','WHITE ST','EAST BOSTON','MA','2128','0','Stopped','Intel',NULL,NULL,NULL,NULL,NULL,NULL,NULL,'No/Null','Body Worn Camera, Juvenile','About 8:00 am on Monday, 01/08/2024, Officers Atehortua and Marifiote in the GK01D observed a male, who matched the description of a BRIC Flyer from 01/06/2024 for an Unarmed Robbery at XXXSaratoga Street, East Boston (I232104145). 

On the BRIC Flyer the suspect was wearing a black shiny jacket, khaki pants and white sneakers. Today the suspect was observed wearing the same shiny black jacket and khaki pants with black boots.

Officers observed the suspect get on the MBTA 117 Bus at Maverick Square. Officers observed the suspect get off the MBTA bus at Meridian and White Street. Officers in plainclothes with badges displayed and Boston Police patches affixed to their ballistic vests approached the suspect in front of XXXWhite Street and explained he fit the description of a previous incident. The suspect first told Officers his name wasXXX, but later gave his real name of XXX DOB XX/XX/XXXX

Should be noted on January 3, 2024, while driving up Brooks Street during patrol, the suspect was screaming profanities to officers as they drove by. The suspect was wearing the same exact shiny black jacket and khaki pants.','No/Null','No/Null',NULL,'1/8/2024','8:00',2024,1,8);
INSERT INTO "fio_juvenile" VALUES ('FC24000122','1/9/2024 8:00','MUSTACCHIO, MICHAEL','MUSTACCHIO, MICHAEL','JOHN SHAUGHNESSY','MEDFORD ST','CHARLESTOWN','MA','2129',NULL,'Encountered','Intel',NULL,NULL,NULL,NULL,NULL,NULL,NULL,'No/Null','Disabled, Juvenile, School','8AM on 1/9/24 Officers spoke to Sergeant Mark XXX(School Police) who informed them that XXXhad attacked a teacher on the previous day. XXXstated that XXXis scheduled back in school tomorrow (1/10/24) and threatened to bring a firearm to school. XXXis a special needs student','No/Null','No/Null',NULL,'1/9/2024','8:00',2024,1,9);
INSERT INTO "fio_juvenile" VALUES ('FC24000207','1/13/2024 19:00','Ostholthoff, Tyler','Ostholthoff, Tyler','CHARLES CELLUCCI','OLD IRONSIDES WAY','CHARLESTOWN','MA','2129','0','Stopped','Intel',NULL,NULL,NULL,NULL,NULL,NULL,NULL,'No/Null','Body Worn Camera, Child Present, Gang, Juvenile','At 7 PM on 1/13/24, Officers were patrolling Old Landing Way when their attention was drawn to two subjects, later identified as XXX (DOB XX/XX/XXXXand XXX(DOB XX/XX/XXXX- active Charlestown Blood associate), walking into XXXOld Landing Way. 

At the time, XXXwas wearing a black shiesty, and Officers believed he matched XXXphysical description. Officers were aware of an active Probation Violation Warrant for XXXarrest and know that he has occasionally, in the past, stayed at XXXOld Landing Way. 

Officers knocked on the door at XXXOld Landing Way, and an unidentified, young juvenile male answered the door. Officers asked him to "go get XXXbecause they needed to speak with him, at which time the young male responded, "hold on..." The male then ran to the bottom of the stairs to the second floor and shouted, "XXXmultiple times. 

XXXeventually came to the bottom of the stairs and informed Officers XXXleft the residence just prior to our arrival. Officers were then met by the home owner, XXX (DOB XX/XX/XXXXwho claimed there was nobody in the home named XXX
Officers explained who they were looking for and that they believed XXXhad entered the home with XXXand XXXeventually admitted XXXhad in fact been the person who entered the home with him. There were multiple other, unidentified female subjects and children in the home. 

XXXgave Officers consent to search the home. Officers searched the home, yielding negative results for XXX

FIOE''d for intel. 

Ostholthoff/McCullough/Kennedy (AK15F)','No/Null','No/Null',NULL,'1/13/2024','19:00',2024,1,13);
INSERT INTO "fio_juvenile" VALUES ('FC24000220','1/14/2024 0:00','Murray, Terrence','Murray, Terrence','JAMES MOORE','NORFOLK ST','BOSTON','MA','2126',NULL,'Encountered','Intel',NULL,NULL,NULL,NULL,NULL,NULL,NULL,'No/Null','Juvenile, Body Worn Camera, Gang','Casual encounter with following juveniles at XXXNorfolk St across from Walker Playground. 

XXXwas wearing a single black glove on his left hand and a ski mask covering his face.XXX continuously shouted that he had the "extended mag" in his pants and taunted officers to come frisk him. Officers approached the group who then became cordial and conversational. 

The group of youths are known to frequent Norfolk St and Walker playground and have been around firearm activity, B&E''s, and larceny''s over the past several months. 

Murray/Shetrawski','No/Null','No/Null',NULL,'1/14/2024','0:00',2024,1,14);
INSERT INTO "fio_juvenile" VALUES ('FC24000236','1/16/2024 21:43','MONZON, RENZO','MONZON, RENZO','MICHAEL MCCARTHY','ADAMS','BOSTON','MA','2129',NULL,'Stopped','Encounter',NULL,NULL,NULL,NULL,NULL,NULL,NULL,'No/Null','Juvenile, Body Worn Camera','On 01/16/24 around 9:43 pm Officers stopped XXX as a result of characteristics of an armed person in front of XXXAdams St, Floor 1 Dorchester. 

While Officers were on patrol in the area of Adams St, they observed three male parties. What caught the Officers attention was when the three males saw the black unmarked cruiser, they began clutching their waistband, they stopped walking and stated, "Is that Detects?" Once they realized that the Ford Explorer was in fact a Boston Police cruiser, the three males began sprinting Adams St towards Linden St. The Officers made their way East St, Dorchester Ave, and made a turn on Linden St. Once Linden St and Adams St, Officers observed a random bystander looking up Linden St towards Juliette St as if someone had just ran that way. 

Officers to make further observations, then went up Linden St towards Juliette St, and towards Fox St. On Fox St, the Officers observed three male parties hunched behind a cruiser. Once they observed the Officers they again took off running. Fearing that they discarded a weapon or narcotics Officers checked the area of Fox St to no avail. This continued on Hecla St, Lyon St, and Linden St. Where they would constantly duck behind a vehicle and continue sprinting away from Officers. Officers would quickly check the area and once they observed that no weapon or contraband was discarded continue following. Once on Linden St Officers observed the male parties run on Adams St. On Adams St the Officers were now behind the three male parties and they ran up the stairs of XXXAdams St and into the house. 

Officers heard yelling and commotion coming from inside of the house. Fearing that the male parties just broke in, Officer knocked on the door to make entry. A female party later identified as XXX opened the door, and observed immediately observed two little children in the residence. The Officers explained to XXXas to why they were and she stated that her son, XXX and an unknown male party just ran inside of her residence. Officers ordered the mother to make the males come outside. XXXthen stated that one ran out the back. 

In order to stop the other male from running away again, Officers entered the house and began speaking with XXXImmediately he became confrontational and began clenching his fists and bladed his stance. Officers began speaking with him and when XXXattempted to push past Officers he was guided to the ground and properly placed in handcuffs so that he could be detained. This was also because throughout the interaction XXXbegan making statements as if he wanted to fight. At this point in time multiple Youth Violence Strike Force Officers and C11 Officers arrived on scene. 

Once everything was settled, Officer explained to XXX(the mother and a resident of floor 1) that they believed that they could have discarded a weapon, specifically a firearm, and they were concerned for the safety of the young children. XXXstated that the Officers could check the residence. Officers checked to no avail. 

XXXwas informed of the Youth Connect Program and if she needed assistance she could reach out at her convenience. 

Officers were able to FIOE both XXXand XXXand released them.','No/Null','No/Null',NULL,'1/16/2024','21:43',2024,1,16);
INSERT INTO "fio_juvenile" VALUES ('FC24000278','1/21/2024 16:28','Byrnes, Patrick','Byrnes, Patrick','EDWARD NORTON','WEBSTER ST','EAST BOSTON','MA','2128','32','Observed','Intel',NULL,NULL,NULL,NULL,NULL,NULL,NULL,'No/Null','Juvenile, Body Worn Camera','Officers responded to XXXWebster Street for an RO violation. Officers are extremely familiar with this location as it is the home of XXX XX/XX/XXXXand her family. XXXis a juvenile who is the subject of frequent calls for service due to her behavior, relationships, and frequent runaway status. Officers are also aware of the existence of an active restraining order (Docket XXXfiled by XXXs mother) on her behalf against her adult male boyfriend, well known to officers as XXX (DOB XX/XX/XXXXXXX had already departed upon officers arrival.

XXX has a lengthy juvenile BOP (27 entries- numerous A&B, ABDW, Unarmed Robbery, Larceny of MV, Firearm Possession w/o FID, Strangulation, Witness Intimidation). XXX''s BOP and RO information cannot be located on CJIS by searching his license number or full name. This information only be found on CJIS by searching XXXwith his birth date. FIOE for intel.

-G101F (Byrnes, P./Sanchez)','No/Null','No/Null',NULL,'1/21/2024','16:28',2024,1,21);
INSERT INTO "fio_juvenile" VALUES ('FC24000464','2/1/2024 20:05','MEDRANO, SERGIO','MEDRANO, SERGIO','JOHN BROWN','CENTRE ST','JAMAICA PLAIN','MA','2130',NULL,'Stopped','Intel',NULL,NULL,NULL,NULL,NULL,NULL,NULL,'No/Null','Juvenile, Gang, Gun','YVSF

Officers made an on-site firearm arrest of XXX (DOB XX/XX/XXXXin the hallway XXXCentre st. XXXand the following were loitering in the hallway of XXXcentre st. Bromley Heath DevelopmentXXXDOB XX/XX/XXXXXXX DOB XX/XX/XXXX
XXX XX/XX/XXXXXXX DOB XX/XX/XXXXXXX DOB XX/XX/XXXX
During the booking process XXX admitted to being a Heath St gang member.

VK06','No/Null','No/Null',NULL,'2/1/2024','20:05',2024,2,1);
INSERT INTO "fio_juvenile" VALUES ('FC24000654','2/12/2024 14:40','FOLEY, ERIC','FOLEY, ERIC','DANIEL TRACEY',NULL,'BOSTON','MA','2124',NULL,'Stopped','Intel',NULL,NULL,NULL,NULL,NULL,NULL,NULL,'No/Null','Body Worn Camera, Juvenile','SS of XXXandXXX at Welles Ave and Washington St in relation to an on-going investigation.

XXXwas wearing a black head wrap with a distinct red X, black sunglasses, white sweatshirt, blue jeans and distinct gray Jordan sneakers and a black backpack. In the BOLO disseminated, Officers observed the suspect wearing the same gray sneakers, black sunglasses and black face covering with a red X on it.

XXX was wearing a black puffy style jacket, black pants, black crocs with white attachments on the top of the crocs and a black backpack with distinct gray/clear air bubble straps. In the BOLO disseminated, Officers observed the suspect wearing the same black puffy style coat, black pants, black crocs with white attachments on the top of them and the same backpack with the gray/clear bubble style straps.

XXXstated he attends the Henderson School and is in theXXX grade. XXXmother''s phone number is XXX. XXXstated he attends the Henderson school and is in theXXX grade.

The H808 (Det Harte) was notified. FIO''d and released.

H102D (E. Foley/M. Russell)','No/Null','No/Null',NULL,'2/12/2024','14:40',2024,2,12);
INSERT INTO "fio_juvenile" VALUES ('FC24000906','2/28/2024 11:29','Benoit, Samuel','Benoit, Samuel','CARL BLANDO','G ST','SOUTH BOSTON','MA','2127',NULL,'Stopped','Intel',NULL,NULL,NULL,NULL,NULL,NULL,NULL,'No/Null','Juvenile, Body Worn Camera','About 11:29 AM on Wednesday, 02/28/24, Officer Benoit/Lepore in the F201D, responded to a radio call for a Breaking and Entering at XXXG St, South Boston. 

Multiple C6 Units responded:

Upon Arrival, Officers made contact with a total of 3 juveniles who were later identified as subject 1 DOB: XX/XX/XXXXXXX subject 2 DOB: XX/XX/XXXXXXX, subject 3 DOB: XX/XX/XXXXXXX Officers questioned the juveniles which stated they left school to smoke and were in the area of XXXG St to find somewhere to smoke. The juveniles stated that they attended Excel High School located at XXXG St, South Boston. Officers contacted the school for confirmation of the names of the juveniles and whether or not the attended the school.

Officer observed no break to the residence, but let it be known that subjectXXXgave the name XXXXX which was incorrect and subject 2 XXX gave the nameXXX which was incorrect.

Note that there was a witness at the scene who stated that she seen the juveniles at the above address, but did not want to share her information.

BW Cameras Activated.','No/Null','No/Null',NULL,'2/28/2024','11:29',2024,2,28);
INSERT INTO "fio_juvenile" VALUES ('FC24000939','3/1/2024 8:45','FOLEY, ERIC','FOLEY, ERIC','MICHAEL MCCARTHY','FULLER ST','DORCHESTER','MA','2124',NULL,'Stopped','Intel',NULL,NULL,NULL,NULL,NULL,NULL,NULL,'No/Null','Juvenile, Body Worn Camera','SS of XXX andXXXat XXXFuller Street. Officers recognized both individuals from a recent BOLO disseminated by C-11 detectives. XXXwas wearing the same, very unique XXX" back pack along with the same hair style as depicted in the BOLO. XXXhas been stopped and FIO''d in regards to the same incident by Officer E. Foley on a prior date withXXX. 

FIO''d and released. C-11 Detectives notified. 

H102D (E. Foley/MacPherson)','No/Null','No/Null',NULL,'3/1/2024','8:45',2024,3,1);
INSERT INTO "fio_juvenile" VALUES ('FC24001032','3/7/2024 9:08','Benoit, Samuel','Benoit, Samuel','ALAN PERKINS','BOSTON ST','DORCHESTER','MA','2125',NULL,'Stopped','Intel',NULL,NULL,NULL,NULL,NULL,NULL,NULL,'No/Null','Juvenile, Body Worn Camera','About 9:08 AM on Thursday, 03/07/24, Officer Benoit/Tejada in the F102D responded to a radio call for a Breaking and Entering at XXXBoston St.

Upon Arrival, Officers made contact with three juveniles at the above location later identified as suspect 1 (XXX) DOB: XX/XX/XXXXsuspect 2XXX XX/XX/XXXXand suspect 3 XXX XX/XX/XXXXOfficers questioned the individuals about attempting to break into properties in the area to which they answered that they were just looking for a place to smoke before school. Officers confirmed that the three juveniles did attend Boston Collegiate Charter School. Officers did not observe there to be any force entry. 

As a result, Officers confiscated a marijuana joint from the juveniles and informed them to go to school.

Note, that the three juveniles were in fact trespassing and were fully cooperative with Officers. 

Body Worn Cameras Activated.','No/Null','No/Null',NULL,'3/7/2024','9:08',2024,3,7);
INSERT INTO "fio_juvenile" VALUES ('FC24001071','3/9/2024 15:34','SCHAIN, RYAN','SCHAIN, RYAN','JOHN BROWN',NULL,'JAMAICA PLAIN','MA','2130',NULL,'Stopped','Intel',NULL,NULL,NULL,NULL,NULL,NULL,NULL,'No/Null','Gang, Juvenile','YVSF Intel - VK23

Casual conversation with the aboveXXX associates. They were in the presence of a young juvenile approximately 13-14 years old. The juvenile had a bulge in the right side of his puffy winter coat, despite his cell phone being in another pocket, and further bladed his side away as the officers approached. He was frisked without incident. The juvenile would not provide his real identity, and claimed his name was XXX," with dates of birth of: XX/XX/XXXX','No/Null','No/Null',NULL,'3/9/2024','15:34',2024,3,9);
INSERT INTO "fio_juvenile" VALUES ('FC24001145','3/13/2024 8:00','FOLEY, ERIC','FOLEY, ERIC','MICHAEL MCCARTHY','BOWDOIN ST','DORCHESTER','MA','2122',NULL,'Stopped','Probable Cause',NULL,NULL,NULL,NULL,NULL,NULL,NULL,'No/Null','Juvenile, Body Worn Camera','On-site warrant arrest of XXX for multiple firearm related offenses in regard to a shooting that took place on Topliff St in October. During booking, XXXself-admitted to being affiliated with Crown Path/Claybourne St. XXXalso stated he "rocks with" XXXSt members and that XXX is his cousin. 

FIO''d for intel.

H104D (E. Foley/M. Russell)','No/Null','No/Null',NULL,'3/13/2024','8:00',2024,3,13);
INSERT INTO "fio_juvenile" VALUES ('FC24001181','3/15/2024 17:53','Maldonado, Santiago','Maldonado, Santiago','ALLISON ENG',NULL,'EAST BOSTON','MA','2128',NULL,'Stopped','Intel',NULL,NULL,NULL,NULL,NULL,NULL,NULL,'No/Null','Gun, Body Worn Camera, Juvenile','At about 5:53 on 03/15/24, officers were flagged at the intersection of Border Street and Maverick Street, East Boston, by a concerned citizen. 

The citizen stated, "There are three men in hoodies going around the block pulling on car doors," as he pointed toward Liverpool Street with his index finger. Officers patrolled the area and observed three males averaging the ages 18 - 21 years of age:

 * subject 1 of thin build, wearing a black graphic hoodie/jacket with red pants (XXX * subject 2, heavy build, wearing a navy blue puffer jacket, black under a hoodie, black ski mask, and sweatpants
 * subject 3, of thin build, unknown color hoodie, black ski mask, and what appeared to be sweatpants. 
Officers approached the subjects at the corner of Landing Street and Liverpool Street. The subjects acknowledged the presence of officers, and a foot chase ensued. Officers identified XXX out of three. 

It should be noted that XXXhas an extensive BOP with the following:

FIR CARRY W/AMM; FIR POSS WO PERM; AMMO NO FID CARD; ROB ARM. 

FIOE for intel purposes.','No/Null','No/Null',NULL,'3/15/2024','17:53',2024,3,15);
INSERT INTO "fio_juvenile" VALUES ('FC24001188','3/16/2024 2:30','KEOHAN, BRENDAN','KEOHAN, BRENDAN','JAMES MOORE','MORA ST','DORCHESTER','MA','2124','30','Stopped','Probable Cause',NULL,NULL,NULL,NULL,NULL,NULL,NULL,'No/Null','Juvenile','About 2:30AM on Saturday, 03/16/24, officers on-sited a B&E to MV (MA REG: XXX at Washington Street and Stockton Street.

While traveling on Washington Street, officers observed four black males who appeared to be juveniles standing around a parked white sedan on the corner of Washington and Stockton St. Upon initial observation the four males observed the unmarked police car and proceeded to move around in different directions raising officer''s suspicion. Officers conducted a U-turn and approached the group who then proceeded to break in two different directions (2 males ran towards Washington Street, 2 males ran down Stockton Street and cut into a fence of the left-hand side of the street). Officers continued to canvass the area when the observed two males in the area of XXXMora Street appear to crouch behind a parked car as officers approached. Officers were able to stop both juvenile parties. Both males were both heavily panting as if they were just running. Both juveniles were initially untruthful. Both frisked to no avail. Photos attached. XXXXXX XX/XX/XXXXwearing a black shiesty mask, black bubble jacket, black sweatpants, maroon Jordan sneakers.

2.XXX (DOB: XX/XX/XXXXwearing blue hospital mask, a black winter jacket, black sweatpants, and black with yellow trim Jordan sneakers

HK01A (Keohan/Zammito)','No/Null','No/Null',NULL,'3/16/2024','2:30',2024,3,16);
INSERT INTO "fio_juvenile" VALUES ('FC24001340','3/26/2024 14:45','FULLAM, PATRICK','FULLAM, PATRICK','CARL BLANDO','ALLSTATE RD','DORCHESTER','MA','2125',NULL,'Stopped','Probable Cause',NULL,NULL,NULL,NULL,NULL,NULL,NULL,'No/Null','Body Worn Camera, Juvenile','Officers while working the South Bay mall were alerted by Home Depot loss prevention of a shoplifter running away from the store after taking a pocket knife. Officers observed a black male running through the parking lot away from loss prevention. Officers stopped the male, identified as XXX, who stated he had not taken anything. A pat frisk yielded negative results for weapons or stolen merchandise. XXXprovided the name XXX before giving officers his information. XXXwas returned to his home at XXXBarry St.','No/Null','No/Null',NULL,'3/26/2024','14:45',2024,3,26);
INSERT INTO "fio_juvenile" VALUES ('FC24001353','3/26/2024 21:15','Foley, Michael','Foley, Michael','MICHAEL MCCARTHY',NULL,'BOSTON','MA','2124',NULL,'Stopped','Probable Cause',NULL,NULL,NULL,NULL,NULL,NULL,NULL,'No/Null','Body Worn Camera, Juvenile','S/S at Washington Street and Talbot Ave of a male later identified asXXX XX/XX/XXXXmatching the description of the suspect from an armed robbery (I242024569) that took place at the "Century Convenience" store at XXXBlue Hill Avenue approximately 25 minutes prior who was wearing a black bubble jacket, black pants and black sneakers.

XXXwas frisked yielding negative results.

Once officers and B-3 detectives confirmed XXXwas not the suspect he was released forthwith.

C113F (M.Foley/Sandoval)','No/Null','No/Null',NULL,'3/26/2024','21:15',2024,3,26);
INSERT INTO "fio_juvenile" VALUES ('FC24001481','4/4/2024 0:29','Petruzziello, Jillian','Petruzziello, Jillian','JOHN BURROWS','ATHELWOLD ST','DORCHESTER','MA','2124','44','Encountered','Encounter',NULL,NULL,NULL,NULL,NULL,NULL,NULL,'No/Null','Juvenile, Gang, Body Worn Camera','Officers responded to a group home at XXXAthelwold Street due to suspects from a fight earlier in the night returning to the area. 

Officers spoke with the suspects (XXXand XXX) who stated that XXX tried to fight them earlier that night because XXXis "H-Block", and he believed XXXmay be involved with "Heath St." 

XXXand XXXboth stated that they grew up in the North Shore and do not have any ties to the area.

XXXfought another individual (XXX at the same location on 2/24/24 because he believed that he was affiliated with "XXX XXXstated that he is not affiliated with the gang, but he did grow up in XXXand XXXmisunderstood him.

Officers are aware that XXXandXXX are rivals withXXX but do not have any reason to believe that these individuals are associated with the groups. 

FIOE for intel.

-C112A (Petruzziello/Milien)','No/Null','No/Null',NULL,'4/4/2024','0:29',2024,4,4);
INSERT INTO "fio_juvenile" VALUES ('FC24001537','4/6/2024 1:55','Foley, Michael','Foley, Michael','JAMES MOORE','NORWELL ST','DORCHESTER','MA','2121',NULL,'Stopped','Probable Cause','2005','MA','COROLLA',NULL,NULL,'4 Door, Sedan','Passenger Car/ Automobile','No/Null','Juvenile','T/S of a stolen gray Toyota Corolla MA REG XXXat New England Ave and Talbot Ave.

The vehicle was occupied by five males as it fled from the traffic stop. (refer to 242027546) Officers located the vehicle unoccupied shortly after in front of XXX Norwell Street. After multiple B-3 and B-2 units responded and canvassed the immediate area officers located XXX hiding in a property off of Washington Street.

XXXwas detained and interviewed by B-3 detectives during which time he explained that he did not know who the operator of the vehicle was and one of his buddies XXXwas also in the vehicle with him but did not provide any further information. XXXadded that the operator was wearing a Ski mask and a grey sweatshirt.

XXXwas released after questioning.

CG01A (M.Foley/Mulrean)','No/Null','No/Null',NULL,'4/6/2024','1:55',2024,4,6);
INSERT INTO "fio_juvenile" VALUES ('FC24001556','4/8/2024 1:08','McPherson, Eric','McPherson, Eric','CHRISTOPHER CARROLL','HARRISON AVE','BOSTON','MA','2118',NULL,'Encountered','Intel',NULL,NULL,NULL,NULL,NULL,NULL,NULL,'No/Null','Body Worn Camera, Gang, Juvenile','Officers performed a CD7 to the residence of XXX (DOB: XX/XX/XXXXActive XXX located at XXXHarrison Ave. While in officers presence waiting for his mother to come take custody of him Mr. XXXcan be heard making the following statement numerous times "Free Bromley, Fuck Mission Hill" and also making statements such as" bouta go roll up some Dre in a blunt".

Captured on officers BWC.

FIO''d for Intel.

B101A (McPherson, Colpoys).','No/Null','No/Null',NULL,'4/8/2024','1:08',2024,4,8);
INSERT INTO "fio_juvenile" VALUES ('FC24001601','4/4/2024 17:00','Ostholthoff, Tyler','Ostholthoff, Tyler','CHARLES CELLUCCI',NULL,'BOSTON','MA','2129','0','Observed','Intel',NULL,NULL,NULL,NULL,NULL,NULL,NULL,'No/Null','Other Agency/Unit Notified, Juvenile','At 5 PM on 4/4/24, Officers were patrolling Medford Street when they observed two juvenile male subjects known to Officers as XXX (DOB XX/XX/XXXXand his younger, half-brother, XXXXXX(unknown DOB) walking on Tufts Street toward Bunker Hill Street. 

Officers observed XXX(wearing a green coat and blue hospital mask) look back and appear to notice Officers'' unmarked cruiser as it traveled past Tufts Street (going toward Charlestown HS). At that point, Officers observed XXXabruptly grab his front waistband with both hands, take an exaggerated "drop step," and pretend to run. He quickly stopped after several steps but pretended to run several more times before Officers lost sight of him. 

While XXXwas doing that, XXXappeared to take his phone out and record him. 

Officers almost immediately re-located XXXand XXXand engaged them in casual conversation. They were cordial, did not show signs of possessing a weapon, and did not run. 

FIOE for intel. 

Ostholthoff/McCullough (AK15F)','No/Null','No/Null',NULL,'4/4/2024','17:00',2024,4,4);
INSERT INTO "fio_juvenile" VALUES ('FC24001624','4/12/2024 21:47','MIllane, Brandon','MIllane, Brandon','STEVEN CICCOLO','GENEVA AVE','DORCHESTER','MA','2122',NULL,'Stopped','Probable Cause',NULL,NULL,NULL,NULL,NULL,NULL,NULL,'No/Null','Juvenile, Body Worn Camera','R/C for Larceny IP at the Target Department Store located at XXXGeneva Ave. Officers stopped and identified the following individuals matching the description given in the CAD Notes: (XXX. Officers observed (XXX) with various items and snacks that he stated he took from Target. Verbal warning issued to all parties not to return to Target. Parties FIO''d and released. Photographs of these individuals are attached for future reference. 

Millane/Mulvey (HK01F)','No/Null','No/Null',NULL,'4/12/2024','21:47',2024,4,12);
INSERT INTO "fio_juvenile" VALUES ('FC24001687','4/18/2024 17:00','Ostholthoff, Tyler','Ostholthoff, Tyler','CHARLES CELLUCCI','TREMONT ST','BOSTON','MA','2111','0','Stopped','Probable Cause',NULL,NULL,NULL,NULL,NULL,NULL,NULL,'No/Null','Juvenile, Drugs','Officers stopped XXXDOB XX/XX/XXXX- ABDW BB Gun out of Middlesex Juvenile - trespassing inside the MBTA Park Street Station exit stairwell in front of XXXTremont St with a large group of known drug users. 

Officers stopped XXXlast week trespassing on the front steps to St. Paul''s Church (XXXTremont Street), explained the Massachusetts trespassing law to him, and released him with a warning. 

Today, as Officers stopped the group trespassing inside the MBTA Park Street Station exit stairwell, XXXattempted to flee by running down the "upward-moving" escalator and into Park Street Station. Officers were able to stop him.

XXXadmitted to having marijuana on his person. Officers did locate a plastic bag inside his fanny pack with crack cocaine residue inside. XXXstated the plastic bag was not his and did not know where it came from. 

When Officers asked if he was storing any additional drugs in-between his glutes, he immediately reached inside the rear of his pants and returned with a handful of feces. 

Officers assisted XXXin cleaning his hands, ensured he did not require EMS for a medical condition, and released him with another trespassing warning. XXXstated he would return immediately to his home in Sommerville. 

FIOE''d to associate XXXto Tremont St. 

Ostholthoff/McCullough (AK15F)','No/Null','No/Null',NULL,'4/18/2024','17:00',2024,4,18);
INSERT INTO "fio_juvenile" VALUES ('FC24001969','5/8/2024 18:15','O''ROURKE, DENNIS','O''ROURKE, DENNIS','SEAN WILBANKS','WASHINGTON ST','BRIGHTON','MA','2135',NULL,'Stopped','Probable Cause',NULL,NULL,NULL,NULL,NULL,NULL,NULL,'No/Null','Body Worn Camera, Drugs, Juvenile','Offcs responded to r/c for kids smoking marijuana in hallway of building. Offcs were able to identifyXXX who is a suspect in B/E to Boston Smokeshop. (I242030710) XXXwas wearing black hoodie, black pants, with black slides. XXXwas with female(jv) XXX FIO''d and released.

K202F(Stewart/O''Rourke"

BWC activated.','No/Null','No/Null',NULL,'5/8/2024','18:15',2024,5,8);
INSERT INTO "fio_juvenile" VALUES ('FC24001998','5/11/2024 12:32','Alves, Ineida','Alves, Ineida','PATRICK MORRISON','DORCHESTER AVENUE','DORCHESTER','MA','2122',NULL,'Stopped','Probable Cause',NULL,NULL,NULL,NULL,NULL,NULL,NULL,'No/Null','Body Worn Camera, Juvenile','Officers responded to a R/C for a vandalism in progress at XXXDorchester Avenue, Dorchester.

Victim stated three teenage suspects habitually harass the store and showed Officers video footage of the incident.

While canvassing the nearby area, one suspect matching the description (blue and white pajama pants, and a black playboy decal sweatshirt) was stopped on Draper Street and identified asXXX (DOB: XXXwas verbally trespassed from the store. FIO''ed and released.

H415D (Alves) H536D (Carnell)','No/Null','No/Null',NULL,'5/11/2024','12:32',2024,5,11);
INSERT INTO "fio_juvenile" VALUES ('FC24002019','5/12/2024 22:20','Clark, Ty','Clark, Ty','KENNETH MACMASTER','WRENTHAM ST','DORCHESTER','MA','2124',NULL,'Stopped','Probable Cause',NULL,NULL,NULL,NULL,NULL,NULL,NULL,'No/Null','Gun, Juvenile, Body Worn Camera','Radio call for BE/MVIP in the area of Wrentham Street and Florida Street resulting in the firearm arrest of XXX (See I#242038558)

The following individuals were present:

XXX XX/XX/XXXXwearing black shiesty, black puffy coat, black hoodie, black sweatpants, and purple and black sneakersXXX XX/XX/XXXXwearing black surgical mask, black hoodie with lime green letters on the right breast, black jeans, black and white sneakers.XXXd XX/XX/XXXXwearing black NIKE hoodie grey jeans, and black sneakers.

XXXXX/XX/XXXXwearing blue surgical mask, black hoodie, grey jeans, white and black sneakers.

XXX XX/XX/XXXXwearing black shiesty, black hoodie, black sweatpants, and black and yellow sneakers.

See attached photos

All parties on scene gave multiple fake names to officers. (XXX)

A pat frisk was conducted of all 5 suspects resulting in a firearm being recovered from XXX''s front left jacket pocket.

FIOE to associate parties with one another/ to the area. 

HK01F Clark/Garvey','No/Null','No/Null',NULL,'5/12/2024','22:20',2024,5,12);
INSERT INTO "fio_juvenile" VALUES ('FC24002040','5/13/2024 17:23','Marchand, Brian','Marchand, Brian','JOHN SHAUGHNESSY','TREMONT ST','BOSTON','MA','2108',NULL,'Stopped','Probable Cause',NULL,NULL,NULL,NULL,NULL,NULL,NULL,'No/Null','Body Worn Camera, Juvenile','About 5:23pm, on 05/13/24, Officers conducted a subject stop at the Brewer Fountain in the Boston Common.

Officers were on patrol when they observed a male in a red hooded sweatshirt throw trash on the ground several feet away from the bench he was sitting on.

Officers exited their cruiser at which point the individual immediately stood up and began walking away from them. Officers called out to the individual who then took off running. A short foot chase ensued and Officers were able to stop the individual and identify him asXXX(DOB XX/XX/XXXXOfficers conducted a pat-frisk which yielded negative results for weapons.

XXXstated that he wasn''t sure why he ran and that it was "just instinct". Officers explained to him that they were stopping him for littering. XXXwas cordial with officers and agreed to pick up the trash and throw it away.

XXXstated he had recently run away from a program but he had returned to the program and his curfew was 7pm.

Officers gave XXXa verbal warning for littering.

FIO''ed and released.

AK15F (Marchand/Hiltunen)','No/Null','No/Null',NULL,'5/13/2024','17:23',2024,5,13);
INSERT INTO "fio_juvenile" VALUES ('FC24002149','5/20/2024 11:38','SCHAIN, RYAN','SCHAIN, RYAN','DANIEL KEANE','CENTRE ST','JAMAICA PLAIN','MA','2130',NULL,'Encountered','Intel',NULL,NULL,NULL,NULL,NULL,NULL,NULL,'No/Null','Juvenile, Gang','YVSF Intel - VK23 XXX associates loitering in front of Evelyn''s Market and blocking the entrance. Casual conversation and cleared the doorway.','No/Null','No/Null',NULL,'5/20/2024','11:38',2024,5,20);
INSERT INTO "fio_juvenile" VALUES ('FC24002235','5/25/2024 2:28','Richard, Zachary','Richard, Zachary','DONALD KEENAN','BERKELEY ST','BOSTON','MA','2116',NULL,'Stopped','Encounter',NULL,NULL,NULL,NULL,NULL,NULL,NULL,'No/Null','Juvenile, Body Worn Camera','About 2:28am on 5/25/24 R/C for Assault in Progress at XXXBerkeley St, Boston (Revolution).

Caller reports 4 females assaulted him.

Officers were able to stop 2 females that were involved, later identified asXXX XX/XX/XXXXandXXX XX/XX/XXXX
XXX gave officers a fake name ofXXX gave officers a fake name of XXX initially with the date of birth XX/XX/XXXXthen XX/XX/XXXX
CJIS inquiry revealedXXX (7) on BOP, all open cases including A&B (x3), ABDW, Unarmed Robbery, and Malicious Destruction of Property.

CJIS inquiry revealed XXX (2) on BOP, both open cases including Unarmed Robbery and A&B.

FIOEd for intel purposes.

D103A (Richard, Tucker)','No/Null','No/Null',NULL,'5/25/2024','2:28',2024,5,25);
INSERT INTO "fio_juvenile" VALUES ('FC24002240','5/26/2024 2:18','Marchionda, Michael','Marchionda, Michael','THOMAS PRATT',NULL,'DORCHESTER','MA','2121',NULL,'Stopped','Probable Cause','2020','MA','ALTIMA',NULL,'WHITE','4 Door, Sedan','Passenger Car/ Automobile','No/Null','Juvenile, Body Worn Camera','Officers observed MA Reg XXXtraveling down Blue Hill Ave with no lights on (90/7). Officers observed the vehicle turn right onto Columbia Rd, Officers were able to get behind the vehicle and activate their emergency lights and sirens. The vehicle initially failed to stop for Officers before coming to a stop on Stanley St. Officers identified the operator as XXX(No BOP) who stated that the vehicle was his mothers, and he did not have a license. XXXalso informed Officers he did not stop because he was scared. A pat frisk of XXXand the vehicle yielded negative results.

FIO''d to associate with vehicle.

XXXand vehicle released to parents; verbal warning issued.

B103A (Marchionda/Flores)','No/Null','No/Null',NULL,'5/26/2024','2:18',2024,5,26);
INSERT INTO "fio_juvenile" VALUES ('FC24002341','6/2/2024 17:05','MEANEY, COLE','MEANEY, COLE','JAMES MOORE','MORTON ST','DORCHESTER','MA','2126',NULL,'Stopped','Probable Cause',NULL,NULL,NULL,NULL,NULL,NULL,NULL,'No/Null','Juvenile, Body Worn Camera','Subject Stop of XXX at XXXMorton Street resulting in a warrant arrest.

Also present at the arrest were XXX, and other unknown male and female individuals.

FIO for intel

Meaney / Cox','No/Null','No/Null',NULL,'6/2/2024','17:05',2024,6,2);
INSERT INTO "fio_juvenile" VALUES ('FC24002416','6/7/2024 9:30','FOLEY, ERIC','FOLEY, ERIC','KENNETH MACMASTER','WASHINGTON ST','DORCHESTER','MA','2124',NULL,'Stopped','Probable Cause',NULL,NULL,NULL,NULL,NULL,NULL,NULL,'No/Null','Juvenile, Body Worn Camera','SS of XXX for shoplifting at XXXWashington St (CVS). Officers removed candy from XXXand returned it to the store. XXXwas trespassed and provided a ride to school. 

HK01D','No/Null','No/Null',NULL,'6/7/2024','9:30',2024,6,7);
INSERT INTO "fio_juvenile" VALUES ('FC24002460','6/10/2024 22:36','MIllane, Brandon','MIllane, Brandon','MICHAEL MCCARTHY','CHURCH ST','DORCHESTER','MA','2122',NULL,'Stopped','Probable Cause',NULL,NULL,NULL,NULL,NULL,NULL,NULL,'No/Null','Juvenile, Body Worn Camera','R/C for a disturbance at XXXChurch St., Dorchester. Officers encountered the following parties trespassing on the steps and blocking the sidewalk with two parked mopeds:

XXX(Active XXX.)XXX

Based on officers'' observations on scene, XXXwas frisked for weapons yielding negative results. Both mopeds frisked for weapons yielding negative results. CJIS query of mopeds did not return any results. It should be noted that on 06/02/24, officers recovered two firearms close in proximity to XXXand XXXon a porch at XXXFifield St. (I242045124). Officers canvased the immediate area around these individuals for any possible weapons yielding negative results. All parties were ultimately cordial with the officers on scene.

Officers also observed that all juveniles appear to respond to and obey XXXas if he is in a position of power.

FIO for intel purposes
Millane/Mulvey (H103F) Polanco/Swanson (H102F)','No/Null','No/Null',NULL,'6/10/2024','22:36',2024,6,10);
INSERT INTO "fio_juvenile" VALUES ('FC24002523','6/15/2024 19:52','Murray, Terrence','Murray, Terrence','JOHN BURROWS','MORTON ST','DORCHESTER','MA','2126',NULL,'Stopped','Probable Cause',NULL,NULL,NULL,NULL,NULL,NULL,NULL,'No/Null','Body Worn Camera, Gang, Juvenile','XXXwere stopped in the area of XXX Elizabeth St. following a 9-11 call for a shoplifting at Walgreens. Probable cause was established andXXXwas arrested. During the booking process, XXXsquared up with officers and dared them to remove their badges and "get down and squabble" XXXthan stated if we were on the streets and he had a gun on him there would be some dead cops on his block. XXXand the XXXbrothers have daily interactions with B3 officers and are known to frequent Norfolk St between Morton and Mildred, Astoria St. and on most occasions XXX Elizabeth St. 

Murray/McPherson','No/Null','No/Null',NULL,'6/15/2024','19:52',2024,6,15);
INSERT INTO "fio_juvenile" VALUES ('FC24002587','6/21/2024 2:21','Madden, Joseph','Madden, Joseph','MICHAEL MCCARTHY','WILLIAM T MORRISSEY BLVD','DORCHESTER','MA','2122','0','Encountered','Encounter',NULL,NULL,NULL,NULL,NULL,NULL,NULL,'No/Null','Gang, Juvenile, Body Worn Camera','R/c for a Larceny in Progress at XXXMorrissey Blvd. (7-Eleven)

Caller stated kids were actively stealing items out of the store and a grey Nissan was parked outside waiting for them.

Officers spoke with the occupants of a gray 2016 Nissan Altima (RI. Reg. XXXrental) parked at one of the gas pumps:

DriveXXXactive XXX)

Front passenger:XXX (active XXX; firearms)

Back passenger: XXXactive XXX; firearms)

FIO to associate parties with MV

H104A (Madden/Mitchell)','No/Null','No/Null',NULL,'6/21/2024','2:21',2024,6,21);
INSERT INTO "fio_juvenile" VALUES ('FC24002639','6/25/2024 11:00','CAVANAUGH, SEAN','CAVANAUGH, SEAN','KENNETH MACMASTER','GENEVA AVE','DORCHESTER','MA','2122',NULL,'Encountered','Encounter',NULL,NULL,NULL,NULL,NULL,NULL,NULL,'No/Null','Juvenile, Body Worn Camera','Officers Armstrong and Cavanaugh encounteredXXX (DOB XX/XX/XXXXwhile responding to a radio call (P240319286) for verbal dispute at XXXGeneva Ave, Dorchester. XXX was looking for her missing daughter (XXX XX/XX/XXXXwhom she believed to be at the above address. Officers did a walk-through of the house and confirmed XXXwas not present. Due to the volatile situation with both families becoming increasing agitated and fearing that a fight may take place, officers informed XXX to meet at District C-11 if she wanted to file a missing persons report.XXX never arrived a C-11 to file a report and no further calls for assistance were received.

At about 3:30pm, XXX arrived at C-11 and stated to the front desk that her her daughter had been sexually assaulted and she physically assaulted during an incident that took place in May 2024 (see I242035286). Due to the nature of the allegations, the font desk cadet informed sworn officers. When Officers went to gather more information from XXX, she had already left the area and refused accept police assistance.','No/Null','No/Null',NULL,'6/25/2024','11:00',2024,6,25);
INSERT INTO "fio_juvenile" VALUES ('FC24002978','7/22/2024 13:00','Keogh, Ryan','Keogh, Ryan','JOHN FITZGERALD','HANO','BRIGHTON','MA','2135',NULL,'Encountered','Encounter',NULL,NULL,NULL,NULL,NULL,NULL,NULL,'No/Null','Body Worn Camera, Juvenile','About 1:00pm on Monday, 07/22/24, Officers Keogh & Walton while assigned to the KK02D performed a subject stop of XXX (DOB: XX/XX/XXXXat XXX Hano Street, Allston.

Officers are aware that a XXX (DOB: XX/XX/XXXXresides at that location and has an open warrant for firearm related offenses.

Officers observed two females exit the residence and stated to Officers that XXXwas not home.

Shortly thereafter, subject XXX was observed approaching the residence, look both ways down the street, speak to someone through the front window, and enter. XXX exited the residence approximately twenty minutes later and approached the direction of Officers'' cruiser while on his cell-phone.

Officers observed a black male quickly poke his head out while on the cell-phone from XXX Hano Street before re-entering.

XXX was observed to be wearing a fanny-pack and backpack.

Officers had a conversation with XXX, who stated he was visiting his friend XXX
Officers performed a pat frisk, to negative results.','No/Null','No/Null',NULL,'7/22/2024','13:00',2024,7,22);
INSERT INTO "fio_juvenile" VALUES ('FC24003168','8/1/2024 14:03','SCHAIN, RYAN','SCHAIN, RYAN','MICHAEL MCCARTHY',NULL,'DORCHESTER','MA','2122',NULL,'Encountered','Intel',NULL,NULL,NULL,NULL,NULL,NULL,NULL,'No/Null','Gang, Juvenile','YVSF intel - VK23

Officers were approached by XXX at the intersection of Bowdoin and Hancock, who walked up to the police vehicle and engaged them in a casual and amusing conversation. XXXwho is out on bail for a firearm case, had previously been associating with M4; however, has been with XXXassociates as of late. He was further observed on Downer Court later in the afternoon, a dead-end where XXXassociates usually congregate. It should be noted he cut his long-dreadlocks off, and only has a single one left.','No/Null','No/Null',NULL,'8/1/2024','14:03',2024,8,1);
INSERT INTO "fio_juvenile" VALUES ('FC24003188','8/3/2024 12:58','Horan, Sean','Horan, Sean','AMYLEIGH DEVITO','COLUMBIA RD','DORCHESTER','MA','2121',NULL,'Stopped','Probable Cause','2023',NULL,'Super 8',NULL,'BLACK',NULL,'Moped','No/Null','Juvenile, Moped, Body Worn Camera','TS for VAL''s, Failure to stop at a red light (2 counts), failure to wear protective gear (no helmet). 

Officers stoppedXXX (DOB XX/XX/XXXXno BOP, operating an unregistered motorcycle at XXX Columbia Road after failing to stop for several red lights while not wearing a helmet. XXXwas initially seen pulling out of Westville Ter on the motorcycle where officers followed him up Geneva Ave all the way to Columbia Road where they then conducted the stop at XXX Columbia Road. 

XXXbecame hypervigilant at the sight of officers exiting their vehicle and attempted to flee on the motorcycle but was quickly apprehended. XXXthen reached his hands directly towards a fanny pack which was slung around his shoulder. Officers immediately frisked XXXand the motorcycle for weapons yielding negative results. 

XXXstated several times that he was "borrowing the bike from a friend" who he then provided a false name of XXX. XXXthen stated to officers that he did not possess a license to operate a vehicle.

CJIS inquiry revealed the vehicle was not registered or insured. 

Officers were able to link the motorcycle to an ID Wanted BRIC Flyer (24-764) from a shots fired incident at Geneva Ave and Everton Street. 

This is the second time XXXwas stopped by officers in the same week, XXXfled on foot from officers on 08/01/24 when they were responding to a fight call aXXXWestville Ter. XXXwas observed wearing a fanny pack on 08/01/24 which he discarded at some point prior to being caught by officers. The fanny pack was not located on that date. 

XXXwas released and summonsed. 

H104D (Horan/Millane) & H103D (Greaves/Barros)','No/Null','No/Null',NULL,'8/3/2024','12:58',2024,8,3);
INSERT INTO "fio_juvenile" VALUES ('FC24003362','8/18/2024 11:00','SCHAIN, RYAN','SCHAIN, RYAN','JAMES MOORE','MORTON ST','DORCHESTER','MA','2126',NULL,'Stopped','Probable Cause',NULL,NULL,NULL,NULL,NULL,NULL,NULL,'No/Null','Juvenile','YVSF intel - VK23

Observed two males dressed in black heavy winter coats, black hooded sweatshirts with the hoods up, and black surgical masks, enter the Walgreens at XXXMorton Street. Officers watched as they exited shortly after and began removing obviously stolen merchandise from underneath their jackets. The pair was stopped exiting the parking lot and identified as:

XXX14 years oldXXX- 13 years old

The stolen items were returned to Walgreens.

XXXaunt/guardian (XXXwas notified and reported that he had snuck out of the house and she was getting ready to report him missing again (had done so a few weeks prior). She responded and took custody of him. 

XXXmother (XXX) was notified, and XXXwalked home a short distance away.','No/Null','No/Null',NULL,'8/18/2024','11:00',2024,8,18);
INSERT INTO "fio_juvenile" VALUES ('FC24003507','8/27/2024 18:46','FULLAM, PATRICK','FULLAM, PATRICK','CARL BLANDO','LUCY ST','DORCHESTER','MA','2125',NULL,'Stopped','Probable Cause',NULL,NULL,NULL,NULL,NULL,NULL,NULL,'No/Null','Juvenile, Body Worn Camera, Moped','Officers observed XXX and XXXattempting to start a moped on Lucy St inside the South Bay mall. Officers observed the moped to have no registration. Officers are aware that XXXand XXXhave open firearm charges stemming from an incident in which they are codefendants. 

CJIS query revealed no active warrants. Moped was secured in a private parking spot. FIO''d and released.','No/Null','No/Null',NULL,'8/27/2024','18:46',2024,8,27);
INSERT INTO "fio_juvenile" VALUES ('FC24003642','9/6/2024 18:08','Walsh, Ryan','Walsh, Ryan','KEVIN MCCLAY','CENTRE ST','JAMAICA PLAIN','MA','2130',NULL,'Encountered','Intel','2019','MA','E-CLASS',NULL,'GRAY','Sedan, 4 Door','Passenger Car/ Automobile','No/Null','Juvenile, Body Worn Camera, Gang','About 6:08pm on Friday, September 6th, 2024, Officers observed a parked MV (MA REG XXXparked in the rear of XXXCentre St. 

MA REG XXX recently involved in FA arrest on 08/24/24 (see I#242071830). 

Officers observed the passenger side rear door was open and 4 or 5 juveniles exited the vehicle. Officers exited their vehicle to talk with the group of juveniles. One of the juveniles was later identified as XXX XX/XX/XXXX(see I#242076040). While officers were outside of their vehicle MA REG XXX which was still occupied at least 3 times reversed and exited the parking lot. 

Officers followed XXX for a brief period before it parked in the plaza at XXXCentre St. Officers were able to identify the driver as the registered ownerXXXXXX (DOB XX/XX/XXXXOfficers were unable to identify the other 2 males with XXX

When XXXreturned to the vehicle he was approached by XXX (DOB XX/XX/XXXXthe two shared a handshake and engaged in a short cordial conversation. 

FIO for intel purposes only.

JK01F Walsh/Asuncion','No/Null','No/Null',NULL,'9/6/2024','18:08',2024,9,6);
INSERT INTO "fio_juvenile" VALUES ('FC24003837','9/22/2024 13:27','FLYNN, THOMAS','FLYNN, THOMAS','SHAWN HARRIS','GENEVA AVE','DORCHESTER','MA','2122','18','Stopped','Probable Cause',NULL,NULL,NULL,NULL,NULL,NULL,NULL,'No/Null','Body Worn Camera, Juvenile','Officers responded to XXXGeneva Ave for a report of three shoplifters from Target. Officers located the suspects inside PriceRite. Suspect XXXwas identified as XXX (XX/XX/XXXX). XXXwas wearing a distinctive black hoodie with "Nightmare on Elm Street" written in red lettering across the chest, grey shorts, and slides. Suspsect #2 was identified asXXX (XX/XX/XXXX). XXXprovided a known alias ofXXXXXXwas wearing a grey hoodie with black shirt underneath and black sweatpants. Suspect #3 was identified as XXX (XX/XX/XXXX. XXXwas wearing a grey hoodie and black sweatpants. 

These three individuals appear to be suspects in several robberies and scooter thefts in C-11, specifically I242075254, I242074187, and I242074456. XXX is wearing the same distinctive hoodie as the suspect from I242074456.','No/Null','No/Null',NULL,'9/22/2024','13:27',2024,9,22);
INSERT INTO "fio_juvenile" VALUES ('FC24003916','9/27/2024 21:00','Delapp, Julianne','Delapp, Julianne','JOHN GOULD','ALLSTON ST','BRIGHTON','MA','2134',NULL,'Stopped','Probable Cause',NULL,NULL,NULL,NULL,NULL,NULL,NULL,'No/Null','Juvenile, Gun','R/C for PERGUN inside Ringer Park. 911 caller stated directly behind the "old school". 911 caller reported parties shooting BB guns. Upon arrival, officer observed a group of young males standing in the rear just near the entrance to Ringer Park. Officer explained the reason for their presence. Above parties denied any BBGun and stated that they were just hanging out. FIO''d and released.','No/Null','No/Null',NULL,'9/27/2024','21:00',2024,9,27);
INSERT INTO "fio_juvenile" VALUES ('FC24004007','10/4/2024 14:28','LUU, MORRIS','LUU, MORRIS','PAUL DONLON','OLD COLONY AVE','BOSTON','MA','2127','22','Stopped','Intel',NULL,NULL,NULL,NULL,NULL,NULL,NULL,'No/Null','Juvenile, Body Worn Camera, Moped','About 2:28 PM on Friday, October 04, 2024, Officer Luu and Officer White in the F112D responded to a radio call for a Fight at Mount Vernon and Harbor Point, South Boston.

Upon arrival Officers made contact with school staff who were speaking with students about a fight that occurred. School staff stated they would handle the situation. Soon two of the students arrived at the JFK/UMass MBTA station on a Moped registered as XXXThe rider of the Moped was identified as XXX and he and his unidentified brother stated that they were attacked by another group of students on Mopeds. XXX did not relay further information to cooperate with units including Transit Police.','No/Null','No/Null',NULL,'10/4/2024','14:28',2024,10,4);
INSERT INTO "fio_juvenile" VALUES ('FC24004026','10/5/2024 0:00','Shimchak, Thomas','Shimchak, Thomas','DANIEL TRACEY','TREMLETT ST','DORCHESTER','MA','2124',NULL,'Stopped','Probable Cause',NULL,NULL,NULL,NULL,NULL,NULL,NULL,'No/Null','Juvenile, Body Worn Camera','Officers responded to a radio call for a Larceny in Progress at XXXTremlett St. Officers given a suspect description of 3 juveniles pushing a cart walking down towards Park St. Officers observed the group walking down Waldeck St and were able to stop them at the corner of Waldeck & Lindsey St. the 3 suspects were Identified as the following:

Suspect 1-XXX XX/XX/XXXXblue t-shirt, black sweatpants, white & black high top Nike Air Force Ones

Suspect 2- XXXXX/XX/XXXXblack beanie w/ light brown lettering on top, red hoodie & red sweatpants

Suspect 3-XXX(DOB: XX/XX/XXXXblack t-shirt, gray sweatpants, purple & orange crocs 

When asked why they stole the items, the group stated that they were bored and had nothing else to do since their parents took away all of their electronics.

Officers recovered numerous small LED lawn lights from the cart.

The suspects were driven back to where they had stolen the items from and had the suspects return the items. Officers then drove each suspect back home to their parents. Officers informed each of the parents about situation. 

H103F(Shimchak/Ruane) HK01F (Bradham/Lopes)','No/Null','No/Null',NULL,'10/5/2024','0:00',2024,10,5);
INSERT INTO "fio_juvenile" VALUES ('FC24004124','10/14/2024 15:45','Ostholthoff, Tyler','Ostholthoff, Tyler','JOHN SHAUGHNESSY','TREMONT ST','BOSTON','MA','2111','0','Stopped','Probable Cause',NULL,NULL,NULL,NULL,NULL,NULL,NULL,'No/Null','Body Worn Camera, Other Agency/Unit Notified, Juvenile','At 3:45 PM on 10/14/24 the Officer stopped XXXwith a juvenile subject at the Brewer Fountain matching the description of suspect #2,XXX (DOB XX/XX/XXXX
Both XXXand XXXadmitted that XXXdid assault XXXand XXXearlier in the day but did it because XXXassaulted XXXthe day before. The Officer asked XXXand XXXwhy they didn''t call police when XXXwas assaulted, and XXXstated it was because XXXthreatened to call DCF and say negative things about her to get her soon-to-be-born child taken away from her (the baby is not XXX. XXXstated he did witness XXXassault XXXthe day in question. 

A1 Det. Chapman notified. 

Ostholthoff (A435D)','No/Null','No/Null',NULL,'10/14/2024','15:45',2024,10,14);
INSERT INTO "fio_juvenile" VALUES ('FC24004334','11/1/2024 17:00','Ostholthoff, Tyler','Ostholthoff, Tyler','CHARLES CELLUCCI',NULL,'BOSTON','MA','2129','0','Encountered','Intel',NULL,NULL,NULL,NULL,NULL,NULL,NULL,'No/Null','Gang, Other Agency/Unit Notified, Juvenile, Body Worn Camera','At 5 PM on 11/1/24, Officers encountered the below subjects on O''Reilly Way at Tufts Street in Charlestown:

XXX (DOB XX/XX/XXXX- prior assault out of Chelsea, known to associate with XXX gang membersXXX(DOB XX/XX/XXXX- no BOP, known to associate with XXX gang members.

XXX and XXXwillingly stopped and conversed with Officers cordially. Officers asked them about the shooting on Carney Court, and both XXXand XXXstated they did not know anything about it. XXXthen FaceTimed a female subject and pointed the phone toward Officers and stated while laughing, "I''m with your people." He then hung up the call.

Officers immediately recognized the female on the FaceTime call as a person of interest related to the shooting that occurred on Carney Court on 10/29 (I242092073). Officers asked XXXto call the person back because they needed to speak with her, but he refused. Officers continued talking cordially with XXXand XXXfor several more minutes before leaving. 

Approximately ten minutes later, Officers observed the female on the other end ofXXXFaceTime call XXXXXXwas pat-frisked, yielding neg. results.

Officers have observed XXXin the past with other known XXX gang members but were unable to identify her until now. Officers allowed XXXto contact her mother, XXX who eventually arrived on scene. 

When Officers explained to XXXwhy they stopped her daughter, she stated, "ya, she saw the shooting." Officers asked her if she would come speak to detectives with her daughter, but she declined. 

XXXdid state that after the shooting she "saw the video." Officers asked her what video she was referring to, and she corrected herself and said, "I mean the news." XXXthen stated she spoke with XXXimmediately after the shooting, given the fact it occurred behind their residence, and that XXXtold her she saw the shooting. XXXthen stated she did not want her family involved anymore. XXXwas otherwise cooperative. 

A1 detectives notified. 

FIOE''d to associate XXXto XXXand for intel. 

Ostholthoff/McCullough (AK15F), Murray/Grady (A101F), McKunes (A416F)','No/Null','No/Null',NULL,'11/1/2024','17:00',2024,11,1);
INSERT INTO "fio_juvenile" VALUES ('FC24004624','11/18/2024 20:15','Crespo, Lewis','Crespo, Lewis','ROBERT DONARUMA','GORDON AVE','HYDE PARK','MA','2136',NULL,'Encountered','Encounter','2017','MA','ACCORD',NULL,'RED','Sedan, 4 Door','Passenger Car/ Automobile','No/Null','Juvenile, Body Worn Camera','About 8:15 PM, Monday, 11/24/24, Officers Crespo & Guzman while assigned to the L202F encountered four male individuals later identified as XXX inside of a Red Honda (MA Reg. XXX
The Red Honda was idling in the parking lot of XXXGordon Ave (The Grew School) and was being operated by Mr. XXXOfficers verbally trespassed all parties from the above. 

FIOE for intel purposes.','No/Null','No/Null',NULL,'11/18/2024','20:15',2024,11,18);
INSERT INTO "fio_juvenile" VALUES ('FC24004647','11/19/2024 13:38','KEOHAN, BRENDAN','KEOHAN, BRENDAN','PATRICK MORRISON','CHEVERUS RD','DORCHESTER','MA','2124','1462','Stopped','Probable Cause',NULL,NULL,NULL,NULL,NULL,NULL,NULL,'No/Null','Gun, Juvenile, Body Worn Camera','11/19/24, Officers responded to a radio call for per gun/stolen vehicle on Cheverus Street. 

Officers located the stolen vehicle which was parked and occupied at the end of the dead end street. XXX. (DOB: XX/XX/XXXXwas seated in drivers seat. XXX (DOB: XX/XX/XXXXwas in the passenger seat. Both juveniles are known to associate with XXX gang members based upon prior police interactions. 

XXX. led officers on a brief foot pursuit where he was observed discarding a firearm. A silver/black Smith & Wesson pistol was recovered on scene. 

 XXXwas placed under arrest and XXXwas released to his mother. 

HK01D (Keohan/ E. Foley)','No/Null','No/Null',NULL,'11/19/2024','13:38',2024,11,19);
INSERT INTO "fio_juvenile" VALUES ('FC24004785','12/1/2024 7:30','Greaves-Poleet, Devante','Greaves-Poleet, Devante','MICHAEL MCCARTHY','LEEDSVILLE ST','DORCHESTER','MA','2122',NULL,'Encountered','Probable Cause',NULL,NULL,NULL,NULL,NULL,NULL,NULL,'No/Null','Juvenile, NIDV, Warrant Arrest, Body Worn Camera','Arrest of the suspect listed above.

Suspect was armed with 2 metal rods and injured an Officer.

Multiple open cases for ABPO, ABDW, Armed Robbery.

FIO for Officer safety/intel

H202D Greaves/L. Barros','No/Null','No/Null',NULL,'12/1/2024','7:30',2024,12,1);
INSERT INTO "fio_juvenile" VALUES ('FC24004884','12/6/2024 19:23','Shimchak, Thomas','Shimchak, Thomas','DANIEL TRACEY','WRENTHAM ST','DORCHESTER','MA','2124',NULL,'Stopped','Probable Cause',NULL,NULL,NULL,NULL,NULL,NULL,NULL,'No/Null','Juvenile, Body Worn Camera','R/C for Vandalism in Progress at XXXWrentham. Multiple C-11 units responded. Victim advised officers of a group of about 6 juvenile who had threw rocks at his window which resulted in a broken window. Victim then followed the group down Wrentham St towards Dorchester Ave. In the past week C-11 officers had responded to similar incidents, reference the following I#''s; (242102941) (242103176) (242103144) (242103141). 

Officers stopped the following juveniles in between Wrentham St & Monsignor Lydon Way. 

XXX XX/XX/XXXXwearing Black hoodie, gray sweatpants, gray slidesXXX XX/XX/XXXXwearing Black puffy jacket, black hoodie, black pants & black crocsXXX XX/XX/XXXXwearing Navy Nike jacket, brown khakis, black slidesXXX XX/XX/XXXXwearing Dark blue hoodie, light blue jeans, dark gray shoes

XXX XX/XX/XXXXwearing Black zip up hoodie, Batman pants, multicolored high top Nike shoes 

XXXXXXXX/XX/XXXXwearing Green puffy jacket, black pants and white slides. 

XXXwas arrested for Vandalism & Malicious Destruction of Property, transported back to C-11. The other juveniles were also transported to C-11 where they were later released into their parents'' custody. 

FIO to associate the juveniles w/ each other as well as the area. 

H104F (Shimchak/Colon)','No/Null','No/Null',NULL,'12/6/2024','19:23',2024,12,6);
INSERT INTO "fio_juvenile" VALUES ('FC24004897','12/10/2024 15:28','SCHAIN, RYAN','SCHAIN, RYAN','MICHAEL MCCARTHY','HANCOCK ST','DORCHESTER','MA','2125',NULL,'Stopped','Probable Cause','2016','MA','Yukon Xl',NULL,'BLACK',NULL,'Suv (sport Utility Vehicle)','No/Null','Juvenile, Gang','YVSF intel - VK23

Observed MA reg: XXXidling outside XXXHancock Street. This vehicle is known to be registered toXXXXXX A CJIS query revealed it to be uninspected. Officers conducted a traffic stop.XXXXXX was in the front passenger seat. In the rear were XXX. Officers have observed these specific younger males with older XXX on numerous previous occasions. XXXwas verbally warned against the inspection issue and released.','No/Null','No/Null',NULL,'12/10/2024','15:28',2024,12,10);
INSERT INTO "fio_juvenile" VALUES ('FC25000010','2025-01-01 16:07','151766','Coppinger, Joseph','JOHN BURROWS','ELIZABETH ST','MATTAPAN','MA','02126','NULL','Stopped','Reasonable Suspicion','NULL','NULL','NULL',NULL,'NULL','NULL','NULL',NULL,'Juvenile, Body Worn Camera','R/C for B&E in Progress/Person with a Gun at XXX XXXStreet.  Officers made entry and stopped the following three juveniles hiding in the basement of XXX XXX XXXXXXXXXX/XX/XXXXXXXXX/XX/XXXX All parties frisked yielding negative results.  FIO''d and released  C415F (Coppinger)',NULL,NULL,NULL,'2025-01-01','16:07',2025,1,1);
INSERT INTO "fio_juvenile" VALUES ('FC25000082','2025-01-06 13:55','167884','Rosa, Eniza','JAMES CONLEY','MORELAND ST','ROXBURY','MA','02119','NULL','Stopped','Reasonable Suspicion','NULL','MA','Tl',NULL,'Black','Sedan','Passenger Car/ Automobile',NULL,'Body Worn Camera, Juvenile','About 1:55pm on Monday, 01/06/2025, Officer Rosa and Leon in the B102D responded to a radio call for Investigate Premise at XXXMoreland Street, Roxbury.  Multiple B2 Units responded to the scene.   Prior to arrival, Operations informed the Officers that there was 1 male wearing black jacket with brown hoodie, 1 black male wearing all black and looking around his home. The caller stated that the male individuals were around a black Acura (MA REG: XXXand standing by his driveway. The caller stated that the police did retrieve a gun when it was thrown in the backyard before Christmas.   Upon arrival, Officers observed 1 black male standing by the gates to the backyard and 4 black males inside of the 2002 black Acura 32TLS (MA REG: XXXon XXXCopeland Street. Officers were aware of the incident that took place at the aforementioned address (I242100756). All parties engaged in a casual conversation with the officers. This FIO is for Intel purposes.   Driver: XXXl  DOB: XX/XX/XXXX  Passenger: XXXDOB: XX/XX/XXXX  Passenger:XXX DOB: XX/XX/XXXX  PassengerXXXDOB: XX/XX/XXXX  Passenger:XXX DOB: XX/XX/XXXX  Mr. XXXand the other passengers were given a verbal warning, and the vehicle was left parked on Copeland Street. All parties agreed to walk to the closest MBTA station to catch the bus.',NULL,NULL,NULL,'2025-01-06','13:55',2025,1,6);
INSERT INTO "fio_juvenile" VALUES ('FC25000125','2025-01-08 21:10','173474','Mulrean, Michael','JOHN BURROWS','NULL','BOSTON','MA','02124','NULL','Stopped','Probable Cause','NULL','MA','Tlx',NULL,'Gray','4 Door, Sedan','Passenger Car/ Automobile',NULL,'Body Worn Camera, Juvenile, Gang','TS of a 2015 gray Acura TLX (MA REG XXXfor excessive window tints (90/9D) at Blue Hill Ave and American Legion Hwy.  Op identified as XXX (DOB XX/XX/XXXXActive Fairmount, multiple open f/a charges  XXXwas cordial with officers throughout the stop. When asked if there were any weapons in the vehicle he stated that he was currently, "fighting his case" and doesn''t ride around with them. Officers measured window tints at 13%.  XXXwas issued a verbal warning and released. FIO for intel  C113F (Mulrean/Williams)',NULL,NULL,NULL,'2025-01-08','21:10',2025,1,8);
INSERT INTO "fio_juvenile" VALUES ('FC25000136','2025-01-09 18:20','40009234','Barbosa, Carlos','STEVEN CICCOLO','DALESSIO CT','SOUTH BOSTON','MA','02127','20','Stopped','Reasonable Suspicion','NULL','MA','Odyssey',NULL,'Gray','Van','Passenger Van',NULL,'Juvenile, Gang','On Thursday, 01/09/2025 at approximately 6:20PM, Housing PO''s were patrolling the West Broadway Development when they observed MA REG XXXdriving through the development at a high speed. The vehicle quickly pulled into the parking lot ofXXX Dalessio Ct and as Officers pulled in behind the vehicle, XXXmales exited the vehicle in a hurry and went in separate directions. Officers conducted a CJIS inquiry of MA REG XXXthat showed the vehicle was REVO/INSC.  Officers later identified XXX as the driver who went directly intoXXX Dalessio ct hallway, XXX as the front passenger who went towards XXXDalessio ct then toward Orton Mariota Way, andXXX who went towards theXXX Dalessio hallway as well. Officers stopped XXXbefore he entered the hallway and asked him why they exited the vehicle in a hurried manner. XXXcontinued to say, "I don''t know. I wasn''t driving."   Officers explained to XXXthe status of the vehicle and that it needs to be properly parked in a parking spot to avoid being towed. After about 10 Minutes, XXXreappeared and stated he was driving his mom''s car but does not have a license. Officers confirmed this through CJIS and mentioned that he needs someone with an active license to park the vehicle. XXXarrived on scene and provided officers with an active license. Prior to XXXentering the vehicle, Officers frisked the vehicle for weapons yielding negative results.   Officers followed XXXas he drove the vehicle to the parking lot of XXXW 7th, where XXXlives with his mom.  FIO to document behavior and associate subjects to vehicle.  Z43XXX(Barbosa) Z429 (Awad) Z434 (Iverson)',NULL,NULL,NULL,'2025-01-09','18:20',2025,1,9);
INSERT INTO "fio_juvenile" VALUES ('FC25000148','2025-01-10 17:15','40006646','Resil, Jacob','FRANCIS MCLAUGHLIN','METCALF CT','JAMAICA PLAIN','MA','02130','27','Stopped','Reasonable Suspicion','NULL','NULL','NULL',NULL,'NULL','NULL','NULL',NULL,'Juvenile','On Friday, 01/10/2025, around 5:15pm, Housing Officers were patrolling South Street development and observed four individuals loitering in XXXMetcalf Court specifically in the stairwell. It is to be noted that Housing has had recent taskforce meetings about juveniles loitering and smoking in the common areas of the development. Housing Officers have been instructed to conduct walking beats in the development to deter this behavior.   Officers were able to conduct an encounter and ID all four individuals:   XXX (DOB: XX/XX/XXXX XXX(DOB: XX/XX/XXXXXX (DOB: XX/XX/XXXXXX (DOB: XX/XX/XXXX The group was cordial with officers and freely gave information. Officers advised the group that they could visit a specific unit but they could not loiter in the stairwell.   Z428 (Resil) Z433 (Barbosa)',NULL,NULL,NULL,'2025-01-10','17:15',2025,1,10);
INSERT INTO "fio_juvenile" VALUES ('FC25000195','2025-01-13 13:15','097246','FORBES, MICHAEL','CHARLES MOORE','SUMNER ST','BOSTON','MA','02128','NULL','Stopped','Probable Cause','NULL','NULL','NULL',NULL,'NULL','NULL','NULL',NULL,'Gang, Juvenile, Body Worn Camera','GK01F Forbes/Ashman while conducting a code 19 Sumner &Jeffries St made suspect stop of: XXX- recent shooting victim involved in XXX violence from 01/01/2025 (I252000215) minor BOP with all VAL''s ( identifies as "X8" on social media account and throwing up XXX) , had on black rosary beads  XXXno BOP in gang database as confirmed XXXgang member, attends East Boston High SchoolXXX- no BOP located (I2220414889 and I222042082) these reports indicate that XXXwas present and in possession of a firearm withXXXXXin 2022 and also ammunition at the Mario Umana School, and now attends East Boston High School now  All minors stopped for smoking marijuana in the park. All individuals are under the age of 21 and did not possess a marijuana card. Parties frisked with no finding and advised to refrain from smoking in park. CJIS check conducted all parties negative for warrants.',NULL,NULL,NULL,'2025-01-13','13:15',2025,1,13);
INSERT INTO "fio_juvenile" VALUES ('FC25000237','2025-01-16 15:35','126514','SCHAIN, RYAN','RAFAEL RODRIGUEZ','WASHINGTON ST','ROXBURY','MA','02119','NULL','Stopped','Reasonable Suspicion','NULL','NULL','NULL',NULL,'NULL','NULL','NULL',NULL,'Juvenile','YVSF Intel - VK23  Officers observed XXX, a male they''ve numerous countless times in recent weeks with XXX members in the area of Dudley Station. Mr. XXXwas wearing a surgical mask covering the majority of his face, despite the paper material giving no protection against the cold.   Mr. XXXis normally casual and calm with the officers; however, on this date, wherever their police vehicle went in the bus station, XXXgot up off where he was sitting, walked away, and repeatedly looked back at them. Officers rounded the busway a second time, and XXXslipped into a heated MBTA vestibule and closed the door. Inside with XXXwere two other individuals in full ski masks.   Upon circling the busway again, XXXwas no longer in the vestibule but was however, running into the Bolling Building across the busway. XXXwas stopped without incident. Once stopped, he was cooperative. A large spring-loaded knife was removed from his person. He was advised against carrying the knife, and was FIO''d and released.',NULL,NULL,NULL,'2025-01-16','15:35',2025,1,16);
INSERT INTO "fio_juvenile" VALUES ('FC25000387','2025-01-27 14:37','135979','MARQUEZ RIVAS, DAVID','MICHAEL LOCKE','HYDE PARK AVE','HYDE PARK','MA','02136','0','Stopped','Intel','NULL','MA','Grand Cherokee',NULL,'Gray',NULL,'Suv (sport Utility Vehicle)',NULL,'Juvenile, School, Gun, Body Worn Camera','About 2:38pm on January 27, 2025, Officers in the L202D, along with assisting units, L101D, LT55D, L411D, L412D, responded to a radio call for a FIGHT at XXXMETROPOLITAN AVE HP BSTN: @SCH-ANOTHER COURSE TO COLLEGE. E-18 Patrol Supervisor on scene. Officers requested Boston School Police over channel 4.   Officers were then notified via radio that an individual driving a Jeep, partial plate XXXhad driven by some of the students and flashed a gun.   Officers intersected this motor vehicle dark gray Jeep, MA Reg. XXXin the area of Hyde Park Avenue and Collins Street, Hyde Park, MA.   Operator identified as XXX) frisked and yield tan BB-gun . And front passenger seat identified as XXX(MA Lic. XXXBB-Gun logged by E-18 Detectives. FIOEd and released on scene. Additional information on 1.1. Both subjects were queried through CJIS.',NULL,NULL,NULL,'2025-01-27','14:37',2025,1,27);
INSERT INTO "fio_juvenile" VALUES ('FC25000462','2025-02-01 01:01','168364','McPherson, Eric','JAMES MOORE','GLENWAY ST','DORCHESTER','MA','02121','NULL','Stopped','Probable Cause','NULL','MA','Accord',NULL,'Silver','Coupe','Passenger Car/ Automobile',NULL,'Juvenile, Body Worn Camera','T/S for VAL (89:9 failure to stop at a stop sign) on a 2005 Gray Honda Accord Coupe MA REG: XXXat XXXGlenway St.  Operator: XXX)  Front Seat Passenger: XXX) Kidnapping, ABDW  Rear Left Passenger:XXX  Middle Passenger:XXX   Rear Right Passenger:XXX)  While approaching the vehicle officers observed all occupants of the vehicle to be moving around the vehicle. While speaking with Mr. XXXhe immediately told officers that he did not have a license and stated that his friend XXXl was letting him drive the vehicle. While speaking with all occupant''s officers observed all passengers in the rear to be ducking down as well XXXto be pinning his left arm across his body. An exit order was issued due to XXXnot having a license and due to occupant''s behavior.   While conducting a pat frisk of XXXOfficer McPherson felt a L shaped object consistent with being a firearm located in the right jacket pocket which turned out to be a BB gun. While conducting a pat frisk of the vehicle Officer O''Neill observed a black Glock style firearm with an extended magazine equipped with a laser and flashlight attached which was determined to be a BB gun.  XXXto be summonsed to Court for unlicensed operation.  FIOd to associate all with MV.  CK01A (McPherson, O''Neill).',NULL,NULL,NULL,'2025-02-01','01:01',2025,2,1);
INSERT INTO "fio_juvenile" VALUES ('FC25000581','2025-02-10 14:00','178057','Ganss, Michael','JOHN SHAUGHNESSY','WASHINGTON ST','BOSTON','MA','02110','5','Observed','Encounter','NULL','NULL','NULL',NULL,'NULL','NULL','NULL',NULL,'Juvenile','Officers on a CD19 in the Downtown Crossing area observed XXX(DOB XX/XX/XXXXin the basement level of Macy''s hanging out in the furniture section.  When officers walked began to have other parties leave the area, XXXleft without issue and met with another unknown young male.  XXXis known to officers from previous interactions in other parts of the city. XXXBOP consists of different violent crimes and larceny.  FIOE completed for intel.  A704 Ganss / A705 Goodwin / A706 Adams / A707 Flaherty',NULL,NULL,NULL,'2025-02-10','14:00',2025,2,10);
INSERT INTO "fio_juvenile" VALUES ('FC25000633','2025-02-14 12:02','178057','Ganss, Michael','LUCAS TAXTER','WASHINGTON ST','BOSTON','MA','02110','8','Encountered','Encounter','NULL','NULL','NULL',NULL,'NULL','NULL','NULL',NULL,'Juvenile, Body Worn Camera','Officer encountered XXX (DOB XX/XX/XXXXin the furniture section of Macy''s.  Officer has had encounters with XXXin the past in other parts of the city of Boston. XXXwas observed to be with XXX (DOB XX/XX/XXXXwho has also had numerous encounters with officers.  XXXhas numerous missing person cases and has been involved in assault cases in the past. CJIS inquiry revealed XXXis currently not marked as a missing person.  FIOE for intel.  A437D Ganss',NULL,NULL,NULL,'2025-02-14','12:02',2025,2,14);
INSERT INTO "fio_juvenile" VALUES ('FC25000676','2025-02-18 11:24','178042','Heredia, Alexandra','ALLISON ENG','BREMEN ST','EAST BOSTON','MA','02128','NULL','Encountered','Encounter','NULL','NULL','NULL',NULL,'NULL','NULL','NULL',NULL,'Section 12, Body Worn Camera, Drugs, Gang, Juvenile','Referring to I252013139, Officers came in contact withXXX(DOB XX/XX/XXXXa known individual fromXXX for a sick assist. XXXwas staying with his sister, who resides at XXXBremen Street, Apartment XXXEast Boston.   XXXmade several statements regarding his street association to police, such as stating, "y''all must not know who I am."  It should be noted that the above stated address is a new address that has not appeared in his Mark43 and Gang Database profiles.  FIOE completed for intel purposes.  G101D (Heredia/Atehortua)',NULL,NULL,NULL,'2025-02-18','11:24',2025,2,18);
INSERT INTO "fio_juvenile" VALUES ('FC25000879','2025-03-04 11:00','168430','Duggan, Daniel','JOHN BURROWS','HARVARD ST','DORCHESTER','MA','02124','NULL','Stopped','Probable Cause','NULL','NULL','NULL',NULL,'NULL','NULL','NULL',NULL,'Body Worn Camera, Juvenile','R/C for group of teens trespassing at XXXHarvard Street Dorchester, MA.  Officers encountered:  JXXX (DOB: XX/XX/XXXXpresent for F/A arrests, stated that he and others were filming a music video and given permission by building resident, XXX (DOB: XX/XX/XXXXOP associate.XXX (DOB: XX/XX/XXXXprior ABDW w/knife, provided alias ofXXX (DOB: XX/XX/XXXXprovided alias of "XXX (DOB: XX/XX/XXXXprevious F/As, provided alias of XXX".  All parties frisked for weapons. Mr. XXXwas in possession of a pocketknife and was determined to be missing (missing person report cleared under original I# 252016512). Frisk revealed nothing else of evidentiary value on additional parties. CJIS query reveals no active warrants for the parties involved.  Individuals were trespassed from the building and Mr. XXXwas returned home.  FIO to document trespass/relationships',NULL,NULL,NULL,'2025-03-04','11:00',2025,3,4);
INSERT INTO "fio_juvenile" VALUES ('FC25000895','2025-03-05 19:05','148317','DOOLAN, SEAN','CHRISTOPHER CARROLL','BOYLSTON ST','BOSTON','MA','02116','NULL','Stopped','Encounter','NULL','MA','Accord',NULL,'Gray','4 Door, Sedan','Passenger Car/ Automobile',NULL,'Body Worn Camera, Juvenile','Officer travelling on Gloucester Street towards Boylston Street when a gray Honda Accord (MA XXXpulled to the drivers side. Front passenger stated, "Hey, Officer, If someone steals from Sak''s [Sak''s Fifth Avenue] tonight, what are you going to do?" Officer observed the vehicle to be occupied at least three times by three black females appearing to be late teens. Numerous recent incidents of shopliftings in the Back Bay by juvenile/teenage black females as disseminated by D4 Detectives and BRIC.  Traffic stop conducted across from XXXBoylston Street. Driver identified as XXX, front passenger who made initial statement identified as XXX, rear passengers identified as XXX and XXX stated the vehicle belonged to her mother and all parties were confrontational during the stop.  FIO for relationships and affiliation to vehicle.  Doolan [D415F]',NULL,NULL,NULL,'2025-03-05','19:05',2025,3,5);
INSERT INTO "fio_juvenile" VALUES ('FC25000939','2025-03-08 19:05','113237','Nunes, Robert','LUCAS TAXTER','WASHINGTON ST','BOSTON','MA','02108','3','Stopped','Reasonable Suspicion','NULL','NULL','NULL',NULL,'NULL','NULL','NULL',NULL,'Body Worn Camera, Juvenile','About 7:09 PM, on Saturday, 03/08/25, Officers Nunes (A707) and Lopriore (A701) assigned to the Community Interaction Team (CIT) responded to a radio call for a Larceny in progress atXXXSchool Street, Boston (Walgreens).   Responding Units A426F (Sheil), A435F (Martinez) and A915 (Sgt. King)   Upon arrival, Officers spoke with XXX(Employee), who stated that four teenagers concealed merchandise into their jackets and then proceeded to exit the store without payment. XXXstated the suspects left the store on foot traveling into the MBTA train station located across the street. XXXdescribed the suspects as 3 skinny black males wearing all black clothing along with a black face covering. XXXdescribed the female as a black stocky girl wearing a blue track suit.   Officers were able to locate the suspects on the State Street orange line (Forest Hills) platform. Officers recovered 3 Twix candy bars along with observing several empty Twix wrappers, in the immediate area of the suspects.   Officers verbally trespassed XXX (DOB XX/XX/XXXXXXX XX/XX/XXXXXXX(DOB: XX/XX/XXXXanXXXXX/XX/XXXXfrom Walgreens, located atXXXSchool Street, on behave of XXX',NULL,NULL,NULL,'2025-03-08','19:05',2025,3,8);
INSERT INTO "fio_juvenile" VALUES ('FC25001020','2025-03-12 15:19','098663','MACPHERSON, ERIC','AMYLEIGH DEVITO','MARTIN LUTHER KING JR BLVD','ROXBURY','MA','02119','NULL','Stopped','Probable Cause','NULL','NULL','NULL',NULL,'NULL','NULL','NULL',NULL,'Body Worn Camera, Juvenile','While addressing community complaints of young teens causing disturbances outside XXXMLK King Blvd, the officers observed two individuals that matched photos disseminated for an armed robbery and aggravated assault that occurred on 3/7/25 inside of the mall. The officers stopped both males and identified them asXXXXX/XX/XXXXand XXX XX/XX/XXXXBoth males were explained why they were stopped and shown the photos. After verifying their identities, they were allowed to leave. The detective assigned to the case was notified.    A photo taken of the two males and their clothing was attached to the FIO.',NULL,NULL,NULL,'2025-03-12','15:19',2025,3,12);
INSERT INTO "fio_juvenile" VALUES ('FC25001055','2025-03-13 20:30','151766','Coppinger, Joseph','JAMES MOORE','NULL','DORCHESTER','MA','02121','NULL','Stopped','Reasonable Suspicion','NULL','NULL','NULL',NULL,'NULL','NULL','NULL',NULL,'Gang, Juvenile','Officers were on directed patrol in the area of Ellington Street and Erie Street due to an uptick in violent crimes when they observed a large group of juveniles walking on Erie Street towards Washington Street. All juveniles in this group had face coverings consisting of either medical masks or ski masks.   Once the group noticed the officers they all dispersed and ran in different directions. A young black male in a black puffer coat and black ski mask along with a young white male in a grey Nike sweatshirt and green ski mask were observed running into the parking lot of XXXWashington Street.     While continuing to canvass the area the officer observed the male in black now with two other juveniles walking on Merrill Street. The officer exited his cruiser to which the male in all black immediately separated himself and began walking at a hurried pace as if he was going to flee. The officer was able to stop him and conduct a pat frisk which yielded negative results.     This individual was identified asXXXXX/XX/XXXX  A canvass of the rear of XXXWashington Street yielded no findings.  FIOd and released   C421F(Coppinger)/C431F(Walsh)',NULL,NULL,NULL,'2025-03-13','20:30',2025,3,13);
INSERT INTO "fio_juvenile" VALUES ('FC25001075','2025-03-14 00:00','124390','COYNE, CHRISTIAN','JOHN FITZGERALD','NULL','DORCHESTER','MA','02121','NULL','Stopped','Probable Cause','NULL','NULL','NULL',NULL,'NULL','NULL','NULL',NULL,'Juvenile, Gang','Arrest of XXX (DOB: XX/XX/XXXXXXX (DOB: XX/XX/XXXXandXXX(DOB: XX/XX/XXXXinside of Kia Soul (NYREG# XXXwhich was carjacked one day prior. During the booking process XXXself identified as a XXX and alleged as if bothXXX were as well. FIOED for intel.   Coyne/Turner/Rodriguez',NULL,NULL,NULL,'2025-03-14','00:00',2025,3,14);
INSERT INTO "fio_juvenile" VALUES ('FC25001128','2025-03-18 16:16','178033','Barry, Ashley','CARL BLANDO','ALLSTATE RD','DORCHESTER','MA','02125','NULL','Stopped','Encounter','NULL','NULL','NULL',NULL,'NULL','NULL','NULL',NULL,'Body Worn Camera, Juvenile','While assigned as the F631F, Officer Barry received a radio call for 2 juveniles in custody. Subject #1 known as XXX(DOB XX/XX/XXXXand subject #2 known as XXX(DOB XX/XX/XXXXwho stole merchandise from Target.  They are both known to be in the area and are trespassed to multiple retail stores in the area of Southbay area. Both subjects were released and FIO''D.',NULL,NULL,NULL,'2025-03-18','16:16',2025,3,18);
INSERT INTO "fio_juvenile" VALUES ('FC25001139','2025-03-19 00:00','141653','Horan, Sean','DANIEL TRACEY','NULL','BOSTON','MA','02124','NULL','Stopped','Reasonable Suspicion','NULL','MA','OTHER: 150',NULL,'Black',NULL,'Scooter',NULL,'Juvenile, Moped, Body Worn Camera','SS (Moped)   Officers observed two males traveling on a moped without helmets on Bowdoin Street. The individuals then exited the scooter and began pushing it to the corner of Bowdoin St. and Bowdoin Ave.   Officers stopped subject 1 (XXX and Subject 2 (XXX at the corner of the aforementioned intersection.   Both parties were cordial and calm throughout the interaction and stated that they were borrowing the scooter XXXfrom a friend.   CJIS and Mark43 inquiries yielded negative results for the vehicle being stolen or reported stolen.   Both parties were released forthwith.   H102D (Horan/Millane)',NULL,NULL,NULL,'2025-03-19','00:00',2025,3,19);
INSERT INTO "fio_juvenile" VALUES ('FC25001162','2025-03-20 18:40','141653','Horan, Sean','DANIEL TRACEY','GENEVA AVE','DORCHESTER','MA','02122','NULL','Stopped','Reasonable Suspicion','NULL','NULL','NULL',NULL,'NULL','NULL','NULL',NULL,'Body Worn Camera, Juvenile','RC (PERGUN)   Officers were responding to a radio call for a person with a gun at XXXXXX which the cad notes stated, "SAW A MALE ON A BIKE WITH A GUN ON WAIST, B/MALE, TEENAGER, THIN BUILT WEARING RED AND BLK HOODIE, BLUE JEANS AND RED BLUE AND BLK SNEAKERS---ON BLK BIKE, CLR STS RED ON HOODIE HAD THE BANDANA DESIGN".   While driving to the call, Officers observed a male fitting that exact description on a pedal bike in the XXXGeneva Parking lot. Upon activating their emergency lights, the subject (XXX DOB XX/XX/XXXXNo BOP), immediately picked up his rate of speed to which officers were able to catch up to him and remove him from the bike while on foot.   XXXwas combative and actively reaching for his waistline throughout the altercation, officers were able to place him in handcuffs where they then located a large unsheathed, fixed blade kitchen knife with napkins wrapped around the handle in his sweatshirt pocket. XXXwas aggressive during the entire stop and continuously yelled at officers. While attempting to retrieve the knife, both Officer Horan and Officer Millane received minor lacerations to their hands.   911 caller would not answer on several attempted callbacks, XXXwas released forthwith.   H104F (Horan/Millane)',NULL,NULL,NULL,'2025-03-20','18:40',2025,3,20);
INSERT INTO "fio_juvenile" VALUES ('FC25001209','2025-03-22 19:22','162968','Sandoval, Thomas','JAMES MOORE','BLUE HILL AVE','DORCHESTER','MA','02124','NULL','Stopped','Probable Cause','NULL','MA','OTHER: RAZOR',NULL,'Black',NULL,'Moped',NULL,'Juvenile, Body Worn Camera, Moped','Subject Stop at XXXBlue Hill Ave. for XXX and XXX, while operating a stolen Moped. XXXwas the operator and XXXwas the rear passenger. Prior to Officers stopping the subjects both attempted to flee on foot from Officers. Officers were able to detain both parties. XXX had in his possession burglarious tools (screw driver/pry bar). XXXsubsequently summonsed for Receiving Stolen MV, Possession of Burglarious Tools, Unlicensed OP, and Fail to Stop for Police.   (Sandoval/M.Foley)',NULL,NULL,NULL,'2025-03-22','19:22',2025,3,22);
INSERT INTO "fio_juvenile" VALUES ('FC25001290','2025-03-26 19:30','40009234','Barbosa, Carlos','DANIEL KEANE','CENTRE ST','JAMAICA PLAIN','MA','02130','15','Encountered','Encounter','NULL','NULL','NULL',NULL,'NULL','NULL','NULL',NULL,'Gang, Juvenile','On Wednesday, 03/26/25 at approximately 7:30PM, Housing PO''s encountered XXX outside XXXCentre St in the Mildred Hailey Development.   XXXwalked from XXXCentre st to XXXCentre st where he met with an unknown juvenile male and unknown juvenile female before leaving the area towards the Stop & Shop XXXCentre St). Officers casually interacted with XXXand he was cordial. Officers are aware that he usually frequents the company of older XXX while in the development.   Important to note that XXXis noticeably taller, approximately 5''10-5''11.  FIO for Intel.  Z433(Barbosa) Z430(Ellsworth)',NULL,NULL,NULL,'2025-03-26','19:30',2025,3,26);
INSERT INTO "fio_juvenile" VALUES ('FC25001313','2025-03-28 11:36','098663','MACPHERSON, ERIC','AMYLEIGH DEVITO','WAKULLAH ST','ROXBURY','MA','02119','NULL','Stopped','Probable Cause','NULL','NULL','NULL',NULL,'NULL','NULL','NULL',NULL,'Body Worn Camera, Moped, Juvenile','Officers observed two individuals in possession of mopeds in the alley of XXXWakullah Street. One individual, later identified as XXX, fled the area on a black moped. The second individual was stopped and identified as XXXHis moped, although is a state of disrepair, was not listed as stolen. While talking with Mr. XXXMr. XXXreturned to the area without his moped. Officers were able to locate the moped a short distance away and determined that it was also not listed as stolen. Both stated they bought the scooters on Facebook Marketplace (showed the officers the listing). XXXXXexited XXXWakullah St (apt. XXX) and stated that he had told his friend and bother not to ride the mopeds. All parties were released from the scene.    the FIO will be forwarded to the Auto Theft Task Force',NULL,NULL,NULL,'2025-03-28','11:36',2025,3,28);
INSERT INTO "fio_juvenile" VALUES ('FC25001331','2025-03-28 15:00','126514','SCHAIN, RYAN','PATRICK CURTIN','WASHINGTON ST','ROXBURY','MA','02119','NULL','Stopped','Probable Cause','NULL','NULL','NULL',NULL,'NULL','NULL','NULL',NULL,'Gang, Juvenile','YVSF intel - VK23  XXX self-admitted to XXXgang affiliation at the booking desk. He is also the son of XXXassociateXXX',NULL,NULL,NULL,'2025-03-28','15:00',2025,3,28);
INSERT INTO "fio_juvenile" VALUES ('FC25001343','2025-03-29 20:50','164111','Mirville, Shawn','MICHAEL LOCKE','NULL','ROSLINDALE','MA','02131','NULL','Stopped','Reasonable Suspicion','NULL','NULL','NULL',NULL,'NULL','NULL','NULL',NULL,'Body Worn Camera, Juvenile','About 8:XXX0PM on Saturday, 03/29/2XXX, Officer Mirville and Prendergast in the L101F investigated a person in the area of Beech Street and Popular Street Roslindale Ma.  Officers, while on directive patrol, observed two vehicle break and entering calls come in via the CAD system, occurring shortly after each other. Call #1: XXXBeechmont Street and Call #2:XXXDeforest Street. It should be noted that the addresses involved are located in the same general area.  Officers immediately made their way to the area to investigate. Shortly after, while patrolling, officers observed a male suspect matching the provided description near XXX Bateman Street, walking away from a vehicle. The suspect was wearing a full-face mask, black gloves, a black backpack, and a black hat.  Upon spotting the suspect, officers attempted to stop him for questioning. The suspect, however, fled on foot, and officers initiated a pursuit  After a brief search, suspect was located and identified asXXX (DOB: XX/XX/XXXX FIO to place in area  Mirville/Prendergast L101F',NULL,NULL,NULL,'2025-03-29','20:50',2025,3,29);
INSERT INTO "fio_juvenile" VALUES ('FC25001366','2025-03-30 19:02','157631','DAHILL, JAMES','CHRISTOPHER CARROLL','SHAWMUT AVE','BOSTON','MA','02119','0','Stopped','Probable Cause','NULL','NULL','NULL',NULL,'NULL','NULL','NULL',NULL,'Juvenile, Body Worn Camera','03/31/25: Officers stopped XXX(DOB: XX/XX/XXXXin relation to a larceny of a bicycle. The owner of the bicycle arranged to buy it back on Facebook market place and notified officers he was going to meet the buyer at Ramsey Park. Officers accompanied him to the area. Officers observed XXXon a specialized bicycle that was listed in the Facebook Ad. After further investigation it was determined it was not the victim''s bicycle. However, the victim stated that a previous picture that was sent to him was definitely his. XXXstated he bought the bicycle from a male the previous day for $20 but could not provide any further information about the male. CJIS inquiry negative for warrants and XXXwas released from the scene.',NULL,NULL,NULL,'2025-03-30','19:02',2025,3,30);
INSERT INTO "fio_juvenile" VALUES ('FC25001415','2025-04-03 09:35','144476','MONZON, RENZO','LUCAS TAXTER','COURT ST','BOSTON','MA','02108','NULL','Encountered','Reasonable Suspicion','NULL','NULL','NULL',NULL,'NULL','NULL','NULL',NULL,'Body Worn Camera, Juvenile','While on patrol in the area of XXXTremont St, Officers observed three male parties conversing. Officers observed that once the individuals would see the Officers, they began relocating. This occurred approx 3 times.   At one point in time, one of the three individuals who was wearing a shiesty style mask kept clutching at the front of his waistband displaying characteristics of a person who was in unlawful possession of a firearm. When the Officers drove around the block in order to further observe them, they again made notice of the Officers, hurried their pace, and began walking away. Fearing that one of the individuals may be in possession of a weapon, the Officers stepped out and began talking to the individuals.   As Officers were speaking to all three, the individual that was clutching appeared to get more nervous (XXX). Based on the observations Officers conducted a pat frisk of the individuals to no avail. The three individuals were as follows XXX XX/XX/XXXXXXXXX/XX/XXXX  XXXX/XX/XXXX   All parties Fioed, informed why they were stopped, and released.',NULL,NULL,NULL,'2025-04-03','09:35',2025,4,3);
INSERT INTO "fio_juvenile" VALUES ('FC25001420','2025-04-03 15:00','153112','RUSSELL, OWEN','ERIC MERNER','DORCHESTER AVE','DORCHESTER','MA','02124','NULL','Stopped','Probable Cause','NULL','NULL','NULL',NULL,'NULL','NULL','NULL',NULL,'Body Worn Camera, Juvenile','About 3:00pm on 04/03/2025 officers stopped and trespassed XXX (DOB: XX/XX/XXXXfrom Johnnys Pizza at XXXDorchester Ave.  Officers spoke to the owner XXX who stated that he wanted XXX trespassed indefinitely from the store. Mr. XXXstated that XXXis constantly coming into the store stealing items and acting aggressive with his staff who are fearful of XXXpresence. Mr. XXXalso stated that XXXhangs with a group of other juveniles who cause problems, but he is the ring leader. Mr. XXXstated to officers XXXhas been a continual problem for his store.  Officers are aware of XXX from past incidents of disruptive behavior and located him inside of Dunkin Donuts and informed him that he is trespassed from Johnnys Pizza and subject to arrest if he returns. XXXstated he understood.  BWC activate.  C-11 CIT Team',NULL,NULL,NULL,'2025-04-03','15:00',2025,4,3);
INSERT INTO "fio_juvenile" VALUES ('FC25001429','2025-04-04 02:40','144333','WALSH, MICHAEL','RAFAEL RODRIGUEZ','NULL','ROXBURY','MA','02119','NULL','Stopped','Reasonable Suspicion','NULL','NULL','NULL',NULL,'NULL','NULL','NULL',NULL,'Juvenile, Body Worn Camera','Officers observed two males, who appeared to be juveniles, wearing dark clothing with hoods pulled over their heads, walking on Dale Street past Washington Park. One male, later identified as XXX had his right arm pinned to his body as he walked, while the second, latter identified as XXXwas observed to be wearing latex gloves on his hands.  Officers have responded to multiple recent shooting incidents in this area, and exited the cruiser to make contact with the two juveniles. During a pat frisk officers recovered a set of bolt cutters, frequently used to steal scooters, and a long unsheathed kitchen knife from XXXand a pair of scissors from XXXBoth juveniles were confrontational and threatening to officers throughout the encounter.  XXXphoned his mother, XXX, who arrived on scene in minutes operating her vehicle at an unreasonable speed. XXXwas confrontational with officers but began scolding her son and XXXfor their behavior and took custody of both boys. Bolt cutters and weapons were confiscated from the juveniles.',NULL,NULL,NULL,'2025-04-04','02:40',2025,4,4);
INSERT INTO "fio_juvenile" VALUES ('FC25001486','2025-04-07 17:51','123205','Daddieco, Vencenzio','JOHN BURROWS','NORFOLK ST & ELMHURST ST','BOSTON','MA','02124','NULL','Stopped','Encounter','NULL','NULL','NULL',NULL,'NULL','NULL','NULL',NULL,'Juvenile, Body Worn Camera','Officers responded to a radio call at the rear of XXXNorfolk St, Dorchester, to investigate a suspicious person. The caller stated that two juvenile males with ski masks on were in the rear and didn''t reside at the above location. The caller said that in the past, juveniles had been breaking windows on the first floor of the apartment building. As soon as officers turned onto Elmhurst St, they observed two juvenile males who matched the description walking across the street. As the two juveniles observed the officers, they separated from one another and walked in separate directions. Officers then exited their cruiser and spoke with both parties on the scene. One male was identified as (XXX and the other was identified asXXX. Due to officers'' observations on the scene, both parties were frisked for weapons, which yielded negative results. Mr. XXXsaid he came from the park and was never behind the apartment building. CJIS inquiry of both parties yield negative results for active warrants and criminal history.   C111F(D''Addieco/Cox)',NULL,NULL,NULL,'2025-04-07','17:51',2025,4,7);
INSERT INTO "fio_juvenile" VALUES ('FC25001491','2025-04-08 01:40','173524','Halloran, Kayla','CARL BLANDO','NULL','SOUTH BOSTON','MA','02127','NULL','Stopped','Probable Cause','NULL','NULL','Rogue Sports',NULL,'Gray','4 Door, Sedan','Passenger Car/ Automobile',NULL,'Juvenile, Body Worn Camera','About 1:40 AM on Tuesday, 04/08/25, Officers responded to XXXH St, South Boston for a report of two unidentified males pulling on car door handles. Upon arrival, officers observed two juvenile males take off on foot in the direction of E Eighth St and I St when the suspects observed the marked police cruisers. One male was wearing a black Nike jacket with gray reflectors on it, black sweatpants and a black ski mask. The second was wearing a black puffer jacket, gray sweatpants and white sneakers with a black mask.   While canvassing the area for the two suspects, a gray Nissan Rogue (MA XXXtook off at a high rate of speed at K St and Columbia Rd circling back towards H St where the incident originated. A CJIS inquiry revealed the car stolen out of Woburn, MA. Officers activated their emergency blue lights in an attempt to stop the vehicle, but the vehicle failed to stop, continuing at a high rate of speed driving recklessly through the area. Officers disengaged the pursuit turning off their emergency lights and proceeding in the opposite direction.  About 2:08 AM, Officers were patrolling the area of Columbia Rd and William J. Day Blvd in the area of the above incident when they observed two juvenile males matching the description of the suspects walking down Columbia Rd towards K St. Officers stopped the two suspects and identified them as XXX XX/XX/XXXXand XXX XX/XX/XXXXAfter briefly speaking to XXX", Officers were able to determine based off his statements that he repeatedly gave officers the incorrect name and birthday. He was then positively identified as XXX XX/XX/XXXXBoth suspects stated that they were at a party on Carson Beach and were just walking in the area. When asked why they ran, the suspects stated that they thought their parents had called looking for them. The suspects stated that they were with their friends at the party who left in a car, and they were taking an uber. Officers instructed the suspects to leave the area, and they departed in an uber which had an end destination of XXXRevere Beach Pkwy, Medford.  F112 (Halloran/Glavin)',NULL,NULL,NULL,'2025-04-08','01:40',2025,4,8);
INSERT INTO "fio_juvenile" VALUES ('FC25001569','2025-04-11 03:25','178055','Lopez, David','DANIEL TRACEY','NULL','DORCHESTER','MA','02124','NULL','Encountered','Reasonable Suspicion','NULL','NULL','NULL',NULL,'NULL','NULL','NULL',NULL,'Body Worn Camera, Juvenile','About 3:25 PM on Friday, April 11th, 2025, Officer Lopez and Colon while assigned to the H103D were flagged down by Henderson K-12 school staff and security for a possible fight. Officers were informedXXX was involved in a fight, along with two other individuals. Officers attempted to stop and speak with XXXwho ignored Officers and continued to walk. Officers were also informed by a parent of another child that XXXwas throwing hard items at her vehicle. Officers observed XXXwith a rock in his hand and Officers ordered XXXto put the rock down to which he did. Officers made contact with XXXwho was physically and verbally resistant by pushing Officers, not answering questions and trying to walk away from Officers. Officers received information from school staff on XXXand XXXguardian information.',NULL,NULL,NULL,'2025-04-11','03:25',2025,4,11);
INSERT INTO "fio_juvenile" VALUES ('FC25001679','2025-04-16 01:07','127036','Madden, Joseph','MICHAEL POWERS','HANCOCK ST','DORCHESTER','MA','02122','0','Encountered','Encounter','NULL','NULL','NULL',NULL,'NULL','NULL','NULL',NULL,'Juvenile, Body Worn Camera, Warrant Arrest','R/c for Investigate Child at XXXHancock St., Dorchester  Identified as XXX after given multiple fake names.  Caller stated he had been sleeping on the 2nd floor hallway for the last few days.  Arrested on four (4) warrants:  -Suff Cty Juvenile Court and Middlesex Juvenile Courts for Armed Robbery; ABDW; property offenses; Resisting Arrest  Had also been reported missing.  FIOd to associate with area  H104A (Madden/Mitchell)',NULL,NULL,NULL,'2025-04-16','01:07',2025,4,16);
INSERT INTO "fio_juvenile" VALUES ('FC25001767','2025-04-19 23:26','128383','O''CONNOR, MATTHEW','JAMES MOORE','WESTVIEW ST','DORCHESTER','MA','02124','NULL','Stopped','Intel','NULL','NULL','NULL',NULL,'NULL','NULL','NULL',NULL,'Gang, Juvenile, Gun','Officers conducted a subject stop in the rear courtyard of the Franklin Field Housing Development abutting XXXWestview Way, which resulted in the recovery of an illegal firearm.   Present in the group of juveniles which were standing in the area of the firearm and distanced themselves from the firearm upon Officers arrival is as follows:   XXX/ open firearm violations)XXX/ open firearm violations)  XXX (open armed robberyXXX  All parties made statements about associating with XXX   Officers were able to document the clothing of all parties on scene, and investigation is on-going by B3 Detectives.   CG03F (O''Connor & Griffiths) CK01F (Coyne, Turner, McCarty, Layden)  C421F (Rodriguez)',NULL,NULL,NULL,'2025-04-19','23:26',2025,4,19);
INSERT INTO "fio_juvenile" VALUES ('FC25001788','2025-04-22 13:50','126514','SCHAIN, RYAN','KEVIN MCCLAY','CENTRE ST','JAMAICA PLAIN','MA','02130','NULL','Stopped','Probable Cause','NULL','NULL','OTHER: RED',NULL,'Red',NULL,'Moped',NULL,'Juvenile','YVSF intel - VK23  Officers observed a red moped occupied by two young males drive out of the Heath Street housing development onto Centre Street. Officers noted the rear passenger did not have a helmet on, and further noted the moped did not have a license plate or registration sticker. Officers observed the moped pull up to Evelyn''s Market at XXXCentre and observed the operator exit the moped and go inside. Once the driver was off the moped, Officers successfully stopped it without incident. The operator was identified as XXX (open firearm case), and the passenger was identified as XXX (open firearm case). Both males have previous incidents withXXX, who is currently wanted for a shooting incident on B2.   XXXand XXXwere wearing heavy winter coats, despite a 70+ degree air temperature. Given the fact that recent gun violence within and coming out of the Heath Street development has been done by young males on scooters, the fact that both males were overdressed for the weather, along with their open firearm cases and associations with a male wanted for a recent shooting, both were frisked for weapons with negative results.  A check of the moped''s VIN # XXXrevealed it was not reported stolen. Both XXXand XXXwere FIO''d and released.',NULL,NULL,NULL,'2025-04-22','13:50',2025,4,22);
INSERT INTO "fio_juvenile" VALUES ('FC25001801','2025-04-22 18:00','162964','Ostholthoff, Tyler','CHARLES CELLUCCI','O''REILLY WAY','CHARLESTOWN','MA','02129','0','Stopped','Intel','NULL','MA','Accord',NULL,'GRA','Sedan','Passenger Car/ Automobile',NULL,'Gang, Juvenile, Body Worn Camera','At 6 PM on 4/22/25, Officers stopped a gray, 2010 Honda Accord (MA reg. XXXatXXX O''Reilly Way for VALs (no inspection sticker) and identified the driver to be XXX(DOB XX/XX/XXXX- no BOP) and passenger to beXXX (DOB XX/XX/XXXX- no BOP).   XXXimmediately facetimed (a different) XXX(DOB XX/XX/XXXXwho THIS XXXstated he was "going to hang" with. Both XXXwent to Charlestown HS together. Officers then observed XXX(DOB XX/XX/XXXXjoin the FaceTime, at which point XXXstated, "I''m coming." XXXhas been present for several violent incidents around the Bunker Hill development and is known to XXX   During this time, XXXwas refusing to provide to his information (no seat belt), claiming only that his name was XXXOfficers observed XXXto be extremely nervous (heavy breathing and fast heart rate). After several minutes XXXandXXXarrived on scene. THIS XXXconsented to a pat frisk (parties removed), yielding negative results for weapons.   All subjects were eventually cordial and cooperative with Officers.   XXXXXXdrove the vehicle away.   FIOE''d to associate THIS XXXand XXXto Charlestown.  Ostholthoff/Rooney/Entwhistle (AK02F)',NULL,NULL,NULL,'2025-04-22','18:00',2025,4,22);
INSERT INTO "fio_juvenile" VALUES ('FC25001847','2025-04-23 19:30','151766','Coppinger, Joseph','JAMES MOORE','MORTON ST','DORCHESTER','MA','02124','NULL','Stopped','Reasonable Suspicion','NULL','NULL','NULL',NULL,'NULL','NULL','NULL',NULL,'Body Worn Camera, Juvenile','Subject Stop ofXXXXX/XX/XXXXat XXXMorton Street.  The weather on this date was approximately 70 Degrees Fahrenheit.  Officers observed an individual wearing a black winter jacket, black sweatshirt, and a black shiesty style ski mask walking on Morton Street towards Norfolk Street with his hands in his pockets firmly grasping the inner layer of clothing. The individual took note of officers and continued to look over his shoulder keeping an eye on the officers as the travelled down Morton Street. Officers conducted a U-turn and observed this individual continuing in the direction of officers. As officers exited the cruiser and approached the individual they observed a large bulge in his front right pocket.   Officers stopped the individual and conducted a pat frisk of his person which yielded negative results.   This individual was identified asXXX(DOB: XX/XX/XXXX FIO''D and released  C111F (Coppinger/Cox)',NULL,NULL,NULL,'2025-04-23','19:30',2025,4,23);
INSERT INTO "fio_juvenile" VALUES ('FC25002011','2025-05-01 18:30','153099','FULLAM, PATRICK','CARL BLANDO','FREDERICK ST','SOUTH BOSTON','MA','02127','NULL','Stopped','Reasonable Suspicion','NULL','NULL','NULL',NULL,'NULL','NULL','NULL',NULL,'Juvenile, Body Worn Camera','Officers responded to a radio call for B&E atXXXXXSt. Caller described two young, thin build black males, one wearing a red hoodie and one wearing a blue hoodie outside ofXXXXXattempting to climb in the second story window. Officers observed XXXXX and XXX outside the entrance toXXXXXwearing red and blue hoodies respectively. XXXstated they were just horsing around jumping from one railing to another. Officers did not observe any signs of forced entry to any units. Both parties were advised they were trespassing on BHA property and released from scene.',NULL,NULL,NULL,'2025-05-01','18:30',2025,5,1);
INSERT INTO "fio_juvenile" VALUES ('FC25002023','2025-05-02 00:49','168362','O''Neill, Matthew','JAMES MOORE','RIVER ST','MATTAPAN','MA','02126','NULL','Stopped','Probable Cause','NULL','NULL','NULL',NULL,'NULL','NULL','NULL',NULL,'Gun, Body Worn Camera, Juvenile','1:00am 05/02/25  Radio call for two males Trespassing at XXXRiver Street, Boston.  Officers observed two males exiting the building matching the description given by the caller.  Suspect #1 - XXX XX/XX/XXXX- F/A''s, Armed Robbery masked, B&E on BOP. After a brief foot chase XXX discarded a firearm from his waistband and was placed under arrest.  Suspect #2 made good on his escape but was later positively identified through body worn camera asXXX XX/XX/XXXX- F/A''s, B&E, Larceny of M/V on BOP.  C113A (O''Neill/Williamson)',NULL,NULL,NULL,'2025-05-02','00:49',2025,5,2);
INSERT INTO "fio_juvenile" VALUES ('FC25002041','2025-05-02 19:16','168389','Byrnes, Patrick','TIMOTHY COUGHLIN','NULL','BOSTON','MA','02128','NULL','Stopped','Reasonable Suspicion','NULL','NULL','NULL',NULL,'NULL','NULL','NULL',NULL,'School, Juvenile, Body Worn Camera','Officers responded to R/C for "Person with a Gun" at Central Square and Liverpool Street in East Boston. Officers were informed via BPD Operations Channel 2 that 5 juveniles in a grey Nissan were shooting people with BB guns. Operations reported that the Nissan fled down Liverpool Street towards Maverick Square.  Officers located MA XXX(grey 2016 Nissan Rogue SUV) occupied by 5 juvenile aged parties at the intersection of Maverick and Border Street. Upon approaching the vehicle, officers observed several Nerf "Gel Fire" blasters in plain view. Officers gave exit orders and began removing the Nissan''s occupants. They were identified as-  XXX (DOB XX/XX/XXXXDriverXXX(DOB XX/XX/XXXXFront Passenger Side XXX(DOB XX/XX/XXXXRear Driver Side XXX (DOB XX/XX/XXXXRear Middle SeaXXXDOB XX/XX/XXXXRear Passenger Side Seat  All parties were pat frisked with negative findings and placed into handcuffs. Officers explained to the parties that they were being detained. After the parties were removed, officers observed 2 bottles of "Orbeez" gel balls sitting in plain view. An additional 2 bags of "Orbeez" gel balls were located in the Nissan''s center console. A CJIS inquiry showed all parties to be negative for warrants.   Officers requested that BPD Operations Channel 2 contact the calling party to determine whether there was an identified victim. Operations made contact with the calling party, who stated that they were hit by a gel ball but did not wish to talk to police or have any further involvement.   Officers determined that all involved parties, with the exception of XXXwere juveniles. XXXmother, the registered owner of the Nissan, took custody of the Nissan and stated that he no longer had permission to operate it. XXXwas released from the scene. All other parties were transported back to District A7 where they were released to their respective parents  FIOE to associate parties with each other and with "Orbeez" related incidents, which usually pick up in the warmer weather.  -G101F (Byrnes, P./Agudelo)',NULL,NULL,NULL,'2025-05-02','19:16',2025,5,2);
